Title,Link,Date
"Iuran BPJS Naik, Sudah 372.924 Peserta Turun Kelas",https://www.cnbcindonesia.com/news/20200106163256-4-128029/iuran-bpjs-naik-sudah-372924-peserta-turun-kelas,4 tahun yang lalu
"Utang BPJS Kesehatan Rp 14 T, Yakin Bisa Lunas di 2020?",https://www.cnbcindonesia.com/news/20200106153415-4-127985/utang-bpjs-kesehatan-rp-14-t-yakin-bisa-lunas-di-2020,4 tahun yang lalu
"Awal Tahun, Sah! Iuran BPJS Kesehatan Naik",https://www.cnbcindonesia.com/news/20200106154141-8-127999/awal-tahun-sah-iuran-bpjs-kesehatan-naik,4 tahun yang lalu
"Peserta BPJS Mandiri Dapat Subsidi dari Pemerintah, Caranya?",https://www.cnbcindonesia.com/news/20200106142647-4-127967/peserta-bpjs-mandiri-dapat-subsidi-dari-pemerintah-caranya,4 tahun yang lalu
Fahmi Idris: Perpres Penyesuaian Iuran BPJS Akan Diberlakukan,https://www.cnbcindonesia.com/news/20191128104159-8-118599/fahmi-idris-perpres-penyesuaian-iuran-bpjs-akan-diberlakukan,4 tahun yang lalu
Sri Mulyani Hingga Terawan Merapat ke Kantor Menko Bahas BPJS,https://www.cnbcindonesia.com/news/20200106121423-4-127906/sri-mulyani-hingga-terawan-merapat-ke-kantor-menko-bahas-bpjs,4 tahun yang lalu
Kenaikan Iuran BPJS Kesehatan Hingga Dua Kali Lipat,https://www.cnbcindonesia.com/market/20200102184358-19-127216/kenaikan-iuran-bpjs-kesehatan-hingga-dua-kali-lipat,4 tahun yang lalu
"Rokok dan Iuran BPJS Naik, Waspada Inflasi Februari 2020",https://www.cnbcindonesia.com/news/20200102132949-4-127103/rokok-dan-iuran-bpjs-naik-waspada-inflasi-februari-2020,4 tahun yang lalu
Kenaikan Iuran BPJS Dinilai Positif Bagi Emiten Farmasi,https://www.cnbcindonesia.com/market/20200102114258-19-127068/kenaikan-iuran-bpjs-dinilai-positif-bagi-emiten-farmasi,4 tahun yang lalu
"Iuran Naik Double, Kenapa Sih Harus Bayar BPJS Tiap Bulan?",https://www.cnbcindonesia.com/news/20200102091952-4-127016/iuran-naik-double-kenapa-sih-harus-bayar-bpjs-tiap-bulan,4 tahun yang lalu
Berlaku Nih! Iuran BPJS Kesehatan Resmi Naik Dua Kali Lipat,https://www.cnbcindonesia.com/news/20200102091413-4-127015/berlaku-nih-iuran-bpjs-kesehatan-resmi-naik-dua-kali-lipat,4 tahun yang lalu
"Awal Tahun Berat, Iuran BPJS Kesehatan Sudah Tarif Baru Lho!",https://www.cnbcindonesia.com/news/20200101190950-4-126977/awal-tahun-berat-iuran-bpjs-kesehatan-sudah-tarif-baru-lho,4 tahun yang lalu
"BPJS Akui Berutang ke Muhammadiyah, tapi Bukan Rp 1,2 T",https://www.cnbcindonesia.com/news/20191231144505-4-126718/bpjs-akui-berutang-ke-muhammadiyah-tapi-bukan-rp-12-t,4 tahun yang lalu
"Wah BPJS Kesehatan Juga Utang Rp 1,2 T Kepada Muhammadiyah",https://www.cnbcindonesia.com/market/20191230151633-19-126491/wah-bpjs-kesehatan-juga-utang-rp-12-t-kepada-muhammadiyah,4 tahun yang lalu
"Waduh, BPJS Kesehatan Ngutang Rp 1,2 T ke Muhammadiyah?",https://www.cnbcindonesia.com/news/20191230101911-4-126399/waduh-bpjs-kesehatan-ngutang-rp-12-t-ke-muhammadiyah,4 tahun yang lalu
"Ini Deretan Tarif yang Naik di 2020: Tol, BPJS, Parkir, Damri",https://www.cnbcindonesia.com/news/20191229211335-4-126361/ini-deretan-tarif-yang-naik-di-2020-tol-bpjs-parkir-damri,4 tahun yang lalu
"Maaf, 'Lowongan' Buzzer untuk BPJS Kesehatan Dibatalkan!",https://www.cnbcindonesia.com/news/20191226104653-4-125653/maaf-lowongan-buzzer-untuk-bpjs-kesehatan-dibatalkan,4 tahun yang lalu
"Beda dengan BP Jamsostek, Jokowi Naikkan Iuran BPJS Kesehatan",https://www.cnbcindonesia.com/news/20191226095313-4-125634/beda-dengan-bp-jamsostek-jokowi-naikkan-iuran-bpjs-kesehatan,4 tahun yang lalu
"Ssst.. BPJS Kesehatan Cari Buzzer Sosmed Nih, Siapa Berminat?",https://www.cnbcindonesia.com/news/20191225082956-4-125503/ssst-bpjs-kesehatan-cari-buzzer-sosmed-nih-siapa-berminat,4 tahun yang lalu
"BPJS Kesehatan Punya Layanan Jemput Bola, Siap Nagih?",https://www.cnbcindonesia.com/news/20191218155549-4-124154/bpjs-kesehatan-punya-layanan-jemput-bola-siap-nagih,4 tahun yang lalu
"Hanya Meninggal, Cara untuk Berhenti dari BPJS Kesehatan!",https://www.cnbcindonesia.com/news/20191218100459-4-123987/hanya-meninggal-cara-untuk-berhenti-dari-bpjs-kesehatan,4 tahun yang lalu
"Cara Berhenti dari Kepesertaan BPJS Kesehatan, Bisa?",https://www.cnbcindonesia.com/news/20191217131653-4-123718/cara-berhenti-dari-kepesertaan-bpjs-kesehatan-bisa,4 tahun yang lalu
"Iuran Naik, Yang Mau Turun Kelas BPJS Ada Batas Waktunya Lho!",https://www.cnbcindonesia.com/news/20191216095808-4-123296/iuran-naik-yang-mau-turun-kelas-bpjs-ada-batas-waktunya-lho,4 tahun yang lalu
"Iuran BPJS Naik Tahun Depan, Ini 3 Skema Alternatif Terawan",https://www.cnbcindonesia.com/news/20191215151219-4-123235/iuran-bpjs-naik-tahun-depan-ini-3-skema-alternatif-terawan,4 tahun yang lalu
Kalian Setuju Uang BPJS Rp 100 T Buat Program Rumah Jokowi?,https://www.cnbcindonesia.com/news/20191214093226-4-123078/kalian-setuju-uang-bpjs-rp-100-t-buat-program-rumah-jokowi,4 tahun yang lalu
"Suntikan Rp5 T ke BPJS Cair Menetes, Distributor Obat Teriak",https://www.cnbcindonesia.com/news/20191213193528-4-123046/suntikan-rp5-t-ke-bpjs-cair-menetes-distributor-obat-teriak,4 tahun yang lalu
"Gegara Utang BPJS, Uang Perusahaan Farmasi Digantung Setahun",https://www.cnbcindonesia.com/news/20191213182923-4-123004/gegara-utang-bpjs-uang-perusahaan-farmasi-digantung-setahun,4 tahun yang lalu
1 Januari 2020 Iuran BPJS Sudah Pasti Naik Double! Bersiap...,https://www.cnbcindonesia.com/news/20191213133741-4-122869/1-januari-2020-iuran-bpjs-sudah-pasti-naik-double-bersiap,4 tahun yang lalu
Pengusaha Dorong Uang Triliunan BPJS untuk Program Rumah,https://www.cnbcindonesia.com/news/20191212185545-4-122691/pengusaha-dorong-uang-triliunan-bpjs-untuk-program-rumah,4 tahun yang lalu
Gegara Utang BPJS: Toko Obat Sampai RS di Ujung Kebangkrutan,https://www.cnbcindonesia.com/news/20191213125932-4-122858/gegara-utang-bpjs-toko-obat-sampai-rs-di-ujung-kebangkrutan,4 tahun yang lalu
"Kacau Balau! BPJS Utang Rp 6 T, Tukang Obat Bisa Gulung Tikar",https://www.cnbcindonesia.com/news/20191213114128-4-122811/kacau-balau-bpjs-utang-rp-6-t-tukang-obat-bisa-gulung-tikar,4 tahun yang lalu
"Solusi Subsidi buat BPJS Kelas III ala Terawan, Efektifkah?",https://www.cnbcindonesia.com/news/20191213093221-4-122758/solusi-subsidi-buat-bpjs-kelas-iii-ala-terawan-efektifkah,4 tahun yang lalu
Kemenkeu Cairkan Dana Sebesar 13 Triliun untuk BPJS,https://www.cnbcindonesia.com/news/20191212191009-8-122696/kemenkeu-cairkan-dana-sebesar-13-triliun-untuk-bpjs,4 tahun yang lalu
"Ada Masyarakat Sudah Bayar BPJS Tarif Baru, DPR Bingung",https://www.cnbcindonesia.com/news/20191212192521-4-122699/ada-masyarakat-sudah-bayar-bpjs-tarif-baru-dpr-bingung,4 tahun yang lalu
Pemerintah Suntik BPJS Kesehatan Hingga Kondisi Pabrik Boeing,https://www.cnbcindonesia.com/news/20191212185612-8-122693/pemerintah-suntik-bpjs-kesehatan-hingga-kondisi-pabrik-boeing,4 tahun yang lalu
"DPR Legowo, Iuran BPJS Kesehatan Jadi Naik Dua Kali Lipat!",https://www.cnbcindonesia.com/news/20191212175547-4-122682/dpr-legowo-iuran-bpjs-kesehatan-jadi-naik-dua-kali-lipat,4 tahun yang lalu
"Kenaikan Iuran BPJS Wajib, Terawan Beri 3 Skema Alternatif",https://www.cnbcindonesia.com/news/20191212163142-4-122602/kenaikan-iuran-bpjs-wajib-terawan-beri-3-skema-alternatif,4 tahun yang lalu
Sri Mulyani Telah Cairkan Rp 13 T untuk BPJS Kesehatan,https://www.cnbcindonesia.com/news/20191212123755-4-122500/sri-mulyani-telah-cairkan-rp-13-t-untuk-bpjs-kesehatan,4 tahun yang lalu
"Uang BPJS Rp 100 T Mau Dipakai Program Rumah Jokowi, Setuju?",https://www.cnbcindonesia.com/news/20191211154703-4-122249/uang-bpjs-rp-100-t-mau-dipakai-program-rumah-jokowi-setuju,4 tahun yang lalu
"Rp 100 T Dana BPJS-TK Bisa Gairahkan Properti, Tapi...",https://www.cnbcindonesia.com/news/20191210185826-4-122009/rp-100-t-dana-bpjs-tk-bisa-gairahkan-properti-tapi,4 tahun yang lalu
Jokowi: dr Terawan Tahu Jurus Atasi Defisit BPJS Kesehatan,https://www.cnbcindonesia.com/tech/20191206103351-37-120859/jokowi-dr-terawan-tahu-jurus-atasi-defisit-bpjs-kesehatan,4 tahun yang lalu
Ketika dr Terawan Ungkap Modus-modus yang Bikin BPJS Tekor,https://www.cnbcindonesia.com/news/20191202120830-16-119532/ketika-dr-terawan-ungkap-modus-modus-yang-bikin-bpjs-tekor,4 tahun yang lalu
Panas! Terawan Vs Ikatan Dokter Soal BPJS yang Bikin Tekor,https://www.cnbcindonesia.com/news/20191130073843-4-119255/panas-terawan-vs-ikatan-dokter-soal-bpjs-yang-bikin-tekor,4 tahun yang lalu
"Terawan Anggap Tindakan Dokter Bikin Tekor BPJS, Ini Kata IDI",https://www.cnbcindonesia.com/news/20191129164050-4-119135/terawan-anggap-tindakan-dokter-bikin-tekor-bpjs-ini-kata-idi,4 tahun yang lalu
"Jokowi Sidak Layanan BPJS Kesehatan di RSUD Subang, Hasilnya?",https://www.cnbcindonesia.com/news/20191129130827-4-119037/jokowi-sidak-layanan-bpjs-kesehatan-di-rsud-subang-hasilnya,4 tahun yang lalu
"Tolak Kenaikan Iuran BPJS, Massa Geruduk Kantor dr Terawan",https://www.cnbcindonesia.com/news/20191128113808-7-118652/tolak-kenaikan-iuran-bpjs-massa-geruduk-kantor-dr-terawan,4 tahun yang lalu
Inilah Modus Dokter yang Bikin BPJS Tekor Versi dr Terawan,https://www.cnbcindonesia.com/news/20191128105226-4-118608/inilah-modus-dokter-yang-bikin-bpjs-tekor-versi-dr-terawan,4 tahun yang lalu
Pasien Cuci Darah BPJS Kesehatan Tinggal Pakai Finger Print,https://www.cnbcindonesia.com/news/20191127194731-4-118516/pasien-cuci-darah-bpjs-kesehatan-tinggal-pakai-finger-print,4 tahun yang lalu
Saat dr Terawan Ungkap Modus Dokter yang Bikin BPJS Tekor,https://www.cnbcindonesia.com/news/20191127123841-4-118361/saat-dr-terawan-ungkap-modus-dokter-yang-bikin-bpjs-tekor,4 tahun yang lalu
Ombudsman: Kenaikan Iuran BPJS Kesehatan Sangat Riskan,https://www.cnbcindonesia.com/news/20191126105137-8-118000/ombudsman-kenaikan-iuran-bpjs-kesehatan-sangat-riskan,4 tahun yang lalu
Upaya RS Jaga Mutu Layanan di Tengah Tunggakan BPJS Kesehatan,https://www.cnbcindonesia.com/news/20191125122544-8-117703/upaya-rs-jaga-mutu-layanan-di-tengah-tunggakan-bpjs-kesehatan,4 tahun yang lalu
"Lagi, Pemerintah Akan Kucurkan Rp 14 T ke BPJS Kesehatan",https://www.cnbcindonesia.com/news/20191125110142-8-117670/lagi-pemerintah-akan-kucurkan-rp-14-t-ke-bpjs-kesehatan,4 tahun yang lalu
Rumah Sakit Harap BPJS Kesehatan Bayar Tagihan Tepat Waktu,https://www.cnbcindonesia.com/news/20191125110412-8-117671/rumah-sakit-harap-bpjs-kesehatan-bayar-tagihan-tepat-waktu,4 tahun yang lalu
Alodokter: Startup Kesehatan Siap Dukung BPJS Kesehatan,https://www.cnbcindonesia.com/tech/20191125083129-39-117629/alodokter-startup-kesehatan-siap-dukung-bpjs-kesehatan,4 tahun yang lalu
"Jokowi Naikkan Iuran BPJS, Orang-Orang Ini Gugat ke MA",https://www.cnbcindonesia.com/news/20191123135305-4-117459/jokowi-naikkan-iuran-bpjs-orang-orang-ini-gugat-ke-ma,4 tahun yang lalu
Presiden Jokowi Kembali Sentil Kinerja BPJS Kesehatan,https://www.cnbcindonesia.com/news/20191122153819-8-117283/presiden-jokowi-kembali-sentil-kinerja-bpjs-kesehatan,4 tahun yang lalu
"Tagihan Operasi Jantung Rp 10,5 T, Terawan Evaluasi BPJS",https://www.cnbcindonesia.com/news/20191122123045-4-117185/tagihan-operasi-jantung-rp-105-t-terawan-evaluasi-bpjs,4 tahun yang lalu
Menkes Terawan Punya 'Jurus' Alternatif Tekan Defisit BPJS,https://www.cnbcindonesia.com/news/20191121201358-4-117075/menkes-terawan-punya-jurus-alternatif-tekan-defisit-bpjs,4 tahun yang lalu
"Lagi dan Lagi, Jokowi Minta Tata Kelola BPJS Diperbaiki",https://www.cnbcindonesia.com/news/20191121155305-4-116965/lagi-dan-lagi-jokowi-minta-tata-kelola-bpjs-diperbaiki,4 tahun yang lalu
"Pak Jokowi, Kartu Prakerja Jangan Ulangi Kesalahan BPJS!",https://www.cnbcindonesia.com/news/20191120214024-4-116744/pak-jokowi-kartu-prakerja-jangan-ulangi-kesalahan-bpjs,4 tahun yang lalu
"Lagi, Pemerintah Akan Kucurkan Rp 14 T ke BPJS Kesehatan",https://www.cnbcindonesia.com/news/20191120110314-8-116527/lagi-pemerintah-akan-kucurkan-rp-14-t-ke-bpjs-kesehatan,4 tahun yang lalu
"Iuran Naik, BPJS Yakin 2021 Keuangan Surplus!",https://www.cnbcindonesia.com/news/20191120102256-4-116505/iuran-naik-bpjs-yakin-2021-keuangan-surplus,4 tahun yang lalu
"Cair Rp 9,3 T, BPJS Kesehatan Segera Bayar Tunggakan ke RS",https://www.cnbcindonesia.com/news/20191120080115-8-116473/cair-rp-93-t-bpjs-kesehatan-segera-bayar-tunggakan-ke-rs,4 tahun yang lalu
BPJS Kesehatan Mulai Bayar Cicilan Utang ke RS Pekan Ini,https://www.cnbcindonesia.com/news/20191120074356-4-116469/bpjs-kesehatan-mulai-bayar-cicilan-utang-ke-rs-pekan-ini,4 tahun yang lalu
Janji Bos BPJS: 2020 Tak Minta Suntikan Dana & 2021 Surplus,https://www.cnbcindonesia.com/news/20191119201133-4-116451/janji-bos-bpjs-2020-tak-minta-suntikan-dana-2021-surplus,4 tahun yang lalu
"Bos BPJS Janji Bayar Utang ke RS, Tapi....",https://www.cnbcindonesia.com/news/20191119191226-4-116442/bos-bpjs-janji-bayar-utang-ke-rs-tapi,4 tahun yang lalu
Komitmen BPJS Kesehatan-PERSI Tingkatkan Kualitas Layanan RS,https://www.cnbcindonesia.com/news/20191119164516-8-116380/komitmen-bpjs-kesehatan-persi-tingkatkan-kualitas-layanan-rs,4 tahun yang lalu
"Atasi Defisit, BPJS Fokus Kejar Pengemplang Iuran Mandiri",https://www.cnbcindonesia.com/news/20191118073959-4-115892/atasi-defisit-bpjs-fokus-kejar-pengemplang-iuran-mandiri,4 tahun yang lalu
"Diminta Jokowi, Ini Cara BPJS Kejar Pengemplang Iuran",https://www.cnbcindonesia.com/news/20191117210720-4-115884/diminta-jokowi-ini-cara-bpjs-kejar-pengemplang-iuran,4 tahun yang lalu
BPJS: Cuma 57% Peserta Mandiri yang Rajin Bayar Iuran,https://www.cnbcindonesia.com/news/20191117204151-4-115883/bpjs-cuma-57-peserta-mandiri-yang-rajin-bayar-iuran,4 tahun yang lalu
"Menkes Terawan Minta Iuran Tak Naik, Ini Kata BPJS",https://www.cnbcindonesia.com/news/20191117193320-4-115878/menkes-terawan-minta-iuran-tak-naik-ini-kata-bpjs,4 tahun yang lalu
"Sebut BPJS Salah Kelola, Jokowi Minta Penagihan Digeber",https://www.cnbcindonesia.com/news/20191115152831-4-115621/sebut-bpjs-salah-kelola-jokowi-minta-penagihan-digeber,4 tahun yang lalu
"BPJS Masih Defisit, Jokowi Minta Penagihan Digeber",https://www.cnbcindonesia.com/news/20191115151755-4-115608/bpjs-masih-defisit-jokowi-minta-penagihan-digeber,4 tahun yang lalu
Kalbe Farma Pastikan Utang BPJS Tidak Ganggu Layanan Obat,https://www.cnbcindonesia.com/market/20191114113531-19-115207/kalbe-farma-pastikan-utang-bpjs-tidak-ganggu-layanan-obat,4 tahun yang lalu
"Luhut Sebut SoftBank & Ping An Mau Masuk RI, Bantu BPJS?",https://www.cnbcindonesia.com/tech/20191113135956-37-114952/luhut-sebut-softbank-ping-an-mau-masuk-ri-bantu-bpjs,4 tahun yang lalu
Ketua MPR Bamsoet Minta Kenaikan Iuran BPJS Kelas III Batal!,https://www.cnbcindonesia.com/news/20191113134658-4-114940/ketua-mpr-bamsoet-minta-kenaikan-iuran-bpjs-kelas-iii-batal,4 tahun yang lalu
Harapan Netizen: Ahok Jadi Bos BPJS Sampai Bank Mandiri,https://www.cnbcindonesia.com/tech/20191113121453-37-114910/harapan-netizen-ahok-jadi-bos-bpjs-sampai-bank-mandiri,4 tahun yang lalu
Benarkah Rakyat Tercekik Gara-gara Tanggung Iuran BPJS?,https://www.cnbcindonesia.com/news/20191113101558-4-114848/benarkah-rakyat-tercekik-gara-gara-tanggung-iuran-bpjs,4 tahun yang lalu
Sri Mulyani & Para Donatur Turun Tangan Bereskan Utang BPJS,https://www.cnbcindonesia.com/news/20191113084328-4-114819/sri-mulyani-para-donatur-turun-tangan-bereskan-utang-bpjs,4 tahun yang lalu
Utang Fantastis BPJS ke Semua Rumah Sakit Tembus Rp 17 T!,https://www.cnbcindonesia.com/news/20191113081321-4-114810/utang-fantastis-bpjs-ke-semua-rumah-sakit-tembus-rp-17-t,4 tahun yang lalu
Ini Aturan Khusus Sri Mulyani Jika BPJS Tengah Sulit,https://www.cnbcindonesia.com/news/20191113074159-4-114803/ini-aturan-khusus-sri-mulyani-jika-bpjs-tengah-sulit,4 tahun yang lalu
"Wow! Bakal Ada Gerakan Sosial Bantu BPJS, Anda Minat?",https://www.cnbcindonesia.com/news/20191112191741-4-114756/wow-bakal-ada-gerakan-sosial-bantu-bpjs-anda-minat,4 tahun yang lalu
Fantastis! Utang BPJS ke Seluruh RS di Indonesia Capai 17 T,https://www.cnbcindonesia.com/news/20191112185554-4-114745/fantastis-utang-bpjs-ke-seluruh-rs-di-indonesia-capai-17-t,4 tahun yang lalu
PKS-PKB Tolak Kenaikan Iuran BPJS: Masyarakat Tercekik!,https://www.cnbcindonesia.com/news/20191112154232-4-114660/pks-pkb-tolak-kenaikan-iuran-bpjs-masyarakat-tercekik,4 tahun yang lalu
"Jokowi Sudah Teken, BPJS Kesehatan Itu Sudah Pasti Naik!",https://www.cnbcindonesia.com/news/20191112092640-4-114517/jokowi-sudah-teken-bpjs-kesehatan-itu-sudah-pasti-naik,4 tahun yang lalu
Cinta dr Terawan & Ide Batalkan Iuran BPJS Kesehatan Kelas 3,https://www.cnbcindonesia.com/news/20191112070926-4-114488/cinta-dr-terawan-ide-batalkan-iuran-bpjs-kesehatan-kelas-3,4 tahun yang lalu
Ini Dia Aturan Khusus dari Sri Mulyani Jika BPJS Kesulitan,https://www.cnbcindonesia.com/news/20191112070257-4-114487/ini-dia-aturan-khusus-dari-sri-mulyani-jika-bpjs-kesulitan,4 tahun yang lalu
"Iuran BPJS Kesehatan Naik, Ini Harapan Provider Rumah Sakit",https://www.cnbcindonesia.com/market/20191111172820-19-114407/iuran-bpjs-kesehatan-naik-ini-harapan-provider-rumah-sakit,4 tahun yang lalu
Polemik Iuran BPJS Kesehatan Naik,https://www.cnbcindonesia.com/news/20191111163629-8-114396/polemik-iuran-bpjs-kesehatan-naik,4 tahun yang lalu
"Yah! Ide dr Terawan Soal Iuran BPJS Kelas III, Mentok?",https://www.cnbcindonesia.com/news/20191111175054-4-114420/yah-ide-dr-terawan-soal-iuran-bpjs-kelas-iii-mentok,4 tahun yang lalu
"Live! Kisruh Iuran BPJS, Begini Prospek Bisnis Rumah Sakit",https://www.cnbcindonesia.com/market/20191111152632-17-114348/live-kisruh-iuran-bpjs-begini-prospek-bisnis-rumah-sakit,4 tahun yang lalu
Sri Mulyani Janji Segera Bayarkan Iuran BPJS Bagi PNS,https://www.cnbcindonesia.com/news/20191111135236-4-114298/sri-mulyani-janji-segera-bayarkan-iuran-bpjs-bagi-pns,4 tahun yang lalu
Sri Mulyani Ubah Aturan Khusus Saat BPJS Kesulitan Keuangan,https://www.cnbcindonesia.com/news/20191111112836-4-114217/sri-mulyani-ubah-aturan-khusus-saat-bpjs-kesulitan-keuangan,4 tahun yang lalu
"dr Terawan Ingin BPJS Kelas III Tak Naik, Siap Turun Kelas?",https://www.cnbcindonesia.com/news/20191111094151-4-114163/dr-terawan-ingin-bpjs-kelas-iii-tak-naik-siap-turun-kelas,4 tahun yang lalu
Ini Alasan Menkes Upayakan Subsidi BPJS Kesehatan Kelas III,https://www.cnbcindonesia.com/news/20191108175439-8-113873/ini-alasan-menkes-upayakan-subsidi-bpjs-kesehatan-kelas-iii,4 tahun yang lalu
"Minta Iuran BPJS Kelas III Tetap, Terawan: Saya Cinta Rakyat!",https://www.cnbcindonesia.com/news/20191108153721-4-113809/minta-iuran-bpjs-kelas-iii-tetap-terawan-saya-cinta-rakyat,4 tahun yang lalu
Top! dr Terawan Usul Iuran BPJS Kesehatan Kelas III Tak Naik,https://www.cnbcindonesia.com/news/20191108151925-4-113806/top-dr-terawan-usul-iuran-bpjs-kesehatan-kelas-iii-tak-naik,4 tahun yang lalu
"Tarif Tol Naik, BPJS Naik, Listrik Naik, Awas Rakyat Tercekik",https://www.cnbcindonesia.com/news/20191107161702-4-113530/tarif-tol-naik-bpjs-naik-listrik-naik-awas-rakyat-tercekik,4 tahun yang lalu
"Soal BPJS, Asosiasi Klinik: Sebenarnya Kami tidak Senang",https://www.cnbcindonesia.com/news/20191107173742-4-113546/soal-bpjs-asosiasi-klinik-sebenarnya-kami-tidak-senang,4 tahun yang lalu
Bos BPJS Diprotes Karena Kaitkan Iuran dengan Pulsa,https://www.cnbcindonesia.com/news/20191107120953-4-113397/bos-bpjs-diprotes-karena-kaitkan-iuran-dengan-pulsa,4 tahun yang lalu
"Iuran BPJS Kesehatan Sudah, Nah Ini Tarif Tol yang Siap Naik!",https://www.cnbcindonesia.com/news/20191107093850-4-113333/iuran-bpjs-kesehatan-sudah-nah-ini-tarif-tol-yang-siap-naik,4 tahun yang lalu
DPR Protes Bos BPJS Soal Bayar Iuran Lebih Murah dari Pulsa!,https://www.cnbcindonesia.com/news/20191106162607-4-113190/dpr-protes-bos-bpjs-soal-bayar-iuran-lebih-murah-dari-pulsa,4 tahun yang lalu
Anggota DPR: BPJS Kesehatan Utang Rp 300 M ke RS Muhammadiyah,https://www.cnbcindonesia.com/news/20191106161115-4-113185/anggota-dpr-bpjs-kesehatan-utang-rp-300-m-ke-rs-muhammadiyah,4 tahun yang lalu
"Menkes Terawan Bebaskan Peserta BPJS Turun Kelas, Ini Caranya",https://www.cnbcindonesia.com/news/20191106131122-4-113104/menkes-terawan-bebaskan-peserta-bpjs-turun-kelas-ini-caranya,4 tahun yang lalu
"Iuran BPJS Naik, Terawan: Kalau Mau Turun Kelas Silakan",https://www.cnbcindonesia.com/news/20191105214823-4-112956/iuran-bpjs-naik-terawan-kalau-mau-turun-kelas-silakan,4 tahun yang lalu
Dirut BPJS: Penurunan Kelas Tak Kurangi Kualitas Medik,https://www.cnbcindonesia.com/news/20191105214508-4-112954/dirut-bpjs-penurunan-kelas-tak-kurangi-kualitas-medik,4 tahun yang lalu
Suasana Layanan BPJS Kesehatan Usai Jokowi Naikkan Iuran 100%,https://www.cnbcindonesia.com/news/20191105140230-7-112816/suasana-layanan-bpjs-kesehatan-usai-jokowi-naikkan-iuran-100,4 tahun yang lalu
"Ramai Tagar #BoikotBPJS, Istana: Tidak ada yang Ditinggalkan",https://www.cnbcindonesia.com/news/20191105155231-4-112845/ramai-tagar-boikotbpjs-istana-tidak-ada-yang-ditinggalkan,4 tahun yang lalu
"Boikot BPJS Menggema, Gegara 'Nabung Goceng Per Hari'?",https://www.cnbcindonesia.com/news/20191104140757-4-112468/boikot-bpjs-menggema-gegara-nabung-goceng-per-hari,4 tahun yang lalu
"Nabung Goceng Sehari Demi BPJS Kesehatan, Ikhlas Nggak?",https://www.cnbcindonesia.com/news/20191104071321-4-112313/nabung-goceng-sehari-demi-bpjs-kesehatan-ikhlas-nggak,4 tahun yang lalu
"Iuran BPJS Kesehatan Naik, DPR Gelar RDP Selasa Depan",https://www.cnbcindonesia.com/news/20191103093840-4-112244/iuran-bpjs-kesehatan-naik-dpr-gelar-rdp-selasa-depan,4 tahun yang lalu
"Cair Bulan Ini, BPJS Kesehatan Diguyur Dana Talangan Rp 14 T",https://www.cnbcindonesia.com/news/20191102171935-4-112198/cair-bulan-ini-bpjs-kesehatan-diguyur-dana-talangan-rp-14-t,4 tahun yang lalu
(Lagi) Kemenkeu Cairkan Dana Talangan BPJS Kesehatan Rp 9 T,https://www.cnbcindonesia.com/news/20191102110733-4-112156/-lagi--kemenkeu-cairkan-dana-talangan-bpjs-kesehatan-rp-9-t,4 tahun yang lalu
"Iuran BPJS Kesehatan Naik Gan, Semangat Cari Uang yah!",https://www.cnbcindonesia.com/news/20191102084837-4-112149/iuran-bpjs-kesehatan-naik-gan-semangat-cari-uang-yah,4 tahun yang lalu
Streaming: dr Terawan Bicara Soal BPJS Hingga Program Kerja,https://www.cnbcindonesia.com/news/20191101202829-4-112135/streaming-dr-terawan-bicara-soal-bpjs-hingga-program-kerja,4 tahun yang lalu
Dirut BPJS: Kenaikan Iuran Bukan untuk Bebani Masyarakat,https://www.cnbcindonesia.com/news/20191101191131-8-112122/dirut-bpjs-kenaikan-iuran-bukan-untuk-bebani-masyarakat,4 tahun yang lalu
Bos BPJS Kesehatan: Kenaikan Iuran Masih Rendah,https://www.cnbcindonesia.com/news/20191101162012-4-112043/bos-bpjs-kesehatan-kenaikan-iuran-masih-rendah,4 tahun yang lalu
"Bos BPJS: Demi Kesehatan, Yuk Nabung Rp 6.000 per Hari!",https://www.cnbcindonesia.com/news/20191101155730-4-112035/bos-bpjs-demi-kesehatan-yuk-nabung-rp-6000-per-hari,4 tahun yang lalu
"Iuran Naik, Bos BPJS Janji Tak Boncos Lagi 5 Tahun ke depan",https://www.cnbcindonesia.com/news/20191101134210-4-111989/iuran-naik-bos-bpjs-janji-tak-boncos-lagi-5-tahun-ke-depan,4 tahun yang lalu
"Iuran BPJS Kesehatan Naik, Penunggak-pun Disikat!",https://www.cnbcindonesia.com/news/20191101115429-4-111947/iuran-bpjs-kesehatan-naik-penunggak-pun-disikat,4 tahun yang lalu
BPJS Kesehatan Jelaskan Polemik Kenaikan Iuran BPJS,https://www.cnbcindonesia.com/news/20191101104748-8-111933/bpjs-kesehatan-jelaskan-polemik-kenaikan-iuran-bpjs,4 tahun yang lalu
Maksud Jokowi Naikkan Iuran BPJS: Bukan Bebani Rakyat!,https://www.cnbcindonesia.com/news/20191101084731-4-111891/maksud-jokowi-naikkan-iuran-bpjs-bukan-bebani-rakyat,4 tahun yang lalu
Bailout BPJS Kesehatan Rp 14 T hingga Kastil Jepang Terbakar,https://www.cnbcindonesia.com/news/20191031193118-8-111846/bailout-bpjs-kesehatan-rp-14-t-hingga-kastil-jepang-terbakar,4 tahun yang lalu
Jokowi Tak Ingin Gegara Iuran BPJS Kesehatan Muncul Kegaduhan,https://www.cnbcindonesia.com/news/20191031152647-4-111741/jokowi-tak-ingin-gegara-iuran-bpjs-kesehatan-muncul-kegaduhan,4 tahun yang lalu
"Saat Jokowi Bicara Kenaikan Iuran BPJS Kesehatan, Simak!",https://www.cnbcindonesia.com/news/20191031152445-8-111740/saat-jokowi-bicara-kenaikan-iuran-bpjs-kesehatan-simak,4 tahun yang lalu
"Pengakuan Jokowi Soal Iuran BPJS, Berikan Beban Rakyat?",https://www.cnbcindonesia.com/news/20191031142510-4-111717/pengakuan-jokowi-soal-iuran-bpjs-berikan-beban-rakyat,4 tahun yang lalu
Sri Mulyani Cairkan Dana Talangan BPJS Kesehatan Rp 14 T,https://www.cnbcindonesia.com/news/20191031130728-4-111658/sri-mulyani-cairkan-dana-talangan-bpjs-kesehatan-rp-14-t,4 tahun yang lalu
"Buruh 'Serbu' Kemenaker, Minta UMP Rp 4,6 Juta Hingga BPJS",https://www.cnbcindonesia.com/news/20191031105507-7-111584/buruh-serbu-kemenaker-minta-ump-rp-46-juta-hingga-bpjs,4 tahun yang lalu
"Tol, BPJS, Rokok, Listrik, Naik Semua!",https://www.cnbcindonesia.com/news/20191031082731-4-111539/tol-bpjs-rokok-listrik-naik-semua,4 tahun yang lalu
Naik-naik ke Puncak Gunung Iuran BPJS Kesehatan,https://www.cnbcindonesia.com/news/20191031071523-4-111526/naik-naik-ke-puncak-gunung-iuran-bpjs-kesehatan,4 tahun yang lalu
"Iuran Naik Cuma Solusi Kecil, BPJS Harus Bereskan Kepesertaan",https://www.cnbcindonesia.com/news/20191030202217-4-111508/iuran-naik-cuma-solusi-kecil-bpjs-harus-bereskan-kepesertaan,4 tahun yang lalu
Jokowi Resmi Naikkan Iuran BPJS hingga Inggris Gelar Pemilu,https://www.cnbcindonesia.com/news/20191030185716-8-111485/jokowi-resmi-naikkan-iuran-bpjs-hingga-inggris-gelar-pemilu,4 tahun yang lalu
"Kencangkan Sabuk, Jokowi Naikkan Iuran BPJS Kesehatan 100%!",https://www.cnbcindonesia.com/news/20191030183959-16-111478/kencangkan-sabuk-jokowi-naikkan-iuran-bpjs-kesehatan-100,4 tahun yang lalu
"Jokowi Naikkan Iuran BPJS, Istana Minta Masyarakat Paham",https://www.cnbcindonesia.com/news/20191030173412-4-111457/jokowi-naikkan-iuran-bpjs-istana-minta-masyarakat-paham,4 tahun yang lalu
"Jokowi Naikkan Tarif BPJS 100%, yang Mampu Biayai yang Miskin",https://www.cnbcindonesia.com/news/20191030163738-4-111422/jokowi-naikkan-tarif-bpjs-100-yang-mampu-biayai-yang-miskin,4 tahun yang lalu
