Title,Link,Date
BPJS Kesehatan Bahas Efektivitas Layanan Kesehatan vs Biaya,https://www.cnbcindonesia.com/news/20210915223827-4-276642/bpjs-kesehatan-bahas-efektivitas-layanan-kesehatan-vs-biaya,3 tahun yang lalu
Pandemi Covid-19 Picu Penurunan Peserta BPJS Ketenagakerjaan,https://www.cnbcindonesia.com/news/20210915111735-4-276409/pandemi-covid-19-picu-penurunan-peserta-bpjs-ketenagakerjaan,3 tahun yang lalu
BPJS Beri Kemudahan untuk Pasien Thalassemia & Hemofilia,https://www.cnbcindonesia.com/news/20210913193333-4-275944/bpjs-beri-kemudahan-untuk-pasien-thalassemia-hemofilia,3 tahun yang lalu
"Inovasi Layanan, BPJS Kesehatan Ubah Care Center Jadi 165",https://www.cnbcindonesia.com/news/20210913142414-4-275822/inovasi-layanan-bpjs-kesehatan-ubah-care-center-jadi-165,3 tahun yang lalu
Bos BPJS Kesehatan Bicara JKN KIS untuk Daerah 3T,https://www.cnbcindonesia.com/news/20210913123001-4-275773/bos-bpjs-kesehatan-bicara-jkn-kis-untuk-daerah-3t,3 tahun yang lalu
"Tingkatkan Layanan, BPJS Kesehatan Luncurkan 3 Inovasi Baru",https://www.cnbcindonesia.com/news/20210913113846-4-275759/tingkatkan-layanan-bpjs-kesehatan-luncurkan-3-inovasi-baru,3 tahun yang lalu
"Demi Imunitas, Dirut BPJS Kesehatan: Ayo Olahraga Teratur",https://www.cnbcindonesia.com/news/20210912185300-4-275641/demi-imunitas-dirut-bpjs-kesehatan-ayo-olahraga-teratur,3 tahun yang lalu
"Cara Daftar BPJS Kesehatan Online, Pakai Ponsel",https://www.cnbcindonesia.com/tech/20210909132439-37-274945/cara-daftar-bpjs-kesehatan-online-pakai-ponsel,3 tahun yang lalu
Begini Cara Klaim BPJS Ketenagakerjaan Secara Online,https://www.cnbcindonesia.com/news/20210909114249-4-274902/begini-cara-klaim-bpjs-ketenagakerjaan-secara-online,3 tahun yang lalu
BPJS Kesehatan Gandeng Bank bjb Tingkatkan Layanan Faskes,https://www.cnbcindonesia.com/news/20210908162657-4-274693/bpjs-kesehatan-gandeng-bank-bjb-tingkatkan-layanan-faskes,3 tahun yang lalu
Ombudsman RI Apresiasi Layanan Hybrid BPJS Ketenagakerjaan,https://www.cnbcindonesia.com/news/20210904234240-4-273690/ombudsman-ri-apresiasi-layanan-hybrid-bpjs-ketenagakerjaan,3 tahun yang lalu
"Percepat Vaksinasi, BPJS Uji Coba P-Care Vaksinasi Mobile",https://www.cnbcindonesia.com/news/20210903183600-4-273571/percepat-vaksinasi-bpjs-uji-coba-p-care-vaksinasi-mobile,3 tahun yang lalu
BPJS Kesehatan Perluas Jaringan Faskes Tingkat Pertama,https://www.cnbcindonesia.com/news/20210901142230-4-272917/bpjs-kesehatan-perluas-jaringan-faskes-tingkat-pertama,3 tahun yang lalu
Pemprov Jateng & BPJS Kesehatan Gelar Vaksinasi Prolanis,https://www.cnbcindonesia.com/news/20210827170623-4-271859/pemprov-jateng-bpjs-kesehatan-gelar-vaksinasi-prolanis,3 tahun yang lalu
"Aksi Kemanusiaan, BPJS Kesehatan Gelar Donor Darah",https://www.cnbcindonesia.com/news/20210826222344-4-271600/aksi-kemanusiaan-bpjs-kesehatan-gelar-donor-darah,3 tahun yang lalu
"Dorong Inovasi, BPJS Kesehatan Gelar Kompetisi Hackathon",https://www.cnbcindonesia.com/news/20210826111040-4-271393/dorong-inovasi-bpjs-kesehatan-gelar-kompetisi-hackathon,3 tahun yang lalu
BPJS Kesehatan: Aplikasi P-Care Vaksinasi Berjalan Lancar,https://www.cnbcindonesia.com/news/20210825152851-4-271178/bpjs-kesehatan-aplikasi-p-care-vaksinasi-berjalan-lancar,3 tahun yang lalu
BPJS Kesehatan Jadi Investasi Kesehatan Keluarga,https://www.cnbcindonesia.com/news/20210825111930-4-271067/bpjs-kesehatan-jadi-investasi-kesehatan-keluarga,3 tahun yang lalu
Layanan Terbaik BPJS Kesehatan Saat Pandemi Covid-19,https://www.cnbcindonesia.com/news/20210825111432-4-271066/layanan-terbaik-bpjs-kesehatan-saat-pandemi-covid-19,3 tahun yang lalu
BPJS Kesehatan & Kemenkop UKM Sinergi Optimalkan Kepesertaan,https://www.cnbcindonesia.com/news/20210824112000-4-270744/bpjs-kesehatan-kemenkop-ukm-sinergi-optimalkan-kepesertaan,3 tahun yang lalu
BPJS Ketenagakerjaan Gerak Cepat untuk Korban Margo City,https://www.cnbcindonesia.com/news/20210822212344-4-270314/bpjs-ketenagakerjaan-gerak-cepat-untuk-korban-margo-city,3 tahun yang lalu
Petani Ini Andalkan BPJS Kesehatan untuk Berobat Istri,https://www.cnbcindonesia.com/news/20210822141341-4-270268/petani-ini-andalkan-bpjs-kesehatan-untuk-berobat-istri,3 tahun yang lalu
"Tanpa Khawatir Biaya, Ini Cerita Peserta JKN BPJS Kesehatan",https://www.cnbcindonesia.com/news/20210822121858-4-270248/tanpa-khawatir-biaya-ini-cerita-peserta-jkn-bpjs-kesehatan,3 tahun yang lalu
"Kisah dari Palopo, 2x Operasi Sesar Ditanggung BPJS Kesehatan",https://www.cnbcindonesia.com/news/20210822114019-4-270244/kisah-dari-palopo-2x-operasi-sesar-ditanggung-bpjs-kesehatan,3 tahun yang lalu
Bayar BPJS Kesehatan Tanpa Ribet Dengan Fitur Autodebit,https://www.cnbcindonesia.com/news/20210821182514-4-270171/bayar-bpjs-kesehatan-tanpa-ribet-dengan-fitur-autodebit,3 tahun yang lalu
BPJS Kesehatan Siapkan Tempat Isoman Khusus Bagi Pegawainya,https://www.cnbcindonesia.com/news/20210820185416-4-270039/bpjs-kesehatan-siapkan-tempat-isoman-khusus-bagi-pegawainya,3 tahun yang lalu
Proteksi Nyata BPJS Kesehatan bagi Keluarga di Indonesia,https://www.cnbcindonesia.com/news/20210820131552-4-269932/proteksi-nyata-bpjs-kesehatan-bagi-keluarga-di-indonesia,3 tahun yang lalu
"Ikuti Alurnya, Nikmati Layanan Dari Program BPJS Kesehatan",https://www.cnbcindonesia.com/news/20210819190223-4-269755/ikuti-alurnya-nikmati-layanan-dari-program-bpjs-kesehatan,3 tahun yang lalu
Cek Tarif BPJS Kesehatan Kelas 3 yang Berlaku 2021,https://www.cnbcindonesia.com/news/20210819095414-4-269529/cek-tarif-bpjs-kesehatan-kelas-3-yang-berlaku-2021,3 tahun yang lalu
Perawatan Pasien Covid Bakal Cost Sharing dengan BPJS di 2022,https://www.cnbcindonesia.com/news/20210816174655-4-268893/perawatan-pasien-covid-bakal-cost-sharing-dengan-bpjs-di-2022,3 tahun yang lalu
Cek Penerima Subsidi Upah Rp 1 Juta di BPJS Ketenagakerjaan,https://www.cnbcindonesia.com/tech/20210816080512-37-268629/cek-penerima-subsidi-upah-rp-1-juta-di-bpjs-ketenagakerjaan,3 tahun yang lalu
BPJS & Gubernur Ganjar Tinjau Sentra Vaksinasi Semarang,https://www.cnbcindonesia.com/news/20210813194435-4-268386/bpjs-gubernur-ganjar-tinjau-sentra-vaksinasi-semarang,3 tahun yang lalu
Mau BLT Rp 1 Juta? Cek sso.bpjsketenagakerjaan.go.id,https://www.cnbcindonesia.com/news/20210812202858-4-268115/mau-blt-rp-1-juta-cek-ssobpjsketenagakerjaangoid,3 tahun yang lalu
Cek sso.bpjsketenagakerjaan.go.id Untuk Dapat BLT Rp 1 Juta,https://www.cnbcindonesia.com/news/20210812112935-4-267930/cek-ssobpjsketenagakerjaangoid-untuk-dapat-blt-rp-1-juta,3 tahun yang lalu
BPJS Kesehatan Teken Kerja Sama dengan Jamdatun,https://www.cnbcindonesia.com/news/20210809211130-4-267350/bpjs-kesehatan-teken-kerja-sama-dengan-jamdatun,3 tahun yang lalu
"Sinergi BPJS Kesehatan dan Dukcapil, Percepat Vaksinasi Covid",https://www.cnbcindonesia.com/news/20210806165330-4-266759/sinergi-bpjs-kesehatan-dan-dukcapil-percepat-vaksinasi-covid,3 tahun yang lalu
Strategi BPJS Kesehatan Tingkatkan Layanan Berbasis Data,https://www.cnbcindonesia.com/news/20210805142546-4-266370/strategi-bpjs-kesehatan-tingkatkan-layanan-berbasis-data,3 tahun yang lalu
BPJS Kesehatan Masuk Inovasi Pelayanan Publik Terpuji 2021,https://www.cnbcindonesia.com/news/20210730115442-4-264852/bpjs-kesehatan-masuk-inovasi-pelayanan-publik-terpuji-2021,3 tahun yang lalu
"Cerita Anisa, Operasi Mata Bebas Biaya Berkat BPJS Kesehatan",https://www.cnbcindonesia.com/news/20210728114753-4-264257/cerita-anisa-operasi-mata-bebas-biaya-berkat-bpjs-kesehatan,3 tahun yang lalu
Mantap! Dirut BPJS Kesehatan Masuk Jajaran CEO Terbaik,https://www.cnbcindonesia.com/news/20210727190352-4-264118/mantap-dirut-bpjs-kesehatan-masuk-jajaran-ceo-terbaik,3 tahun yang lalu
"Berkat BPJS Kesehatan, Maag Kronis Sembuh Tanpa Biaya",https://www.cnbcindonesia.com/news/20210726150044-4-263699/berkat-bpjs-kesehatan-maag-kronis-sembuh-tanpa-biaya,3 tahun yang lalu
Sembuh Dari Sakit Maag Berkat Fasilitas BPJS Kesehatan,https://www.cnbcindonesia.com/news/20210723145211-4-263136/sembuh-dari-sakit-maag-berkat-fasilitas-bpjs-kesehatan,3 tahun yang lalu
Sinergi Dua BPJS Optimalkan Layanan Program Jaminan Sosial,https://www.cnbcindonesia.com/news/20210723192901-4-263217/sinergi-dua-bpjs-optimalkan-layanan-program-jaminan-sosial,3 tahun yang lalu
Kemudahan dan Manfaat Besar Jadi Peserta BPJS Kesehatan,https://www.cnbcindonesia.com/news/20210723141723-4-263119/kemudahan-dan-manfaat-besar-jadi-peserta-bpjs-kesehatan,3 tahun yang lalu
"Gak Ribet, di Sini Layanan BPJS Kesehatan Mudah & Berkualitas",https://www.cnbcindonesia.com/news/20210722195157-4-262938/gak-ribet-di-sini-layanan-bpjs-kesehatan-mudah-berkualitas,3 tahun yang lalu
Cerita Pasien Anak Operasi dan Sembuh Berkat BPJS Kesehatan,https://www.cnbcindonesia.com/news/20210717154402-4-261679/cerita-pasien-anak-operasi-dan-sembuh-berkat-bpjs-kesehatan,3 tahun yang lalu
"Harapan Sesuai Ekspektasi, Pekerja Dimudahkan BPJS Kesehatan",https://www.cnbcindonesia.com/news/20210716101702-4-261394/harapan-sesuai-ekspektasi-pekerja-dimudahkan-bpjs-kesehatan,3 tahun yang lalu
"Tanpa Biaya, Berkat BPJS Kesehatan Persalinan Jadi Lancar",https://www.cnbcindonesia.com/news/20210714190327-4-260925/tanpa-biaya-berkat-bpjs-kesehatan-persalinan-jadi-lancar,3 tahun yang lalu
"Pakai Pandawa, Layanan Kepesertaan BPJS Kesehatan Makin Cepat",https://www.cnbcindonesia.com/news/20210714183611-4-260914/pakai-pandawa-layanan-kepesertaan-bpjs-kesehatan-makin-cepat,3 tahun yang lalu
Parah! 8 Penyakit Ini Benar-benar Nguras Duit BPJS Kesehatan,https://www.cnbcindonesia.com/news/20210710120248-4-259763/parah-8-penyakit-ini-benar-benar-nguras-duit-bpjs-kesehatan,3 tahun yang lalu
8 Penyakit yang Menghabiskan Dana BPJS Kesehatan,https://www.cnbcindonesia.com/news/20210709184320-4-259691/8-penyakit-yang-menghabiskan-dana-bpjs-kesehatan,3 tahun yang lalu
Selama 7 Tahun BPJS Kesehatan 2020 Diganjar Predikat WTM,https://www.cnbcindonesia.com/news/20210709151824-4-259624/selama-7-tahun-bpjs-kesehatan-2020-diganjar-predikat-wtm,3 tahun yang lalu
Bukan Saham! Ternyata 2 BPJS Kerek Investasi di Instrumen Ini,https://www.cnbcindonesia.com/market/20210708164611-17-259372/bukan-saham-ternyata-2-bpjs-kerek-investasi-di-instrumen-ini,3 tahun yang lalu
"Sisa 2 Hari Lagi, Bayar Iuran BPJS Kesehatan! Ini Tarif 2021",https://www.cnbcindonesia.com/news/20210708063726-4-259153/sisa-2-hari-lagi-bayar-iuran-bpjs-kesehatan-ini-tarif-2021,3 tahun yang lalu
"Sebelum Tanggal 10 Bayar BPJS Kesehatan, Ini Tarif Terbarunya",https://www.cnbcindonesia.com/news/20210706211133-4-258820/sebelum-tanggal-10-bayar-bpjs-kesehatan-ini-tarif-terbarunya,3 tahun yang lalu
"Sebelum 10 Juli Bayar Iuran BPJS Kesehatan, Ini Tarif Terbaru",https://www.cnbcindonesia.com/news/20210705202532-4-258516/sebelum-10-juli-bayar-iuran-bpjs-kesehatan-ini-tarif-terbaru,3 tahun yang lalu
BPJS Kesehatan Bicara Klaim Efek Samping Vaksin Covid-19,https://www.cnbcindonesia.com/news/20210705185650-4-258490/bpjs-kesehatan-bicara-klaim-efek-samping-vaksin-covid-19,3 tahun yang lalu
BPJS Kesehatan Jelaskan Mekanisme Pembayaran Klaim di Pandemi,https://www.cnbcindonesia.com/news/20210705145630-4-258383/bpjs-kesehatan-jelaskan-mekanisme-pembayaran-klaim-di-pandemi,3 tahun yang lalu
"Bayar BPJS Kesehatan Sebelum Tanggal 10, Ini Tarif Terbarunya",https://www.cnbcindonesia.com/news/20210705063603-4-258162/bayar-bpjs-kesehatan-sebelum-tanggal-10-ini-tarif-terbarunya,3 tahun yang lalu
"Ayo Cek, Daftar Tarif Terbaru BPJS Kesehatan Kelas I, II, III",https://www.cnbcindonesia.com/news/20210704075724-4-258058/ayo-cek-daftar-tarif-terbaru-bpjs-kesehatan-kelas-i-ii-iii,3 tahun yang lalu
"Ingat Bayar Iuran BPJS Kesehatan, Ini Tarif Terbarunya!",https://www.cnbcindonesia.com/news/20210701214340-4-257575/ingat-bayar-iuran-bpjs-kesehatan-ini-tarif-terbarunya,3 tahun yang lalu
Hot News: PPKM Darurat Hingga Perubahan Iuran BPJS Kesehatan,https://www.cnbcindonesia.com/news/20210701180752-8-257544/hot-news-ppkm-darurat-hingga-perubahan-iuran-bpjs-kesehatan,3 tahun yang lalu
Kemudahan Dari BPJS Kesehatan Harus Dimanfaatkan Maksimal,https://www.cnbcindonesia.com/news/20210701113512-4-257373/kemudahan-dari-bpjs-kesehatan-harus-dimanfaatkan-maksimal,3 tahun yang lalu
"Tanggal 1 Waktunya Bayar BPJS Kesehatan, Ini Tarif Terbarunya",https://www.cnbcindonesia.com/news/20210701074830-4-257287/tanggal-1-waktunya-bayar-bpjs-kesehatan-ini-tarif-terbarunya,3 tahun yang lalu
"Lewat Mobile JKN, Mudahnya Urus Administrasi BPJS Kesehatan",https://www.cnbcindonesia.com/news/20210629094238-4-256663/lewat-mobile-jkn-mudahnya-urus-administrasi-bpjs-kesehatan,3 tahun yang lalu
Peserta Rasakan Pelayanan BPJS Kesehatan Tanpa Didiskriminasi,https://www.cnbcindonesia.com/news/20210629092905-4-256657/peserta-rasakan-pelayanan-bpjs-kesehatan-tanpa-didiskriminasi,3 tahun yang lalu
"Sadar Biaya Kesehatan Mahal, BPJS Kesehatan Jadi Andalan",https://www.cnbcindonesia.com/news/20210628183401-4-256574/sadar-biaya-kesehatan-mahal-bpjs-kesehatan-jadi-andalan,3 tahun yang lalu
Sembuh Dari Obstruksi Usus Berkat BPJS Kesehatan,https://www.cnbcindonesia.com/news/20210628111206-4-256421/sembuh-dari-obstruksi-usus-berkat-bpjs-kesehatan,3 tahun yang lalu
"Iuran BPJS Kesehatan Terbaru 2021 untuk Kelas I, II, dan III",https://www.cnbcindonesia.com/news/20210628063911-4-256344/iuran-bpjs-kesehatan-terbaru-2021-untuk-kelas-i-ii-dan-iii,3 tahun yang lalu
"Terus Berinovasi, BPJS Kesehatan Semakin Mudah Digunakan",https://www.cnbcindonesia.com/news/20210627192232-4-256322/terus-berinovasi-bpjs-kesehatan-semakin-mudah-digunakan,3 tahun yang lalu
"Tarif Iuran Terbaru BPJS 2021 Untuk Kelas I, II, & III",https://www.cnbcindonesia.com/news/20210624210853-4-255786/tarif-iuran-terbaru-bpjs-2021-untuk-kelas-i-ii-iii,3 tahun yang lalu
Hot News: Tabung Oksigen Diburu & Iuran BPJS Kesehatan 2021,https://www.cnbcindonesia.com/news/20210624183743-8-255761/hot-news-tabung-oksigen-diburu-iuran-bpjs-kesehatan-2021,3 tahun yang lalu
Jalani Operasi Tanpa Biaya Berkat BPJS Kesehatan,https://www.cnbcindonesia.com/news/20210624101552-4-255546/jalani-operasi-tanpa-biaya-berkat-bpjs-kesehatan,3 tahun yang lalu
Manfaat dan Kemudahan Saat Rutin Bayar Iuran BPJS Kesehatan,https://www.cnbcindonesia.com/news/20210624100112-4-255537/manfaat-dan-kemudahan-saat-rutin-bayar-iuran-bpjs-kesehatan,3 tahun yang lalu
"Daftar Iuran BPJS Terbaru 2021 Kelas I, II, dan III",https://www.cnbcindonesia.com/news/20210624071632-4-255495/daftar-iuran-bpjs-terbaru-2021-kelas-i-ii-dan-iii,3 tahun yang lalu
Alert! BPK Minta BPJS Ketenagakerjaan Cut Loss di Saham Ini,https://www.cnbcindonesia.com/news/20210622153631-4-255093/alert-bpk-minta-bpjs-ketenagakerjaan-cut-loss-di-saham-ini,3 tahun yang lalu
Sembuh dari Stroke Tanpa Biaya Berkat BPJS Kesehatan,https://www.cnbcindonesia.com/news/20210622125837-4-255037/sembuh-dari-stroke-tanpa-biaya-berkat-bpjs-kesehatan,3 tahun yang lalu
"Tanpa Biaya, BPJS Kesehatan Jadi Andalan Dalam Persalinan",https://www.cnbcindonesia.com/news/20210622124214-4-255029/tanpa-biaya-bpjs-kesehatan-jadi-andalan-dalam-persalinan,3 tahun yang lalu
Cek Daftar Iuran Terbaru BPJS Kesehatan 2021,https://www.cnbcindonesia.com/news/20210621191724-4-254856/cek-daftar-iuran-terbaru-bpjs-kesehatan-2021,3 tahun yang lalu
Semua Peserta BPJS Kesehatan Terlayani Tanpa Pandang Bulu,https://www.cnbcindonesia.com/news/20210621144747-4-254752/semua-peserta-bpjs-kesehatan-terlayani-tanpa-pandang-bulu,3 tahun yang lalu
Perusahaan Wajib Lindungi Pekerjanya Dengan BPJS Kesehatan,https://www.cnbcindonesia.com/tech/20210621115723-37-254657/perusahaan-wajib-lindungi-pekerjanya-dengan-bpjs-kesehatan,3 tahun yang lalu
Ini Tarif Iuran BPJS Kesehatan 2021,https://www.cnbcindonesia.com/tech/20210621090228-37-254583/ini-tarif-iuran-bpjs-kesehatan-2021,3 tahun yang lalu
"Rutin Bayar, Peserta Bersyukur Jarang Gunakan BPJS Kesehatan",https://www.cnbcindonesia.com/news/20210618102350-4-254105/rutin-bayar-peserta-bersyukur-jarang-gunakan-bpjs-kesehatan,3 tahun yang lalu
Cara Cek Tagihan BPJS Kesehatan & Tarif Terbarunya di 2021,https://www.cnbcindonesia.com/news/20210617103029-4-253811/cara-cek-tagihan-bpjs-kesehatan-tarif-terbarunya-di-2021,3 tahun yang lalu
Kendali Mutu & Kendali Biaya Jadi Prioritas BPJS Kesehatan,https://www.cnbcindonesia.com/news/20210617094059-4-253782/kendali-mutu-kendali-biaya-jadi-prioritas-bpjs-kesehatan,3 tahun yang lalu
"Layanan Memuaskan, Ikhlas Gaji Dipotong Iuran BPJS Kesehatan",https://www.cnbcindonesia.com/news/20210616180932-4-253693/layanan-memuaskan-ikhlas-gaji-dipotong-iuran-bpjs-kesehatan,3 tahun yang lalu
Peserta BPJS Kesehatan Berhasil Sembuh dari Koma 13 Hari,https://www.cnbcindonesia.com/news/20210614140045-4-252947/peserta-bpjs-kesehatan-berhasil-sembuh-dari-koma-13-hari,3 tahun yang lalu
"Bayar BPJS Kesehatan Deadline 2 Hari Lagi, Ini Tarifnya",https://www.cnbcindonesia.com/news/20210608104434-4-251349/bayar-bpjs-kesehatan-deadline-2-hari-lagi-ini-tarifnya,3 tahun yang lalu
Bantuan Subsidi Upah BSU BLT BPJS Ketenagakerjaan 2021 Cair?,https://www.cnbcindonesia.com/news/20210607153851-4-251128/bantuan-subsidi-upah-bsu-blt-bpjs-ketenagakerjaan-2021-cair,3 tahun yang lalu
"Sebentar Lagi Deadline Bayar Iuran BPJS, Ini Rincian Tarifnya",https://www.cnbcindonesia.com/news/20210607151946-4-251118/sebentar-lagi-deadline-bayar-iuran-bpjs-ini-rincian-tarifnya,3 tahun yang lalu
Begini Cara BPJS Kesehatan Bangun Karakter SDM Andal,https://www.cnbcindonesia.com/news/20210604095809-4-250526/begini-cara-bpjs-kesehatan-bangun-karakter-sdm-andal,3 tahun yang lalu
Awas Rampok! Dugaan Penipuan Bansos BPJS Lewat SMS,https://www.cnbcindonesia.com/tech/20210604103105-37-250537/awas-rampok-dugaan-penipuan-bansos-bpjs-lewat-sms,3 tahun yang lalu
Bareskrim: Diduga Keras Data BPJS Bocor!,https://www.cnbcindonesia.com/tech/20210604064808-37-250487/bareskrim-diduga-keras-data-bpjs-bocor,3 tahun yang lalu
"Jangan Salah, Cek Daftar Iuran BPJS Kesehatan 2021 di Sini",https://www.cnbcindonesia.com/news/20210517075600-4-245819/jangan-salah-cek-daftar-iuran-bpjs-kesehatan-2021-di-sini,3 tahun yang lalu
Pandawa Permudah Layanan BPJS Kesehatan Tanpa Tatap Muka,https://www.cnbcindonesia.com/news/20210531111830-4-249474/pandawa-permudah-layanan-bpjs-kesehatan-tanpa-tatap-muka,3 tahun yang lalu
"Sederet Manfaat BPJS Kesehatan, Masih Ragu Buat Ikut?",https://www.cnbcindonesia.com/news/20210530192039-4-249375/sederet-manfaat-bpjs-kesehatan-masih-ragu-buat-ikut,3 tahun yang lalu
"Andalkan BPJS Kesehatan, Cara Cerdas Nikmati Hari Tua",https://www.cnbcindonesia.com/news/20210529114206-4-249217/andalkan-bpjs-kesehatan-cara-cerdas-nikmati-hari-tua,3 tahun yang lalu
"Ikut BPJS Kesehatan, Bisa Pasang Ring Jantung Tanpa Jadi Kere",https://www.cnbcindonesia.com/news/20210528120903-4-249001/ikut-bpjs-kesehatan-bisa-pasang-ring-jantung-tanpa-jadi-kere,3 tahun yang lalu
"BPJS Kesehatan Buka Ratusan Lowongan Kerja, Cek di Sini",https://www.cnbcindonesia.com/news/20210528104652-4-248972/bpjs-kesehatan-buka-ratusan-lowongan-kerja-cek-di-sini,3 tahun yang lalu
"Berkat BPJS Kesehatan, Biaya Berobat Jadi Gratis",https://www.cnbcindonesia.com/news/20210527161254-4-248801/berkat-bpjs-kesehatan-biaya-berobat-jadi-gratis,3 tahun yang lalu
Bos BPJS Kesehatan: Butuh Waktu Untuk Investigasi,https://www.cnbcindonesia.com/tech/20210525200422-37-248405/bos-bpjs-kesehatan-butuh-waktu-untuk-investigasi,3 tahun yang lalu
BPJS Kesehatan Pastikan Keamanan Data Peserta Sesuai Standar,https://www.cnbcindonesia.com/news/20210525191519-4-248397/bpjs-kesehatan-pastikan-keamanan-data-peserta-sesuai-standar,3 tahun yang lalu
"Lowongan Kerja, BPJS Kesehatan Rekrut Ratusan Verifikator",https://www.cnbcindonesia.com/news/20210525180928-4-248366/lowongan-kerja-bpjs-kesehatan-rekrut-ratusan-verifikator,3 tahun yang lalu
Dewas BPJS Bicara Isu Keamanan Nasional dari Kebocoran Data,https://www.cnbcindonesia.com/tech/20210525163624-37-248328/dewas-bpjs-bicara-isu-keamanan-nasional-dari-kebocoran-data,3 tahun yang lalu
"Dugaan Kebocoran Data, Ini Penjelasan Lengkap BPJS Kesehatan",https://www.cnbcindonesia.com/tech/20210525153907-37-248310/dugaan-kebocoran-data-ini-penjelasan-lengkap-bpjs-kesehatan,3 tahun yang lalu
"Kasus Penjualan Data, BPJS Kesehatan Laporkan ke Bareskrim",https://www.cnbcindonesia.com/news/20210525130425-4-248222/kasus-penjualan-data-bpjs-kesehatan-laporkan-ke-bareskrim,3 tahun yang lalu
BPJS Kesehatan Telusuri Kasus Penawaran Data di Forum Online,https://www.cnbcindonesia.com/news/20210525125449-4-248214/bpjs-kesehatan-telusuri-kasus-penawaran-data-di-forum-online,3 tahun yang lalu
Data BPJS Kesehatan Bocor atau Tidak? Cek Periksadata.com,https://www.cnbcindonesia.com/tech/20210525114958-37-248185/data-bpjs-kesehatan-bocor-atau-tidak-cek-periksadatacom,3 tahun yang lalu
"Soal Dugaan Data Bocor, Ini Tindakan BPJS Kesehatan",https://www.cnbcindonesia.com/tech/20210522070259-37-247516/soal-dugaan-data-bocor-ini-tindakan-bpjs-kesehatan,3 tahun yang lalu
"Kominfo Panggil BPJS Kesehatan Soal Data Bocor, Ini Hasilnya",https://www.cnbcindonesia.com/tech/20210521193040-37-247492/kominfo-panggil-bpjs-kesehatan-soal-data-bocor-ini-hasilnya,3 tahun yang lalu
Sembuh Dari Sakit Asam Lambung Berkat BPJS Kesehatan,https://www.cnbcindonesia.com/news/20210521164210-4-247437/sembuh-dari-sakit-asam-lambung-berkat-bpjs-kesehatan,3 tahun yang lalu
Kemudahan BPJS Kesehatan Jadi Penolong Sembuh dari DBD,https://www.cnbcindonesia.com/news/20210521132256-4-247363/kemudahan-bpjs-kesehatan-jadi-penolong-sembuh-dari-dbd,3 tahun yang lalu
"Data Diduga Bocor, Direksi BPJS Kesehatan Dipanggil Kominfo",https://www.cnbcindonesia.com/tech/20210521140308-37-247375/data-diduga-bocor-direksi-bpjs-kesehatan-dipanggil-kominfo,3 tahun yang lalu
BPJS Kesehatan Ciptakan Jaringan Ekosistem Kesehatan Digital,https://www.cnbcindonesia.com/news/20210520112743-4-246939/bpjs-kesehatan-ciptakan-jaringan-ekosistem-kesehatan-digital,3 tahun yang lalu
"Semua Tertolong, BPJS Kesehatan Bentuk Nyata Gotong Royong",https://www.cnbcindonesia.com/news/20210520101329-4-246913/semua-tertolong-bpjs-kesehatan-bentuk-nyata-gotong-royong,3 tahun yang lalu
"Berkali-kali Pakai BPJS Kesehatan, Tak Ada Perbedaan Layanan",https://www.cnbcindonesia.com/news/20210519110812-4-246612/berkali-kali-pakai-bpjs-kesehatan-tak-ada-perbedaan-layanan,3 tahun yang lalu
"Andalkan BPJS Kesehatan, Persalinan Jadi Tenang & Nyaman",https://www.cnbcindonesia.com/news/20210519111345-4-246615/andalkan-bpjs-kesehatan-persalinan-jadi-tenang-nyaman,3 tahun yang lalu
Terbebas dari Anxiety Disorder Bersama BPJS Kesehatan,https://www.cnbcindonesia.com/news/20210518124500-4-246266/terbebas-dari-anxiety-disorder-bersama-bpjs-kesehatan,3 tahun yang lalu
Beban Hidup Berkurang Berkat Program BPJS Kesehatan,https://www.cnbcindonesia.com/news/20210518122422-4-246257/beban-hidup-berkurang-berkat-program-bpjs-kesehatan,3 tahun yang lalu
"Jangan Salah Bayar, Cek Iuran Terbaru BPJS Kesehatan 2021",https://www.cnbcindonesia.com/news/20210517190115-4-246109/jangan-salah-bayar-cek-iuran-terbaru-bpjs-kesehatan-2021,3 tahun yang lalu
BPJS Kesehatan Pastikan Layanan JKN Optimal di Libur Lebaran,https://www.cnbcindonesia.com/news/20210517105902-4-245888/bpjs-kesehatan-pastikan-layanan-jkn-optimal-di-libur-lebaran,3 tahun yang lalu
"BPJS Kesehatan Rilis Daftar Iuran Terbaru, Cek di Sini!",https://www.cnbcindonesia.com/news/20210515225959-4-245673/bpjs-kesehatan-rilis-daftar-iuran-terbaru-cek-di-sini,3 tahun yang lalu
"Jangan Sampai Salah, ini Daftar Iuran Terbaru BPJS Kesehatan",https://www.cnbcindonesia.com/news/20210515064828-4-245547/jangan-sampai-salah-ini-daftar-iuran-terbaru-bpjs-kesehatan,3 tahun yang lalu
Biar Tak Kaget! Ini Daftar Iuran BPJS Kesehatan 2021,https://www.cnbcindonesia.com/news/20210511165918-4-245090/biar-tak-kaget-ini-daftar-iuran-bpjs-kesehatan-2021,3 tahun yang lalu
"Jangan Keliru, Ini Daftar Terbaru Iuran BPJS Kesehatan 2021",https://www.cnbcindonesia.com/news/20210511215220-4-245177/jangan-keliru-ini-daftar-terbaru-iuran-bpjs-kesehatan-2021,3 tahun yang lalu
BPJS Kesehatan Bentuk Tim Agar Layanan Aman Jelang Lebaran,https://www.cnbcindonesia.com/news/20210511095124-4-244861/bpjs-kesehatan-bentuk-tim-agar-layanan-aman-jelang-lebaran,3 tahun yang lalu
"Jangan Salah, Ini Besaran Iuran BPJS Kesehatan yang Terbaru",https://www.cnbcindonesia.com/news/20210510183354-4-244779/jangan-salah-ini-besaran-iuran-bpjs-kesehatan-yang-terbaru,3 tahun yang lalu
"Masa Libur Lebaran, Pelayanan BPJS Kesehatan Tetap Siaga",https://www.cnbcindonesia.com/news/20210510173417-4-244758/masa-libur-lebaran-pelayanan-bpjs-kesehatan-tetap-siaga,3 tahun yang lalu
"Cegah Covid-19, Peserta BPJS Bisa Konsultasi Dokter Online",https://www.cnbcindonesia.com/news/20210510121013-4-244591/cegah-covid-19-peserta-bpjs-bisa-konsultasi-dokter-online,3 tahun yang lalu
"Ada Penyesuaian, Ini Dia Besaran Iuran BPJS Kesehatan Terbaru",https://www.cnbcindonesia.com/news/20210510033004-4-244474/ada-penyesuaian-ini-dia-besaran-iuran-bpjs-kesehatan-terbaru,3 tahun yang lalu
Ini Besaran Iuran BPJS Kesehatan Terbaru 2021,https://www.cnbcindonesia.com/news/20210508063815-4-244269/ini-besaran-iuran-bpjs-kesehatan-terbaru-2021,3 tahun yang lalu
BPJS Kesehatan Dorong Pemenuhan Faskes di Daerah Terpencil,https://www.cnbcindonesia.com/news/20210507181344-4-244218/bpjs-kesehatan-dorong-pemenuhan-faskes-di-daerah-terpencil,3 tahun yang lalu
Ini Besaran Iuran BPJS Kesehatan Terbaru 2021,https://www.cnbcindonesia.com/news/20210506032426-4-243563/ini-besaran-iuran-bpjs-kesehatan-terbaru-2021,3 tahun yang lalu
Daftar Besaran Iuran BPJS Kesehatan Terbaru 2021,https://www.cnbcindonesia.com/news/20210501092156-4-242364/daftar-besaran-iuran-bpjs-kesehatan-terbaru-2021,3 tahun yang lalu
Masih Banyak Masyarakat yang Keliru Soal BPJS Kesehatan,https://www.cnbcindonesia.com/news/20210430112343-4-242131/masih-banyak-masyarakat-yang-keliru-soal-bpjs-kesehatan,3 tahun yang lalu
