Title,Link,Date
Dirut BPJS Kesehatan: Kami Tidak Punya Utang!,https://www.cnbcindonesia.com/news/20230314112420-4-421480/dirut-bpjs-kesehatan-kami-tidak-punya-utang,1 tahun yang lalu
Cara Mencairkan JHT BPJS Ketenagakerjaan Online Tanpa Ribet,https://www.cnbcindonesia.com/news/20230313102414-4-421102/cara-mencairkan-jht-bpjs-ketenagakerjaan-online-tanpa-ribet,1 tahun yang lalu
"Sat Set, Cara Mudah Cek BPJS Kesehatan Aktif atau Tidak",https://www.cnbcindonesia.com/news/20230313084342-4-421062/sat-set-cara-mudah-cek-bpjs-kesehatan-aktif-atau-tidak,1 tahun yang lalu
BPJS Ketenagakerjaan Beri Santunan Korban Kebakaran Plumpang,https://www.cnbcindonesia.com/news/20230310180203-4-420745/bpjs-ketenagakerjaan-beri-santunan-korban-kebakaran-plumpang,1 tahun yang lalu
"Cara Daftar BPJS Kesehatan Secara Online, Tak Perlu Repot!",https://www.cnbcindonesia.com/mymoney/20230308181516-72-420049/cara-daftar-bpjs-kesehatan-secara-online-tak-perlu-repot,1 tahun yang lalu
BPJS Ketenagakerjaan Luncurkan Panduan Jamsostek Bagi Pemdes,https://www.cnbcindonesia.com/news/20230307102755-4-419487/bpjs-ketenagakerjaan-luncurkan-panduan-jamsostek-bagi-pemdes,1 tahun yang lalu
"Cek Iuran BPJS Kesehatan Berlaku 6 Maret 2023, Ada Perubahan?",https://www.cnbcindonesia.com/news/20230306083739-4-419100/cek-iuran-bpjs-kesehatan-berlaku-6-maret-2023-ada-perubahan,1 tahun yang lalu
BPJS Ketenagakerjaan Biayai Peserta Korban Kebakaran Plumpang,https://www.cnbcindonesia.com/news/20230305221215-4-419038/bpjs-ketenagakerjaan-biayai-peserta-korban-kebakaran-plumpang,1 tahun yang lalu
Catat! 4 Penyakit Ini Bikin BPJS Kesehatan 'Nombok',https://www.cnbcindonesia.com/news/20230302172852-4-418432/catat-4-penyakit-ini-bikin-bpjs-kesehatan-nombok,1 tahun yang lalu
"Kartu Tak Pernah Dipakai, Dana BPJS Kesehatan Bisa Dicairkan?",https://www.cnbcindonesia.com/news/20230302110646-4-418241/kartu-tak-pernah-dipakai-dana-bpjs-kesehatan-bisa-dicairkan,1 tahun yang lalu
"Cek Iuran Terkini BPJS Kesehatan Jelang Kelas 1,2,3 Dihapus",https://www.cnbcindonesia.com/news/20230302073915-4-418139/cek-iuran-terkini-bpjs-kesehatan-jelang-kelas-123-dihapus,1 tahun yang lalu
"Jelang Kelas 1-3 BPJS Kesehatan Dihapus, Cek Iuran Maret 2023",https://www.cnbcindonesia.com/news/20230227075246-4-417127/jelang-kelas-1-3-bpjs-kesehatan-dihapus-cek-iuran-maret-2023,1 tahun yang lalu
Top! BPJS Ketenagakerjaan Ikut Salurkan Pekerja Disabilitas,https://www.cnbcindonesia.com/news/20230223193808-4-416521/top-bpjs-ketenagakerjaan-ikut-salurkan-pekerja-disabilitas,1 tahun yang lalu
Wow! 100% Pekerja di Sulut Akan Tercover BPJS Ketenagakerjaan,https://www.cnbcindonesia.com/news/20230223181136-4-416489/wow-100-pekerja-di-sulut-akan-tercover-bpjs-ketenagakerjaan,1 tahun yang lalu
"PBI BPJS Kesehatan Naik Drastis, APBN Tekor Bu Sri Mulyani?",https://www.cnbcindonesia.com/news/20230222172943-4-416110/pbi-bpjs-kesehatan-naik-drastis-apbn-tekor-bu-sri-mulyani,1 tahun yang lalu
"Tak Pernah Sakit, Dana Iuran BPJS Kesehatan Bisa Dicairkan?",https://www.cnbcindonesia.com/news/20230222115007-4-415971/tak-pernah-sakit-dana-iuran-bpjs-kesehatan-bisa-dicairkan,1 tahun yang lalu
"Sistem Kelas BPJS Segera Dihapus, Aturan KRIS Kok Mandek?",https://www.cnbcindonesia.com/news/20230222074116-4-415845/sistem-kelas-bpjs-segera-dihapus-aturan-kris-kok-mandek,1 tahun yang lalu
"Kelas 1-3 BPJS Kesehatan Dihapus Tahun Ini, Berapa Iurannya?",https://www.cnbcindonesia.com/news/20230221072455-4-415491/kelas-1-3-bpjs-kesehatan-dihapus-tahun-ini-berapa-iurannya,1 tahun yang lalu
"Isu Hapus Kelas BPJS Mencuat, Padahal Iuran Peserta Melesat",https://www.cnbcindonesia.com/research/20230220114913-128-415237/isu-hapus-kelas-bpjs-mencuat-padahal-iuran-peserta-melesat,1 tahun yang lalu
Nih! Daftar 14 RS yang Hapus Kelas 1-3 BPJS Kesehatan,https://www.cnbcindonesia.com/news/20230220063532-4-415125/nih-daftar-14-rs-yang-hapus-kelas-1-3-bpjs-kesehatan,1 tahun yang lalu
"Kelas 1, 2, 3 Mau Dihapus, Cek Iuran BPJS Kesehatan Terkini",https://www.cnbcindonesia.com/news/20230220062125-4-415123/kelas-1-2-3-mau-dihapus-cek-iuran-bpjs-kesehatan-terkini,1 tahun yang lalu
"Kelas 1, 2, 3 BPJS Kesehatan Bakal Dihapus, Cek Iuran Terkini",https://www.cnbcindonesia.com/news/20230217100434-4-414648/kelas-1-2-3-bpjs-kesehatan-bakal-dihapus-cek-iuran-terkini,1 tahun yang lalu
"Klaim BPJS Ketenagakerjaan Anti Ribet, Simak Caranya...",https://www.cnbcindonesia.com/news/20230215155848-4-414079/klaim-bpjs-ketenagakerjaan-anti-ribet-simak-caranya,1 tahun yang lalu
"Kelas 1,2,3 BPJS Kesehatan Dihapus, Gimana Iuran Peserta?",https://www.cnbcindonesia.com/news/20230213084104-4-413175/kelas-123-bpjs-kesehatan-dihapus-gimana-iuran-peserta,1 tahun yang lalu
"Kelas 1-3 Dihapus, Bos BPJS Kesehatan Sebut Ini Lebih Penting",https://www.cnbcindonesia.com/news/20230213074542-4-413157/kelas-1-3-dihapus-bos-bpjs-kesehatan-sebut-ini-lebih-penting,1 tahun yang lalu
Ini Hasil Uji Coba Kelas Standar BPJS Kesehatan di 14 RS!,https://www.cnbcindonesia.com/news/20230213071635-4-413149/ini-hasil-uji-coba-kelas-standar-bpjs-kesehatan-di-14-rs,1 tahun yang lalu
"Kelas 1-3 BPJS Kesehatan Dihapus, Apa Untungnya?",https://www.cnbcindonesia.com/news/20230213070007-4-413146/kelas-1-3-bpjs-kesehatan-dihapus-apa-untungnya,1 tahun yang lalu
"Membedah Kelas Standar BPJS Kesehatan, Pengganti Kelas 1,2,3!",https://www.cnbcindonesia.com/news/20230213063302-4-413140/membedah-kelas-standar-bpjs-kesehatan-pengganti-kelas-123,1 tahun yang lalu
Kelas Rawat Inap BPJS 1 - 3 Dihapus Total pada 2026,https://www.cnbcindonesia.com/news/20230212165838-4-413093/kelas-rawat-inap-bpjs-1--3-dihapus-total-pada-2026,1 tahun yang lalu
Mudah! 6 Cara Cek Nomor BPJS Kesehatan Pakai NIK KTP,https://www.cnbcindonesia.com/mymoney/20230212110716-72-413053/mudah-6-cara-cek-nomor-bpjs-kesehatan-pakai-nik-ktp,1 tahun yang lalu
Ribuan RS Siap Hapus Kelas 1-3 BPJS Kesehatan Tahun Ini,https://www.cnbcindonesia.com/news/20230210153541-4-412845/ribuan-rs-siap-hapus-kelas-1-3-bpjs-kesehatan-tahun-ini,1 tahun yang lalu
Bos BPJS Kesehatan Tolak Penghapusan Kelas Dimulai 2023,https://www.cnbcindonesia.com/news/20230210130135-4-412779/bos-bpjs-kesehatan-tolak-penghapusan-kelas-dimulai-2023,1 tahun yang lalu
RS Swasta Rogoh Kocek Sendiri Siapkan Kelas Standar BPJS,https://www.cnbcindonesia.com/news/20230210092018-4-412701/rs-swasta-rogoh-kocek-sendiri-siapkan-kelas-standar-bpjs,1 tahun yang lalu
"Kelas 1-3 BPJS Kesehatan Dihapus Mulai 2023, Iuran Akan Naik?",https://www.cnbcindonesia.com/news/20230210100046-4-412720/kelas-1-3-bpjs-kesehatan-dihapus-mulai-2023-iuran-akan-naik,1 tahun yang lalu
"Ini Penampakan KRIS, Pengganti Kelas 1,2,3 BPJS Kesehatan",https://www.cnbcindonesia.com/news/20230210073931-4-412656/ini-penampakan-kris-pengganti-kelas-123-bpjs-kesehatan,1 tahun yang lalu
BPJS Ketenagakerjaan Gandeng SRCIS Beri Perlindungan ke UMKM,https://www.cnbcindonesia.com/news/20230209212117-4-412618/bpjs-ketenagakerjaan-gandeng-srcis-beri-perlindungan-ke-umkm,1 tahun yang lalu
"Ketua DJSN Tak Hadir Rapat Soal BPJS Kesehatan, DPR Murka!",https://www.cnbcindonesia.com/news/20230209210543-4-412616/ketua-djsn-tak-hadir-rapat-soal-bpjs-kesehatan-dpr-murka,1 tahun yang lalu
Menkes: Kelas 1-3 BPJS Kesehatan Dihapus Bertahap Sampai 2025,https://www.cnbcindonesia.com/news/20230209203423-4-412603/menkes-kelas-1-3-bpjs-kesehatan-dihapus-bertahap-sampai-2025,1 tahun yang lalu
Hot News: Marak Tambang Ilegal Hingga Tak Ada Lagi Kelas BPJS,https://www.cnbcindonesia.com/news/20230209194634-8-412584/hot-news-marak-tambang-ilegal-hingga-tak-ada-lagi-kelas-bpjs,1 tahun yang lalu
"Rapat Kelas BPJS Kesehatan Panas, Menkes Kembali ke DPR",https://www.cnbcindonesia.com/news/20230209201028-4-412600/rapat-kelas-bpjs-kesehatan-panas-menkes-kembali-ke-dpr,1 tahun yang lalu
"DPR Memanas, Program Penghapusan Kelas BPJS Terancam Batal",https://www.cnbcindonesia.com/news/20230209195901-4-412590/dpr-memanas-program-penghapusan-kelas-bpjs-terancam-batal,1 tahun yang lalu
Wamenkes: Cangkok Paru & Hati Bisa Diklaim ke BPJS Kesehatan!,https://www.cnbcindonesia.com/news/20230209184048-4-412558/wamenkes-cangkok-paru-hati-bisa-diklaim-ke-bpjs-kesehatan,1 tahun yang lalu
"Kelas Rawat Inap 1-3 Dihapus, BPJS Kesehatan Tak Akan Rugi",https://www.cnbcindonesia.com/news/20230209180421-4-412550/kelas-rawat-inap-1-3-dihapus-bpjs-kesehatan-tak-akan-rugi,1 tahun yang lalu
"Kelas 1, 2, & 3 BPJS Kesehatan Dihapus! Ini Hasil Uji Cobanya",https://www.cnbcindonesia.com/news/20230209172629-4-412542/kelas-1-2-3-bpjs-kesehatan-dihapus-ini-hasil-uji-cobanya,1 tahun yang lalu
DPR Panggil Wamenkes Soal Penghapusan Kelas BPJS Kesehatan,https://www.cnbcindonesia.com/news/20230209171044-4-412536/dpr-panggil-wamenkes-soal-penghapusan-kelas-bpjs-kesehatan,1 tahun yang lalu
Daftar & Bayar BPJS Ketenagakerjaan Kini Bisa di Pegadaian,https://www.cnbcindonesia.com/news/20230209160102-4-412508/daftar-bayar-bpjs-ketenagakerjaan-kini-bisa-di-pegadaian,1 tahun yang lalu
Tata Cara dan Syarat USG Kehamilan Pakai BPJS Kesehatan 2023,https://www.cnbcindonesia.com/lifestyle/20230209141849-33-412466/tata-cara-dan-syarat-usg-kehamilan-pakai-bpjs-kesehatan-2023,1 tahun yang lalu
"Kelas 1,2,3 BPJS Kesehatan Dihapus 2023, Ini Penggantinya!",https://www.cnbcindonesia.com/news/20230209152207-4-412489/kelas-123-bpjs-kesehatan-dihapus-2023-ini-penggantinya,1 tahun yang lalu
"Hapus Kelas 1,2,3 BPJS Kesehatan, Menkes: Semua RS Disamakan!",https://www.cnbcindonesia.com/news/20230209081118-4-412298/hapus-kelas-123-bpjs-kesehatan-menkes-semua-rs-disamakan,1 tahun yang lalu
"Menkes: Kelas 1,2,3 BPJS Kesehatan Dihapus Tahun Ini",https://www.cnbcindonesia.com/news/20230208195246-4-412239/menkes-kelas-123-bpjs-kesehatan-dihapus-tahun-ini,1 tahun yang lalu
"Kabar BPJS Kesehatan Hapus Kelas 1-3, Ini Update Terbarunya!",https://www.cnbcindonesia.com/news/20230208093023-4-412008/kabar-bpjs-kesehatan-hapus-kelas-1-3-ini-update-terbarunya,1 tahun yang lalu
Jaga Kesehatan! Penyakit Ini Tidak Ditanggung BPJS,https://www.cnbcindonesia.com/news/20230205105831-4-411071/jaga-kesehatan-penyakit-ini-tidak-ditanggung-bpjs,1 tahun yang lalu
"Kelas 1-3 BPJS Kesehatan Bakal Dihapus, Iurannya Segini",https://www.cnbcindonesia.com/news/20230204104415-4-410960/kelas-1-3-bpjs-kesehatan-bakal-dihapus-iurannya-segini,1 tahun yang lalu
"Kelas 1, 2, 3 BPJS Kesehatan Akan Dihapus, Iuran Jadi Berapa?",https://www.cnbcindonesia.com/news/20230203151042-4-410820/kelas-1-2-3-bpjs-kesehatan-akan-dihapus-iuran-jadi-berapa,1 tahun yang lalu
"Aturan Rampung, Kelas 1,2,3 BPJS Kesehatan Segera Dihapus!",https://www.cnbcindonesia.com/news/20230203115729-4-410741/aturan-rampung-kelas-123-bpjs-kesehatan-segera-dihapus,1 tahun yang lalu
"Menanti Rencana Hapus Kelas 1-3 BPJS Kesehatan, Jadi 2023?",https://www.cnbcindonesia.com/news/20230203072707-4-410637/menanti-rencana-hapus-kelas-1-3-bpjs-kesehatan-jadi-2023,1 tahun yang lalu
BPJS Ketenagakerjaan Beri Penghargaan ke Pemkab Muna Barat,https://www.cnbcindonesia.com/news/20230202135457-4-410447/bpjs-ketenagakerjaan-beri-penghargaan-ke-pemkab-muna-barat,1 tahun yang lalu
"Masih Andalkan APBN, BPJS Kesehatan Was-was Tekor Lagi!",https://www.cnbcindonesia.com/market/20230131072629-17-409516/masih-andalkan-apbn-bpjs-kesehatan-was-was-tekor-lagi,1 tahun yang lalu
Naik Tajam! Pendapatan BPJS Kesehatan Tembus Rp144 T di 2022,https://www.cnbcindonesia.com/market/20230130150857-17-409381/naik-tajam-pendapatan-bpjs-kesehatan-tembus-rp144-t-di-2022,1 tahun yang lalu
"Tarif Sudah Naik, BPJS Kesehatan Minta RS Tingkatkan Layanan",https://www.cnbcindonesia.com/lifestyle/20230130131638-33-409303/tarif-sudah-naik-bpjs-kesehatan-minta-rs-tingkatkan-layanan,1 tahun yang lalu
"Orang Kaya Bikin Bangkrut BPJS Kesehatan, Benarkah?",https://www.cnbcindonesia.com/lifestyle/20230130125813-33-409288/orang-kaya-bikin-bangkrut-bpjs-kesehatan-benarkah,1 tahun yang lalu
"BPJS Kesehatan Surplus, Jokowi & Negara Lain Sampai Bingung",https://www.cnbcindonesia.com/lifestyle/20230130123344-33-409277/bpjs-kesehatan-surplus-jokowi-negara-lain-sampai-bingung,1 tahun yang lalu
BPJS Ketenagakerjaan Dukung Kesejahteraan Pelaku Olahraga,https://www.cnbcindonesia.com/news/20230130085953-4-409164/bpjs-ketenagakerjaan-dukung-kesejahteraan-pelaku-olahraga,1 tahun yang lalu
Wajib Tahu! Ini Daftar Penyakit Tak Ditanggung BPJS Kesehatan,https://www.cnbcindonesia.com/lifestyle/20230129122736-33-409038/wajib-tahu-ini-daftar-penyakit-tak-ditanggung-bpjs-kesehatan,1 tahun yang lalu
Wajib Tahu! Cara Bikin BPJS Kesehatan untuk Bayi Baru Lahir,https://www.cnbcindonesia.com/lifestyle/20230127162511-33-408832/wajib-tahu-cara-bikin-bpjs-kesehatan-untuk-bayi-baru-lahir,1 tahun yang lalu
"Dibuka! Lowongan Kerja BPJS Ketenagakerjaan, Ini Lengkapnya",https://www.cnbcindonesia.com/news/20230127115824-4-408747/dibuka-lowongan-kerja-bpjs-ketenagakerjaan-ini-lengkapnya,1 tahun yang lalu
"Viral Netizen Nunggak Iuran 11 Tahun, Ini Kata BPJS Kesehatan",https://www.cnbcindonesia.com/news/20230123102501-4-407558/viral-netizen-nunggak-iuran-11-tahun-ini-kata-bpjs-kesehatan,1 tahun yang lalu
"Jangan Lupa, Ini Cara Cek Status Kepesertaan BPJS Kesehatan",https://www.cnbcindonesia.com/news/20230120180644-4-407221/jangan-lupa-ini-cara-cek-status-kepesertaan-bpjs-kesehatan,1 tahun yang lalu
"Cek Lagi, Cara Daftar BPJS Kesehatan Tahun 2023",https://www.cnbcindonesia.com/news/20230120171341-4-407207/cek-lagi-cara-daftar-bpjs-kesehatan-tahun-2023,1 tahun yang lalu
Simak! 6 Cara Cek Nomor BPJS Kesehatan Pakai NIK KTP,https://www.cnbcindonesia.com/mymoney/20230119110104-72-406714/simak-6-cara-cek-nomor-bpjs-kesehatan-pakai-nik-ktp,1 tahun yang lalu
Cek! Segini Iuran BPJS Kesehatan Berlaku Januari 2023,https://www.cnbcindonesia.com/news/20230112092041-4-404887/cek-segini-iuran-bpjs-kesehatan-berlaku-januari-2023,1 tahun yang lalu
BPJS Ketenagakerjaan Bidik 10 Juta Peserta Baru di Tahun 2023,https://www.cnbcindonesia.com/news/20230111104058-4-404578/bpjs-ketenagakerjaan-bidik-10-juta-peserta-baru-di-tahun-2023,1 tahun yang lalu
"Sri Mulyani Siram Rp4,78 T ke BPJS Ketenagakerjaan, Buat Apa?",https://www.cnbcindonesia.com/news/20230110163545-4-404385/sri-mulyani-siram-rp478-t-ke-bpjs-ketenagakerjaan-buat-apa,1 tahun yang lalu
"Gak Semua RS di Jakarta Terima BPJS, 44 RS Ini Mau",https://www.cnbcindonesia.com/mymoney/20230109072823-72-403808/gak-semua-rs-di-jakarta-terima-bpjs-44-rs-ini-mau,1 tahun yang lalu
78.000 Pekerja Rentan di Jambi Terdaftar BPJS Ketenagakerjaan,https://www.cnbcindonesia.com/news/20230106165541-4-403521/78000-pekerja-rentan-di-jambi-terdaftar-bpjs-ketenagakerjaan,1 tahun yang lalu
"Ramai BPJS Kesehatan Orang Kaya, Hapus Kelas & Iuran Baru",https://www.cnbcindonesia.com/news/20221228184609-4-400993/ramai-bpjs-kesehatan-orang-kaya-hapus-kelas-iuran-baru,1 tahun yang lalu
Ingat! Rawat Inap Standar BPJS Kesehatan Mulai 1 Januari 2023,https://www.cnbcindonesia.com/news/20221228073035-4-400715/ingat-rawat-inap-standar-bpjs-kesehatan-mulai-1-januari-2023,1 tahun yang lalu
Awas! Ini Akibatnya Kalau Kantor Anda Nunggak Bayar BPJS TK,https://www.cnbcindonesia.com/mymoney/20221226150840-72-400199/awas-ini-akibatnya-kalau-kantor-anda-nunggak-bayar-bpjs-tk,1 tahun yang lalu
Bjb Raih Apresiasi dari BPJS Ketenagakerjaan Berkat Hal Ini,https://www.cnbcindonesia.com/news/20221223161617-4-399662/bjb-raih-apresiasi-dari-bpjs-ketenagakerjaan-berkat-hal-ini,1 tahun yang lalu
"Ada Kabar Baik Soal Iuran BPJS Kesehatan Tahun Depan, Simak!",https://www.cnbcindonesia.com/news/20221222064029-4-399055/ada-kabar-baik-soal-iuran-bpjs-kesehatan-tahun-depan-simak,1 tahun yang lalu
BPJS Ketenagakerjaan Kenalkan Wajah & Fitur Layanan Baru,https://www.cnbcindonesia.com/news/20221221164246-4-399005/bpjs-ketenagakerjaan-kenalkan-wajah-fitur-layanan-baru,1 tahun yang lalu
BPJS Ketenagakerjaan Gaet Ombudsman Tingkatkan Layanan Publik,https://www.cnbcindonesia.com/news/20221219120851-4-398094/bpjs-ketenagakerjaan-gaet-ombudsman-tingkatkan-layanan-publik,1 tahun yang lalu
Catat! Iuran Peserta BPJS Kesehatan yang Berlaku 2023,https://www.cnbcindonesia.com/news/20221219092127-4-398018/catat-iuran-peserta-bpjs-kesehatan-yang-berlaku-2023,1 tahun yang lalu
Catat! Ini Daftar Penyakit yang Tak Dicover BPJS Kesehatan,https://www.cnbcindonesia.com/lifestyle/20221218071221-33-397813/catat-ini-daftar-penyakit-yang-tak-dicover-bpjs-kesehatan,1 tahun yang lalu
"Biar Gak Salah, BPJS Kesehatan Tak Menanggung 21 Penyakit Ini",https://www.cnbcindonesia.com/news/20221216120215-4-397514/biar-gak-salah-bpjs-kesehatan-tak-menanggung-21-penyakit-ini,1 tahun yang lalu
"Joss! Persalinan Ditanggung BPJS Kesehatan, Segini Jumlahnya",https://www.cnbcindonesia.com/mymoney/20221216114754-72-397509/joss-persalinan-ditanggung-bpjs-kesehatan-segini-jumlahnya,1 tahun yang lalu
Simak! Segini Iuran BPJS Kesehatan yang Berlaku 2023,https://www.cnbcindonesia.com/news/20221216115146-4-397512/simak-segini-iuran-bpjs-kesehatan-yang-berlaku-2023,1 tahun yang lalu
BPJS Kesehatan Rilis Data Sampel Terbaru & New Mobile JKN,https://www.cnbcindonesia.com/news/20221216102143-4-397464/bpjs-kesehatan-rilis-data-sampel-terbaru-new-mobile-jkn,1 tahun yang lalu
BPJS Ketenagakerjaan Kukuhkan Karyawan Sebagai PAKSI & API,https://www.cnbcindonesia.com/news/20221214212253-4-397019/bpjs-ketenagakerjaan-kukuhkan-karyawan-sebagai-paksi-api,1 tahun yang lalu
LSP BPJS Kesehatan Luncurkan Tiga Skema Baru,https://www.cnbcindonesia.com/news/20221214183421-4-396964/lsp-bpjs-kesehatan-luncurkan-tiga-skema-baru,1 tahun yang lalu
BPJS Kesehatan & DJSN Luncurkan Buku Statistik JKN 2016-2021,https://www.cnbcindonesia.com/news/20221214164706-4-396914/bpjs-kesehatan-djsn-luncurkan-buku-statistik-jkn-2016-2021,1 tahun yang lalu
BPJS Kesehatan Pertahankan Predikat Badan Publik Informatif,https://www.cnbcindonesia.com/news/20221214163613-4-396906/bpjs-kesehatan-pertahankan-predikat-badan-publik-informatif,1 tahun yang lalu
"Punya Sistem Andal, BPJS Kesehatan Dulang Penghargaan",https://www.cnbcindonesia.com/news/20221213121216-4-396422/punya-sistem-andal-bpjs-kesehatan-dulang-penghargaan,1 tahun yang lalu
Ibu Mau Kontrol Kehamilan Pakai BPJS Kesehatan? Ini Syaratnya,https://www.cnbcindonesia.com/lifestyle/20221212133815-33-396061/ibu-mau-kontrol-kehamilan-pakai-bpjs-kesehatan-ini-syaratnya,1 tahun yang lalu
BPJS Ketenagakerjaan Lindungi 26.808 Petani Kabupaten Bekasi,https://www.cnbcindonesia.com/news/20221209192204-4-395484/bpjs-ketenagakerjaan-lindungi-26808-petani-kabupaten-bekasi,1 tahun yang lalu
BPJS Kesehatan Cegah Fraud Dengan Pemanfaatan AI,https://www.cnbcindonesia.com/news/20221208163407-4-395037/bpjs-kesehatan-cegah-fraud-dengan-pemanfaatan-ai,1 tahun yang lalu
"Wajib Tahu, Daftar Penyakit yang Tak Dicover BPJS Kesehatan",https://www.cnbcindonesia.com/lifestyle/20221207182027-33-394708/wajib-tahu-daftar-penyakit-yang-tak-dicover-bpjs-kesehatan,1 tahun yang lalu
BPJS Ketenagakerjaan Satukan Semangat Sejahterakan Pekerja,https://www.cnbcindonesia.com/news/20221205234141-4-394002/bpjs-ketenagakerjaan-satukan-semangat-sejahterakan-pekerja,1 tahun yang lalu
BPJS Kesehatan Salurkan Bantuan ke Korban Gempa Cianjur,https://www.cnbcindonesia.com/news/20221205191152-4-393976/bpjs-kesehatan-salurkan-bantuan-ke-korban-gempa-cianjur,1 tahun yang lalu
Cek Iuran BPJS Kesehatan yang Berlaku Desember 2022,https://www.cnbcindonesia.com/news/20221205070510-4-393625/cek-iuran-bpjs-kesehatan-yang-berlaku-desember-2022,1 tahun yang lalu
Perlindungan BPJS Ketenagakerjaan Bantalan Pengaman Sosial,https://www.cnbcindonesia.com/news/20221204183854-4-393600/perlindungan-bpjs-ketenagakerjaan-bantalan-pengaman-sosial,1 tahun yang lalu
Hore! Ada Kabar Baik soal BPJS Kesehatan dari Jokowi,https://www.cnbcindonesia.com/news/20221203094544-4-393438/hore-ada-kabar-baik-soal-bpjs-kesehatan-dari-jokowi,1 tahun yang lalu
"Pendamping Desa Meninggal, BPJS Ketenagakerjaan Beri Santunan",https://www.cnbcindonesia.com/news/20221202074934-4-393109/pendamping-desa-meninggal-bpjs-ketenagakerjaan-beri-santunan,1 tahun yang lalu
"Bisa Diandalkan, Pria Ini Pakai BPJS Kesehatan untuk Berobat",https://www.cnbcindonesia.com/news/20221201171518-4-393001/bisa-diandalkan-pria-ini-pakai-bpjs-kesehatan-untuk-berobat,1 tahun yang lalu
Horeee! Menkes Beri Kabar Baik Soal Iuran BPJS Kesehatan,https://www.cnbcindonesia.com/news/20221201063633-4-392737/horeee-menkes-beri-kabar-baik-soal-iuran-bpjs-kesehatan,1 tahun yang lalu
"Ada BPJS Kesehatan Orang Kaya, Lah Orang Miskin Gimana?",https://www.cnbcindonesia.com/news/20221129152936-4-392168/ada-bpjs-kesehatan-orang-kaya-lah-orang-miskin-gimana,1 tahun yang lalu
Menkes Bawa Kabar Baik dari Jokowi Soal Iuran BPJS Kesehatan,https://www.cnbcindonesia.com/news/20221129072659-4-391965/menkes-bawa-kabar-baik-dari-jokowi-soal-iuran-bpjs-kesehatan,1 tahun yang lalu
Pegawai BPJS Kesehatan Jadi Pelapor Gratifikasi Inspiratif,https://www.cnbcindonesia.com/news/20221128152130-4-391850/pegawai-bpjs-kesehatan-jadi-pelapor-gratifikasi-inspiratif,1 tahun yang lalu
"Video: Gaduh ""BPJS Orang Kaya"", Ini Penjelasannya",https://www.cnbcindonesia.com/news/20221128115900-8-391764/video-gaduh-bpjs-orang-kaya-ini-penjelasannya,1 tahun yang lalu
"RS Swasta Kesulitan Terapkan Kelas Standar BPJS, Kenapa?",https://www.cnbcindonesia.com/news/20221128115154-8-391762/rs-swasta-kesulitan-terapkan-kelas-standar-bpjs-kenapa,1 tahun yang lalu
BPJS Ketenagakerjaan Ajak Pekerja Peduli Jaminan Sosial,https://www.cnbcindonesia.com/news/20221127200845-4-391613/bpjs-ketenagakerjaan-ajak-pekerja-peduli-jaminan-sosial,1 tahun yang lalu
Akhirnya! Menkes Angkat Bicara Soal 'BPJS Orang Kaya',https://www.cnbcindonesia.com/news/20221126135010-4-391441/akhirnya-menkes-angkat-bicara-soal-bpjs-orang-kaya,1 tahun yang lalu
"BPJS Orang Kaya Bikin Gaduh, Begini Penjelasan Manajemen",https://www.cnbcindonesia.com/news/20221126124100-4-391429/bpjs-orang-kaya-bikin-gaduh-begini-penjelasan-manajemen,1 tahun yang lalu
Heboh Konglomerat Masih Banyak yang Pakai Jasa BPJS Kesehatan,https://www.cnbcindonesia.com/news/20221124152640-4-390942/heboh-konglomerat-masih-banyak-yang-pakai-jasa-bpjs-kesehatan,1 tahun yang lalu
Dijamin Happy! Ini Kabar Terbaru Soal Iuran BPJS Kesehatan,https://www.cnbcindonesia.com/news/20221123191736-4-390653/dijamin-happy-ini-kabar-terbaru-soal-iuran-bpjs-kesehatan,1 tahun yang lalu
"DPR & Menkes Rapat 9 Jam Bahas BPJS Kesehatan, Ini Hasilnya!",https://www.cnbcindonesia.com/news/20221122202912-4-390333/dpr-menkes-rapat-9-jam-bahas-bpjs-kesehatan-ini-hasilnya,1 tahun yang lalu
Titah Jokowi: Iuran BPJS Kesehatan Tak Naik Sampai 2024!,https://www.cnbcindonesia.com/news/20221122193640-4-390323/titah-jokowi-iuran-bpjs-kesehatan-tak-naik-sampai-2024,1 tahun yang lalu
Iuran BPJS Kesehatan Naik? Simak Penjelasan Menkes!,https://www.cnbcindonesia.com/news/20221122181521-4-390290/iuran-bpjs-kesehatan-naik-simak-penjelasan-menkes,1 tahun yang lalu
BPJS Ketenagakerjaan Siap Beri Kemudahan Peserta Terkena PHK,https://www.cnbcindonesia.com/news/20221122164238-4-390250/bpjs-ketenagakerjaan-siap-beri-kemudahan-peserta-terkena-phk,1 tahun yang lalu
"RS Sepakat Kelas BPJS Kesehatan Dihapus, Tapi...",https://www.cnbcindonesia.com/news/20221122153053-4-390233/rs-sepakat-kelas-bpjs-kesehatan-dihapus-tapi,1 tahun yang lalu
Menkes Pede BPJS Kesehatan Tak Defisit Sampai 2024,https://www.cnbcindonesia.com/news/20221122134949-4-390184/menkes-pede-bpjs-kesehatan-tak-defisit-sampai-2024,1 tahun yang lalu
Bulan Depan! 10 RS Ini Terapkan Kelas Standar BPJS Kesehatan,https://www.cnbcindonesia.com/news/20221122114313-4-390138/bulan-depan-10-rs-ini-terapkan-kelas-standar-bpjs-kesehatan,1 tahun yang lalu
Tak Puas! Uji Coba Kelas Standar BPJS Kesehatan Diperpanjang,https://www.cnbcindonesia.com/news/20221122112350-4-390129/tak-puas-uji-coba-kelas-standar-bpjs-kesehatan-diperpanjang,1 tahun yang lalu
"Uji Coba Kelas Standar BPJS Kesehatan Selesai, Ini Hasilnya!",https://www.cnbcindonesia.com/news/20221122105744-4-390116/uji-coba-kelas-standar-bpjs-kesehatan-selesai-ini-hasilnya,1 tahun yang lalu
"Kelas 1,2,3 BPJS Kesehatan Mau Dihapus, DPR Panggil Menkes!",https://www.cnbcindonesia.com/news/20221122102925-4-390108/kelas-123-bpjs-kesehatan-mau-dihapus-dpr-panggil-menkes,1 tahun yang lalu
Catat Ya! Penyakit Ini Tak Ditanggung BPJS Kesehatan,https://www.cnbcindonesia.com/news/20221120143738-4-389632/catat-ya-penyakit-ini-tak-ditanggung-bpjs-kesehatan,1 tahun yang lalu
"Bayar BPJS Kesehatan Tapi Tak Pernah Dipakai, Bisa Dicairkan?",https://www.cnbcindonesia.com/news/20221120142954-4-389631/bayar-bpjs-kesehatan-tapi-tak-pernah-dipakai-bisa-dicairkan,1 tahun yang lalu
"Tsunami PHK, Segini Hak Pekerja Cairkan BPJS Ketenagakerjaan",https://www.cnbcindonesia.com/mymoney/20221119133748-72-389515/tsunami-phk-segini-hak-pekerja-cairkan-bpjs-ketenagakerjaan,1 tahun yang lalu
Anda Kena PHK? Ini Cara Cairkan Dana JKP BPJS Ketenagakerjaan,https://www.cnbcindonesia.com/mymoney/20221118210230-72-389465/anda-kena-phk-ini-cara-cairkan-dana-jkp-bpjs-ketenagakerjaan,1 tahun yang lalu
"Ini Besaran Iuran BPJS Kesehatan Kelas 1, 2, 3 yang Berlaku",https://www.cnbcindonesia.com/mymoney/20221117153157-72-389016/ini-besaran-iuran-bpjs-kesehatan-kelas-1-2-3-yang-berlaku,1 tahun yang lalu
"Tak Pernah Sakit, Dana BPJS Kesehatan Bisa Dicairkan?",https://www.cnbcindonesia.com/mymoney/20221116085703-72-388404/tak-pernah-sakit-dana-bpjs-kesehatan-bisa-dicairkan,1 tahun yang lalu
"Cek Iuran BPJS Kesehatan Kelas 1,2,3 Terkini, Ada Perubahan?",https://www.cnbcindonesia.com/mymoney/20221114082010-72-387547/cek-iuran-bpjs-kesehatan-kelas-123-terkini-ada-perubahan,1 tahun yang lalu
Program BPJS Ketenagakerjaan Bisa Cegah Kemiskinan Baru,https://www.cnbcindonesia.com/news/20221114083350-4-387561/program-bpjs-ketenagakerjaan-bisa-cegah-kemiskinan-baru,1 tahun yang lalu
Awas Menyesal! Ini yang Terjadi Jika Tak Bayar BPJS Kesehatan,https://www.cnbcindonesia.com/mymoney/20221111125438-72-387056/awas-menyesal-ini-yang-terjadi-jika-tak-bayar-bpjs-kesehatan,1 tahun yang lalu
