Judul,Link,Kategori,Tanggal Upload
Cara Cek Bantuan BPJS Ketenagakerjaan dengan NIK KTP,https://www.cnnindonesia.com/ekonomi/20220414162612-97-784937/cara-cek-bantuan-bpjs-ketenagakerjaan-dengan-nik-ktp,Ekonomi,2 tahun yang lalu
Cara Daftar NIB Bagi UMKM Lewat DANA,https://www.cnnindonesia.com/ekonomi/20220418162000-92-786206/cara-daftar-nib-bagi-umkm-lewat-dana,Ekonomi,2 tahun yang lalu
Walkot Semarang Siapkan Pelayanan Kesehatan 24 Jam bagi Pemudik,https://www.cnnindonesia.com/gaya-hidup/20220418202714-307-786317/walkot-semarang-siapkan-pelayanan-kesehatan-24-jam-bagi-pemudik,Gaya Hidup,2 tahun yang lalu
5 Alasan Orang Ingin Kerja di BUMN,https://www.cnnindonesia.com/ekonomi/20220415055247-92-785096/5-alasan-orang-ingin-kerja-di-bumn,Ekonomi,2 tahun yang lalu
Biaya Rp1.000 per Akses NIK Hanya Berlaku untuk Lembaga Profit,https://www.cnnindonesia.com/nasional/20220414165305-20-784954/biaya-rp1000-per-akses-nik-hanya-berlaku-untuk-lembaga-profit,Nasional,2 tahun yang lalu
"Demo Mahasiswa Masih Terjadi di Jatim, Sulsel hingga Banten",https://www.cnnindonesia.com/nasional/20220413191758-20-784472/demo-mahasiswa-masih-terjadi-di-jatim-sulsel-hingga-banten,Nasional,2 tahun yang lalu
KPK Periksa Direktur Summarecon Agung Terkait TPPU Rahmat Effendi,https://www.cnnindonesia.com/nasional/20220411132036-12-783175/kpk-periksa-direktur-summarecon-agung-terkait-tppu-rahmat-effendi,Nasional,2 tahun yang lalu
Kriteria Pekerja Dapat BLT Subsidi Gaji Rp1 Juta,https://www.cnnindonesia.com/ekonomi/20220408185418-532-782417/kriteria-pekerja-dapat-blt-subsidi-gaji-rp1-juta,Ekonomi,2 tahun yang lalu
"Sampah Plastik RI 7,9 Ton per Tahun, 20 Juta Kg Dikumpulkan Sejak 2018",https://www.cnnindonesia.com/teknologi/20220408094749-199-782025/sampah-plastik-ri-79-ton-per-tahun-20-juta-kg-dikumpulkan-sejak-2018,Teknologi,2 tahun yang lalu
VIDEO: Persoalan Stok Obat BPJS Kosong,https://www.cnnindonesia.com/tv/20220408125108-400-782139/video-persoalan-stok-obat-bpjs-kosong,TV,2 tahun yang lalu
Lima Tantangan Cegah Pencemaran Sampah Plastik di RI,https://www.cnnindonesia.com/teknologi/20220407202854-199-781882/lima-tantangan-cegah-pencemaran-sampah-plastik-di-ri,Teknologi,2 tahun yang lalu
Kemnaker Godok Mekanisme Subsidi Gaji 2022,https://www.cnnindonesia.com/ekonomi/20220406091628-532-780921/kemnaker-godok-mekanisme-subsidi-gaji-2022,Ekonomi,2 tahun yang lalu
Serikat Buruh Kritik Skema Bantuan Subsidi Gaji,https://www.cnnindonesia.com/ekonomi/20220405213340-92-780806/serikat-buruh-kritik-skema-bantuan-subsidi-gaji,Ekonomi,2 tahun yang lalu
VIDEO: BPJS Akan Leburkan Kelas Rawat Inap,https://www.cnnindonesia.com/tv/20220405215226-410-780811/video-bpjs-akan-leburkan-kelas-rawat-inap,TV,2 tahun yang lalu
VIDEO: BPJS Kesehatan Akan Leburkan Kelas Rawat Inap,https://www.cnnindonesia.com/tv/20220405115824-400-780437/video-bpjs-kesehatan-akan-leburkan-kelas-rawat-inap,TV,2 tahun yang lalu
Jasa Raharja Raih Penghargaan IRSMS Award Korlantas Polri,https://www.cnnindonesia.com/nasional/20220405115049-293-780422/jasa-raharja-raih-penghargaan-irsms-award-korlantas-polri,Nasional,2 tahun yang lalu
Cara Cek Penerima BLT Minyak Goreng,https://www.cnnindonesia.com/ekonomi/20220404072127-92-779761/cara-cek-penerima-blt-minyak-goreng,Ekonomi,2 tahun yang lalu
"Penipuan Kian Marak, Ketahui 7 Tips Hindari Asuransi Bodong",https://www.cnnindonesia.com/teknologi/20220331185350-303-778585/penipuan-kian-marak-ketahui-7-tips-hindari-asuransi-bodong,Teknologi,2 tahun yang lalu
3 Cara Cek Status BPJS Kesehatan Aktif atau Tidak 2022,https://www.cnnindonesia.com/ekonomi/20220329084455-83-777292/3-cara-cek-status-bpjs-kesehatan-aktif-atau-tidak-2022,Ekonomi,2 tahun yang lalu
Cara Mengganti No Hp yang Sudah Terdaftar di BPJS Kesehatan,https://www.cnnindonesia.com/ekonomi/20220328153151-83-777061/cara-mengganti-no-hp-yang-sudah-terdaftar-di-bpjs-kesehatan,Ekonomi,2 tahun yang lalu
Cara Ganti Faskes Dokter Gigi BPJS Kesehatan,https://www.cnnindonesia.com/ekonomi/20220322171927-83-774784/cara-ganti-faskes-dokter-gigi-bpjs-kesehatan,Ekonomi,2 tahun yang lalu
"Pandemi Covid, Kasus Bunuh Diri di Bali Naik Dua Kali Lipat",https://www.cnnindonesia.com/nasional/20220326194330-12-776568/pandemi-covid-kasus-bunuh-diri-di-bali-naik-dua-kali-lipat,Nasional,2 tahun yang lalu
Aplikasi PeduliLindungi Bakal Dirombak jika Pandemi Covid-19 Berakhir,https://www.cnnindonesia.com/nasional/20220326151659-20-776495/aplikasi-pedulilindungi-bakal-dirombak-jika-pandemi-covid-19-berakhir,Nasional,2 tahun yang lalu
Romo Syafi'i Dilaporkan ke MKD DPR Diduga Tak Penuhi Hak Pekerja,https://www.cnnindonesia.com/nasional/20220325161536-12-776202/romo-syafii-dilaporkan-ke-mkd-dpr-diduga-tak-penuhi-hak-pekerja,Nasional,2 tahun yang lalu
Moeldoko Ungkap Klaim RS Covid-19 Rp21 Triliun Belum Dibayar,https://www.cnnindonesia.com/nasional/20220325123325-20-776047/moeldoko-ungkap-klaim-rs-covid-19-rp21-triliun-belum-dibayar,Nasional,2 tahun yang lalu
Mencari Waktu Ideal Pencairan JHT,https://www.cnnindonesia.com/ekonomi/20220325060727-78-775881/mencari-waktu-ideal-pencairan-jht,Ekonomi,2 tahun yang lalu
PAN soal Cak Imin Persilakan Masuk Kabinet: Kami Cinta Banget,https://www.cnnindonesia.com/nasional/20220325112736-32-776024/pan-soal-cak-imin-persilakan-masuk-kabinet-kami-cinta-banget,Nasional,2 tahun yang lalu
Cak Imin Persilakan PAN Masuk Kabinet Selama Tak Ganggu PKB,https://www.cnnindonesia.com/nasional/20220324161605-32-775709/cak-imin-persilakan-pan-masuk-kabinet-selama-tak-ganggu-pkb,Nasional,2 tahun yang lalu
"Cara Menjadi Peserta JHT, Pekerja Nonformal Juga Bisa",https://www.cnnindonesia.com/ekonomi/20220324083538-78-775447/cara-menjadi-peserta-jht-pekerja-nonformal-juga-bisa,Ekonomi,2 tahun yang lalu
"Simulasi Hitung-hitungan JHT, Bantalan Pekerja di Hari Tua",https://www.cnnindonesia.com/ekonomi/20220320142114-78-773828/simulasi-hitung-hitungan-jht-bantalan-pekerja-di-hari-tua,Ekonomi,2 tahun yang lalu
Gaji Suka Cuma Lewat? Coba Strategi Ini Biar Bisa Investasi,https://www.cnnindonesia.com/teknologi/20220322215457-303-774900/gaji-suka-cuma-lewat-coba-strategi-ini-biar-bisa-investasi,Teknologi,2 tahun yang lalu
Crazy Rich Tahir Sumbang Rp2 M Tutup Tunggakan Peserta BPJS,https://www.cnnindonesia.com/ekonomi/20220322203948-92-774876/crazy-rich-tahir-sumbang-rp2-m-tutup-tunggakan-peserta-bpjs,Ekonomi,2 tahun yang lalu
Saat Sri Mulyani Puji Dua Crazy Rich RI Taat Pajak,https://www.cnnindonesia.com/ekonomi/20220322195311-92-774839/saat-sri-mulyani-puji-dua-crazy-rich-ri-taat-pajak,Ekonomi,2 tahun yang lalu
Tahir Foundation Kucurkan Rp2 Miliar Tutup Tunggakan Peserta JKN-KIS,https://www.cnnindonesia.com/ekonomi/20220322182601-83-774810/tahir-foundation-kucurkan-rp2-miliar-tutup-tunggakan-peserta-jkn-kis,Ekonomi,2 tahun yang lalu
Beda JHT dengan Jaminan Sosial Tenaga Kerja BPJS Lainnya,https://www.cnnindonesia.com/ekonomi/20220322120508-78-774585/beda-jht-dengan-jaminan-sosial-tenaga-kerja-bpjs-lainnya,Ekonomi,2 tahun yang lalu
Istana Pastikan Tak Ada Reshuffle Kabinet Besok,https://www.cnnindonesia.com/nasional/20220322155014-32-774732/istana-pastikan-tak-ada-reshuffle-kabinet-besok,Nasional,2 tahun yang lalu
3 Cara Mengubah Data BPJS Ketenagakerjaan,https://www.cnnindonesia.com/ekonomi/20220321115616-83-774120/3-cara-mengubah-data-bpjs-ketenagakerjaan,Ekonomi,2 tahun yang lalu
Setneg Bicara Isu Reshuffle: Gosip Politik Selalu Ada Jelang Rabu Pon,https://www.cnnindonesia.com/nasional/20220319194131-32-773657/setneg-bicara-isu-reshuffle-gosip-politik-selalu-ada-jelang-rabu-pon,Nasional,2 tahun yang lalu
VIDEO: Dana JHT Dipastikan Bisa Cair Sebelum 56 Tahun,https://www.cnnindonesia.com/tv/20220317141506-405-772604/video-dana-jht-dipastikan-bisa-cair-sebelum-56-tahun,TV,2 tahun yang lalu
Syarat Pencairan JHT Terbaru,https://www.cnnindonesia.com/ekonomi/20220316181854-92-772234/syarat-pencairan-jht-terbaru,Ekonomi,2 tahun yang lalu
VIDEO: Viral Warga Bulukumba Wafat Saat Rekam E-KTP di Dukcapil,https://www.cnnindonesia.com/nasional/20220316171841-24-772196/video-viral-warga-bulukumba-wafat-saat-rekam-e-ktp-di-dukcapil,Nasional,2 tahun yang lalu
Kemendagri Buka Suara Lansia Wafat Kala Antre Rekam e-KTP di Bulukumba,https://www.cnnindonesia.com/nasional/20220316143852-20-772096/kemendagri-buka-suara-lansia-wafat-kala-antre-rekam-e-ktp-di-bulukumba,Nasional,2 tahun yang lalu
Menaker Permudah Syarat Pencairan JHT,https://www.cnnindonesia.com/ekonomi/20220316131011-92-772007/menaker-permudah-syarat-pencairan-jht,Ekonomi,2 tahun yang lalu
Menaker Beri Opsi Usia Pensiun Buruh untuk Cairkan JHT,https://www.cnnindonesia.com/ekonomi/20220316132231-92-772022/menaker-beri-opsi-usia-pensiun-buruh-untuk-cairkan-jht,Ekonomi,2 tahun yang lalu
Buruh Boleh Cairkan JHT 1 Bulan Setelah di PHK Atau Resign,https://www.cnnindonesia.com/ekonomi/20220316130754-92-772006/buruh-boleh-cairkan-jht-1-bulan-setelah-di-phk-atau-resign,Ekonomi,2 tahun yang lalu
Viral Lansia Wafat saat Rekam e-KTP demi Operasi Pakai BPJS Kesehatan,https://www.cnnindonesia.com/nasional/20220316130633-20-772005/viral-lansia-wafat-saat-rekam-e-ktp-demi-operasi-pakai-bpjs-kesehatan,Nasional,2 tahun yang lalu
3 Perawatan Gagal Ginjal yang Ditanggung BPJS Kesehatan,https://www.cnnindonesia.com/ekonomi/20220311103049-83-769772/3-perawatan-gagal-ginjal-yang-ditanggung-bpjs-kesehatan,Ekonomi,2 tahun yang lalu
Cara Klaim JKP Korban PHK,https://www.cnnindonesia.com/ekonomi/20220311072844-78-769707/cara-klaim-jkp-korban-phk,Ekonomi,2 tahun yang lalu
Menaker Pastikan JKP Tak Hapus Kewajiban Pengusaha Bayar Pesangon,https://www.cnnindonesia.com/ekonomi/20220310185829-92-769605/menaker-pastikan-jkp-tak-hapus-kewajiban-pengusaha-bayar-pesangon,Ekonomi,2 tahun yang lalu
"Pengobatan Gagal Ginjal Kuras Uang BPJS Kesehatan Rp6,5 T di 2021",https://www.cnnindonesia.com/ekonomi/20220310173739-78-769566/pengobatan-gagal-ginjal-kuras-uang-bpjs-kesehatan-rp65-t-di-2021,Ekonomi,2 tahun yang lalu
Cara Mencairkan BPJS Ketenagakerjaan Peserta yang Sudah Wafat,https://www.cnnindonesia.com/ekonomi/20220308141951-83-768277/cara-mencairkan-bpjs-ketenagakerjaan-peserta-yang-sudah-wafat,Ekonomi,2 tahun yang lalu
Buruh Desak DPR Pakai Hak Interpelasi untuk JHT Jumat Ini,https://www.cnnindonesia.com/ekonomi/20220309145202-92-768850/buruh-desak-dpr-pakai-hak-interpelasi-untuk-jht-jumat-ini,Ekonomi,3 tahun yang lalu
Cara dan Prosedur Menggunakan KIS untuk Perawatan Gigi,https://www.cnnindonesia.com/ekonomi/20220308110421-83-768158/cara-dan-prosedur-menggunakan-kis-untuk-perawatan-gigi,Ekonomi,3 tahun yang lalu
Cara Mudah Cek Status Terdaftar Bansos PKH Maret 2022,https://www.cnnindonesia.com/ekonomi/20220308184326-532-768455/cara-mudah-cek-status-terdaftar-bansos-pkh-maret-2022,Ekonomi,3 tahun yang lalu
Layanan Operasi yang Ditanggung BPJS Kesehatan dan Prosedurnya,https://www.cnnindonesia.com/ekonomi/20220307142631-83-767784/layanan-operasi-yang-ditanggung-bpjs-kesehatan-dan-prosedurnya,Ekonomi,3 tahun yang lalu
Polisi Ulur Bayar Pajak STNK Disertai Bukti Kepesertaan BPJS Kesehatan,https://www.cnnindonesia.com/otomotif/20220308114606-579-768177/polisi-ulur-bayar-pajak-stnk-disertai-bukti-kepesertaan-bpjs-kesehatan,Otomotif,3 tahun yang lalu
Perpanjang STNK dengan Kartu BPJS Bakal Dilakukan Bertahap,https://www.cnnindonesia.com/otomotif/20220304172844-579-766895/perpanjang-stnk-dengan-kartu-bpjs-bakal-dilakukan-bertahap,Otomotif,3 tahun yang lalu
Daftar 7 Perawatan Gigi yang Ditanggung BPJS Kesehatan,https://www.cnnindonesia.com/ekonomi/20220302154906-83-766003/daftar-7-perawatan-gigi-yang-ditanggung-bpjs-kesehatan,Ekonomi,3 tahun yang lalu
7 Keuntungan yang Didapatkan Anggota BPJS Kesehatan,https://www.cnnindonesia.com/ekonomi/20220302092124-83-765751/7-keuntungan-yang-didapatkan-anggota-bpjs-kesehatan,Ekonomi,3 tahun yang lalu
Kronologi Menaker Batalkan Aturan JHT Cair Usia 56 Tahun,https://www.cnnindonesia.com/ekonomi/20220302154228-78-765988/kronologi-menaker-batalkan-aturan-jht-cair-usia-56-tahun,Ekonomi,3 tahun yang lalu
Polisi Adang Mahasiswa Muhammadiyah Hendak Demo ke Istana,https://www.cnnindonesia.com/nasional/20220302151225-20-765961/polisi-adang-mahasiswa-muhammadiyah-hendak-demo-ke-istana,Nasional,3 tahun yang lalu
Menaker Batalkan Aturan JHT Hanya Boleh Cair Usia 56 Tahun,https://www.cnnindonesia.com/ekonomi/20220302120852-78-765842/menaker-batalkan-aturan-jht-hanya-boleh-cair-usia-56-tahun,Ekonomi,3 tahun yang lalu
BPJS Kesehatan Jadi Syarat Jual Beli Tanah Mulai Hari Ini,https://www.cnnindonesia.com/ekonomi/20220301124618-78-765305/bpjs-kesehatan-jadi-syarat-jual-beli-tanah-mulai-hari-ini,Ekonomi,3 tahun yang lalu
Memahami JKP Sebagai Bantalan Pekerja yang Kena PHK,https://www.cnnindonesia.com/ekonomi/20220224161443-82-763614/memahami-jkp-sebagai-bantalan-pekerja-yang-kena-phk,Ekonomi,3 tahun yang lalu
VIDEO: Aturan Transaksi Rumah/Tanah Wajib BPJS,https://www.cnnindonesia.com/tv/20220226154924-405-764471/video-aturan-transaksi-rumah-tanah-wajib-bpjs,TV,3 tahun yang lalu
Daftar Lengkap Penyakit yang Tidak Ditanggung BPJS Kesehatan,https://www.cnnindonesia.com/gaya-hidup/20220225160955-260-764153/daftar-lengkap-penyakit-yang-tidak-ditanggung-bpjs-kesehatan,Gaya Hidup,3 tahun yang lalu
Dampak Syarat Baru BPJS untuk Perpanjang STNK Jika Tak Selaras,https://www.cnnindonesia.com/otomotif/20220225194036-579-764286/dampak-syarat-baru-bpjs-untuk-perpanjang-stnk-jika-tak-selaras,Otomotif,3 tahun yang lalu
"Pekerja Tuntut Transparansi BPJS Terkait Rp3,1 M Buat Main Golf",https://www.cnnindonesia.com/ekonomi/20220225154052-92-764121/pekerja-tuntut-transparansi-bpjs-terkait-rp31-m-buat-main-golf,Ekonomi,3 tahun yang lalu
Ojol Bakal Surati Jokowi soal Keberatan BPJS Syarat Bikin SIM-STNK,https://www.cnnindonesia.com/otomotif/20220225172605-579-764209/ojol-bakal-surati-jokowi-soal-keberatan-bpjs-syarat-bikin-sim-stnk,Otomotif,3 tahun yang lalu
Daftar Penyakit yang Ditanggung BPJS Kesehatan,https://www.cnnindonesia.com/ekonomi/20220224171443-83-763658/daftar-penyakit-yang-ditanggung-bpjs-kesehatan,Ekonomi,3 tahun yang lalu
"Tak Dapat BPJS, Ojol Tolak Syarat Baru Jokowi untuk Urus SIM dan STNK",https://www.cnnindonesia.com/otomotif/20220225120350-579-763999/tak-dapat-bpjs-ojol-tolak-syarat-baru-jokowi-untuk-urus-sim-dan-stnk,Otomotif,3 tahun yang lalu
VIDEO: Maju Mundur Aturan BPJS Kesehatan Satu Harga,https://www.cnnindonesia.com/tv/20220225085318-434-763906/video-maju-mundur-aturan-bpjs-kesehatan-satu-harga,TV,3 tahun yang lalu
Aturan JHT di UU Cipta Kerja Digugat ke Mahkamah Konstitusi,https://www.cnnindonesia.com/nasional/20220225074008-12-763871/aturan-jht-di-uu-cipta-kerja-digugat-ke-mahkamah-konstitusi,Nasional,3 tahun yang lalu
Syarat BPJS Kesehatan Dinilai Bikin Warga Malas Urus SIM dan STNK,https://www.cnnindonesia.com/otomotif/20220224150328-579-763562/syarat-bpjs-kesehatan-dinilai-bikin-warga-malas-urus-sim-dan-stnk,Otomotif,3 tahun yang lalu
Muhadjir Soal BPJS Syarat Urus Dokumen: Bukan untuk Beratkan Rakyat,https://www.cnnindonesia.com/nasional/20220224184543-20-763731/muhadjir-soal-bpjs-syarat-urus-dokumen-bukan-untuk-beratkan-rakyat,Nasional,3 tahun yang lalu
Jumlah Pengguna Dompet Digital DANA Tembus 100 Juta,https://www.cnnindonesia.com/teknologi/20220225093143-303-763919/jumlah-pengguna-dompet-digital-dana-tembus-100-juta,Teknologi,3 tahun yang lalu
BPJS Bantah Isu Ambil Duit Masyarakat dari Kewajiban Jadi Peserta,https://www.cnnindonesia.com/ekonomi/20220224151448-92-763568/bpjs-bantah-isu-ambil-duit-masyarakat-dari-kewajiban-jadi-peserta,Ekonomi,3 tahun yang lalu
BPJS Kesehatan Syarat Wajib Bagi Calon Jemaah Haji Plus,https://www.cnnindonesia.com/ekonomi/20220224141618-78-763514/bpjs-kesehatan-syarat-wajib-bagi-calon-jemaah-haji-plus,Ekonomi,3 tahun yang lalu
BPJS Ketenagakerjaan Dituding Biayai Main Golf hingga Rp3 M,https://www.cnnindonesia.com/ekonomi/20220224113604-78-763386/bpjs-ketenagakerjaan-dituding-biayai-main-golf-hingga-rp3-m,Ekonomi,3 tahun yang lalu
"VIDEO: Belum Selesai Revisi JHT, Muncul Polemik JKP",https://www.cnnindonesia.com/tv/20220223202034-409-763174/video-belum-selesai-revisi-jht-muncul-polemik-jkp,TV,3 tahun yang lalu
Menaker Ida Fauziyah: Permenaker JHT akan Saya Revisi,https://www.cnnindonesia.com/ekonomi/20220223201150-92-763168/menaker-ida-fauziyah-permenaker-jht-akan-saya-revisi,Ekonomi,3 tahun yang lalu
BPJS Watch: JKP Tetap Berjalan Meski JHT Direvisi,https://www.cnnindonesia.com/ekonomi/20220223172706-78-763097/bpjs-watch-jkp-tetap-berjalan-meski-jht-direvisi,Ekonomi,3 tahun yang lalu
BPJS Watch soal Revisi JHT: Apa Yang Mau Direvisi?,https://www.cnnindonesia.com/ekonomi/20220223182514-78-763131/bpjs-watch-soal-revisi-jht-apa-yang-mau-direvisi,Ekonomi,3 tahun yang lalu
"Moeldoko: Masyarakat Mampu Beli Tanah, Tak Masalah Bayar Iuran BPJS",https://www.cnnindonesia.com/nasional/20220223181213-20-763126/moeldoko-masyarakat-mampu-beli-tanah-tak-masalah-bayar-iuran-bpjs,Nasional,3 tahun yang lalu
ITW soal Bikin SIM dan STNK Harus Punya BPJS: Sarat Pemaksaan,https://www.cnnindonesia.com/otomotif/20220223154129-579-763030/itw-soal-bikin-sim-dan-stnk-harus-punya-bpjs-sarat-pemaksaan,Otomotif,3 tahun yang lalu
Nasib JKP di Tengah Restu Jokowi Otak-Atik JHT,https://www.cnnindonesia.com/ekonomi/20220223065220-78-762735/nasib-jkp-di-tengah-restu-jokowi-otak-atik-jht,Ekonomi,3 tahun yang lalu
Kemnaker Siapkan Kuota 720 Ribu Untuk Korban PHK via JKP,https://www.cnnindonesia.com/ekonomi/20220222152822-92-762493/kemnaker-siapkan-kuota-720-ribu-untuk-korban-phk-via-jkp,Ekonomi,3 tahun yang lalu
"Polri Siap Ubah Aturan SIM dan STNK, Sesuaikan Syarat BPJS Kesehatan",https://www.cnnindonesia.com/otomotif/20220222140750-579-762435/polri-siap-ubah-aturan-sim-dan-stnk-sesuaikan-syarat-bpjs-kesehatan,Otomotif,3 tahun yang lalu
Serikat Pekerja Apresiasi Titah Jokowi Revisi JHT,https://www.cnnindonesia.com/ekonomi/20220222183500-92-762609/serikat-pekerja-apresiasi-titah-jokowi-revisi-jht,Ekonomi,3 tahun yang lalu
VIDEO: Strategi 'Hero' Jokowi Soal Pencairan JHT 56 Tahun,https://www.cnnindonesia.com/tv/20220222192344-407-762630/video-strategi-hero-jokowi-soal-pencairan-jht-56-tahun,TV,3 tahun yang lalu
Kemenkeu Anggarkan Dana JKP Rp900 Miliar Tahun Ini,https://www.cnnindonesia.com/ekonomi/20220222184533-532-762617/kemenkeu-anggarkan-dana-jkp-rp900-miliar-tahun-ini,Ekonomi,3 tahun yang lalu
48 Peserta BPJS Ketenagakerjaan Klaim JKP,https://www.cnnindonesia.com/ekonomi/20220222174620-92-762582/48-peserta-bpjs-ketenagakerjaan-klaim-jkp,Ekonomi,3 tahun yang lalu
VIDEO: Jokowi Perintahkan Aturan Baru JHT Direvisi,https://www.cnnindonesia.com/tv/20220222165736-405-762552/video-jokowi-perintahkan-aturan-baru-jht-direvisi,TV,3 tahun yang lalu
"Sejumlah Pekerja Dapat Email Terdaftar JKP, Kamu?",https://www.cnnindonesia.com/ekonomi/20220222145805-92-762462/sejumlah-pekerja-dapat-email-terdaftar-jkp-kamu,Ekonomi,3 tahun yang lalu
Daftar Layanan dan Penyakit yang Tidak Ditanggung BPJS Kesehatan,https://www.cnnindonesia.com/ekonomi/20220217102922-83-760334/daftar-layanan-dan-penyakit-yang-tidak-ditanggung-bpjs-kesehatan,Ekonomi,3 tahun yang lalu
"Buruh KSPI Tolak JKP, Tuding Salahi Aturan",https://www.cnnindonesia.com/ekonomi/20220222120416-78-762335/buruh-kspi-tolak-jkp-tuding-salahi-aturan,Ekonomi,3 tahun yang lalu
Alasan JKP Batal Diluncurkan oleh Jokowi Hari Ini,https://www.cnnindonesia.com/ekonomi/20220222104527-92-762292/alasan-jkp-batal-diluncurkan-oleh-jokowi-hari-ini,Ekonomi,3 tahun yang lalu
JKP Batal Diluncurkan Jokowi Hari Ini,https://www.cnnindonesia.com/ekonomi/20220222101326-78-762264/jkp-batal-diluncurkan-jokowi-hari-ini,Ekonomi,3 tahun yang lalu
VIDEO: Kartu BPJS Kesehatan Jadi Syarat Urus Dokumen,https://www.cnnindonesia.com/tv/20220222083346-407-762212/video-kartu-bpjs-kesehatan-jadi-syarat-urus-dokumen,TV,3 tahun yang lalu
Pengamat soal JKP di Tengah Polemik JHT: Tak Konsisten,https://www.cnnindonesia.com/ekonomi/20220222080505-532-762197/pengamat-soal-jkp-di-tengah-polemik-jht-tak-konsisten,Ekonomi,3 tahun yang lalu
Mengenal JKP Pengganti JHT yang Diluncurkan Jokowi Hari Ini,https://www.cnnindonesia.com/ekonomi/20220222073040-92-762190/mengenal-jkp-pengganti-jht-yang-diluncurkan-jokowi-hari-ini,Ekonomi,3 tahun yang lalu
Jokowi Dijadwalkan Resmikan Program JKP Besok,https://www.cnnindonesia.com/ekonomi/20220221150343-532-761958/jokowi-dijadwalkan-resmikan-program-jkp-besok,Ekonomi,3 tahun yang lalu
"VIDEO: BPJS Kesehatan Jadi ""Kartu Sakti"" untuk Mengurus Layanan Publik",https://www.cnnindonesia.com/tv/20220221185303-405-762090/video-bpjs-kesehatan-jadi-kartu-sakti-untuk-mengurus-layanan-publik,TV,3 tahun yang lalu
"Buruh Tetap Tolak JHT, Opsi Mogok Kerja Mencuat",https://www.cnnindonesia.com/nasional/20220221163942-20-762035/buruh-tetap-tolak-jht-opsi-mogok-kerja-mencuat,Nasional,3 tahun yang lalu
Luhut: Komorbid Diabetes Terbanyak Sumbang Kematian Covid,https://www.cnnindonesia.com/nasional/20220221152742-20-761967/luhut-komorbid-diabetes-terbanyak-sumbang-kematian-covid,Nasional,3 tahun yang lalu
PKS Kritik BPJS Jadi Syarat Jual-Beli Tanah: Pemerintah Putus Asa,https://www.cnnindonesia.com/nasional/20220221133027-32-761912/pks-kritik-bpjs-jadi-syarat-jual-beli-tanah-pemerintah-putus-asa,Nasional,3 tahun yang lalu
PKS: JHT Cair Usia 56 Tahun Turunkan Kepuasan Publik ke Jokowi,https://www.cnnindonesia.com/nasional/20220221144855-20-761953/pks-jht-cair-usia-56-tahun-turunkan-kepuasan-publik-ke-jokowi,Nasional,3 tahun yang lalu
"Desak Aturan JHT Dicabut, Buruh KASBI Geruduk Kemenaker Rabu",https://www.cnnindonesia.com/nasional/20220221142055-20-761939/desak-aturan-jht-dicabut-buruh-kasbi-geruduk-kemenaker-rabu,Nasional,3 tahun yang lalu
3 Cara Mengetahui Nomor BPJS Ketenagakerjaan yang Hilang Secara Online,https://www.cnnindonesia.com/ekonomi/20220215165649-83-759526/3-cara-mengetahui-nomor-bpjs-ketenagakerjaan-yang-hilang-secara-online,Ekonomi,3 tahun yang lalu
"Survei Litbang Kompas: Kepuasan Publik ke Jokowi 73,9 Persen",https://www.cnnindonesia.com/nasional/20220221115306-32-761841/survei-litbang-kompas-kepuasan-publik-ke-jokowi-739-persen,Nasional,3 tahun yang lalu
Alasan Kartu BPJS Kesehatan Jadi Syarat Jual Beli Tanah Hingga SIM,https://www.cnnindonesia.com/ekonomi/20220221101128-78-761768/alasan-kartu-bpjs-kesehatan-jadi-syarat-jual-beli-tanah-hingga-sim,Ekonomi,3 tahun yang lalu
DPR: Instruksi Jokowi Kartu BPJS Jadi Syarat Beli Tanah Absurd,https://www.cnnindonesia.com/nasional/20220221093737-32-761748/dpr-instruksi-jokowi-kartu-bpjs-jadi-syarat-beli-tanah-absurd,Nasional,3 tahun yang lalu
Cara Cek Status BPJS Kesehatan yang Kini Jadi Syarat Bikin SIM,https://www.cnnindonesia.com/teknologi/20220221095742-185-761759/cara-cek-status-bpjs-kesehatan-yang-kini-jadi-syarat-bikin-sim,Teknologi,3 tahun yang lalu
"Instruksi Jokowi Soal BPJS Kesehatan Trending Topic, Netizen Bingung",https://www.cnnindonesia.com/teknologi/20220221082035-192-761716/instruksi-jokowi-soal-bpjs-kesehatan-trending-topic-netizen-bingung,Teknologi,3 tahun yang lalu
"JKP Pengganti JHT Bakal Meluncur Besok, 22 Februari 2022",https://www.cnnindonesia.com/ekonomi/20220221081146-78-761714/jkp-pengganti-jht-bakal-meluncur-besok-22-februari-2022,Ekonomi,3 tahun yang lalu
"Jokowi Tambah Syarat Bikin SIM dan STNK, Kini Butuh BPJS Kesehatan",https://www.cnnindonesia.com/otomotif/20220221070244-579-761696/jokowi-tambah-syarat-bikin-sim-dan-stnk-kini-butuh-bpjs-kesehatan,Otomotif,3 tahun yang lalu
Daftar Layanan Publik dengan Syarat Kartu BPJS Kesehatan,https://www.cnnindonesia.com/ekonomi/20220221070516-78-761698/daftar-layanan-publik-dengan-syarat-kartu-bpjs-kesehatan,Ekonomi,3 tahun yang lalu
"BPJS Jadi Syarat Urus SIM, STNK, Naik Haji, hingga Jual Beli Tanah",https://www.cnnindonesia.com/ekonomi/20220220082622-92-761468/bpjs-jadi-syarat-urus-sim-stnk-naik-haji-hingga-jual-beli-tanah,Ekonomi,3 tahun yang lalu
Warga Respons BPJS Kesehatan Jadi Syarat SIM: Malah Menghambat,https://www.cnnindonesia.com/nasional/20220219195218-20-761395/warga-respons-bpjs-kesehatan-jadi-syarat-sim-malah-menghambat,Nasional,3 tahun yang lalu
VIDEO: Polemik Kartu BPJS Kesehatan Jadi Syarat Jual Beli Tanah,https://www.cnnindonesia.com/tv/20220220194821-407-761633/video-polemik-kartu-bpjs-kesehatan-jadi-syarat-jual-beli-tanah,TV,3 tahun yang lalu
Hujan Kritik Buruh ke Menaker Ida Fauziyah soal JHT,https://www.cnnindonesia.com/ekonomi/20220220131356-92-761555/hujan-kritik-buruh-ke-menaker-ida-fauziyah-soal-jht,Ekonomi,3 tahun yang lalu
Warga Keberatan BPJS Jadi Syarat Umroh: Semakin Ribet Birokrasi,https://www.cnnindonesia.com/nasional/20220219203343-20-761401/warga-keberatan-bpjs-jadi-syarat-umroh-semakin-ribet-birokrasi,Nasional,3 tahun yang lalu
Warga soal Kartu BPJS Kesehatan buat Jual Beli Tanah: Tak Ada Kolerasi,https://www.cnnindonesia.com/nasional/20220219205205-20-761404/warga-soal-kartu-bpjs-kesehatan-buat-jual-beli-tanah-tak-ada-kolerasi,Nasional,3 tahun yang lalu
Janji Menaker: Mudah Cairkan JHT Cukup Pakai NIK,https://www.cnnindonesia.com/ekonomi/20220220093557-92-761486/janji-menaker-mudah-cairkan-jht-cukup-pakai-nik,Ekonomi,3 tahun yang lalu
Viral 'Valentino Rossi' Tunggu JHT Sampai Tua,https://www.cnnindonesia.com/olahraga/20220220080914-156-761462/viral-valentino-rossi-tunggu-jht-sampai-tua,Olahraga,3 tahun yang lalu
DPR Minta Batalkan Aturan Jual Beli Tanah Wajib Punya Kartu BPJS,https://www.cnnindonesia.com/nasional/20220219202720-32-761400/dpr-minta-batalkan-aturan-jual-beli-tanah-wajib-punya-kartu-bpjs,Nasional,3 tahun yang lalu
Said Iqbal Soal JHT Bentuk Sayang Pemerintah : Kasih Sayang Apanya?,https://www.cnnindonesia.com/nasional/20220219164010-20-761343/said-iqbal-soal-jht-bentuk-sayang-pemerintah-kasih-sayang-apanya,Nasional,3 tahun yang lalu
Menaker Sebut Pencairan JHT Kelak Lebih Mudah: Cukup Pakai NIK,https://www.cnnindonesia.com/ekonomi/20220219152902-92-761331/menaker-sebut-pencairan-jht-kelak-lebih-mudah-cukup-pakai-nik,Ekonomi,3 tahun yang lalu
