Judul,Link,Kategori,Tanggal Upload
Pengguna Dompet Aman Kian Nyaman Bayar JKN-KIS,https://www.cnnindonesia.com/ekonomi/20201218155224-83-583927/pengguna-dompet-aman-kian-nyaman-bayar-jkn-kis,Ekonomi,4 tahun yang lalu
"Bertambah 6.689 Kasus, Total Positif Corona 650.197",https://www.cnnindonesia.com/nasional/20201218133249-20-583830/bertambah-6689-kasus-total-positif-corona-650197,Nasional,4 tahun yang lalu
"Jokowi: Vaksin Gratis Tak Terkait BPJS, Semua Warga Bisa Ikut",https://www.cnnindonesia.com/nasional/20201218144353-20-583874/jokowi-vaksin-gratis-tak-terkait-bpjs-semua-warga-bisa-ikut,Nasional,4 tahun yang lalu
Dahlan Iskan Ingatkan Tantangan Pemerintah Gratiskan Vaksin,https://www.cnnindonesia.com/ekonomi/20201218132624-92-583827/dahlan-iskan-ingatkan-tantangan-pemerintah-gratiskan-vaksin,Ekonomi,4 tahun yang lalu
"Vaksin Gratis Tak Terkait BPJS, Kemenkes Ungkap 2 Syarat",https://www.cnnindonesia.com/nasional/20201218140415-20-583848/vaksin-gratis-tak-terkait-bpjs-kemenkes-ungkap-2-syarat,Nasional,4 tahun yang lalu
Vaksin Corona Bersyarat Langgar Hak Hidup Sehat Rakyat,https://www.cnnindonesia.com/ekonomi/20201218124143-532-583807/vaksin-corona-bersyarat-langgar-hak-hidup-sehat-rakyat,Ekonomi,4 tahun yang lalu
Menilik Cara Pemerintah Mendata Peserta Vaksin Corona Gratis,https://www.cnnindonesia.com/ekonomi/20201218081633-92-583675/menilik-cara-pemerintah-mendata-peserta-vaksin-corona-gratis,Ekonomi,4 tahun yang lalu
Jubir: Enam Merek Vaksin Corona Diberikan Gratis,https://www.cnnindonesia.com/nasional/20201218080831-20-583681/jubir-enam-merek-vaksin-corona-diberikan-gratis,Nasional,4 tahun yang lalu
Kemenkes: Vaksin Gratis untuk Seluruh Rakyat Tak Terkait BPJS,https://www.cnnindonesia.com/nasional/20201218072617-20-583665/kemenkes-vaksin-gratis-untuk-seluruh-rakyat-tak-terkait-bpjs,Nasional,4 tahun yang lalu
BPJS Kesehatan Buka Suara Soal Penyaluran Vaksin Covid Gratis,https://www.cnnindonesia.com/ekonomi/20201217154803-78-583478/bpjs-kesehatan-buka-suara-soal-penyaluran-vaksin-covid-gratis,Ekonomi,4 tahun yang lalu
Pemerintah Pertimbangkan Syarat Vaksin Gratis Peserta BPJS,https://www.cnnindonesia.com/nasional/20201217154459-20-583472/pemerintah-pertimbangkan-syarat-vaksin-gratis-peserta-bpjs,Nasional,4 tahun yang lalu
Rosy Angkat Jempol untuk Layanan Kesehatan JKN-KIS,https://www.cnnindonesia.com/ekonomi/20201217111428-83-583298/rosy-angkat-jempol-untuk-layanan-kesehatan-jkn-kis,Ekonomi,4 tahun yang lalu
BPJS Kesehatan Optimal Perbaiki Kualitas Layanan di Faskes,https://www.cnnindonesia.com/ekonomi/20201216190630-83-583107/bpjs-kesehatan-optimal-perbaiki-kualitas-layanan-di-faskes,Ekonomi,4 tahun yang lalu
"Jokowi Gratiskan Vaksin Corona, DPR Minta Perbaiki Data",https://www.cnnindonesia.com/nasional/20201216161551-32-583003/jokowi-gratiskan-vaksin-corona-dpr-minta-perbaiki-data,Nasional,4 tahun yang lalu
BPJS Tenaker Ikut Beri Vaksin Corona Gratis ke Peserta,https://www.cnnindonesia.com/ekonomi/20201216141922-78-582911/bpjs-tenaker-ikut-beri-vaksin-corona-gratis-ke-peserta,Ekonomi,4 tahun yang lalu
66.924 Rekening Calon Penerima BLT Pekerja Masih Bermasalah,https://www.cnnindonesia.com/ekonomi/20201216130703-532-582857/66924-rekening-calon-penerima-blt-pekerja-masih-bermasalah,Ekonomi,4 tahun yang lalu
Konsultasi Kesehatan Lebih Mudah Lewat Aplikasi Mobile JKN,https://www.cnnindonesia.com/ekonomi/20201216120919-83-582835/konsultasi-kesehatan-lebih-mudah-lewat-aplikasi-mobile-jkn,Ekonomi,4 tahun yang lalu
Politikus PAN: Pemerintah Sanggup Gratiskan Vaksin Covid-19,https://www.cnnindonesia.com/nasional/20201215153658-32-582423/politikus-pan-pemerintah-sanggup-gratiskan-vaksin-covid-19,Nasional,4 tahun yang lalu
Pengusaha Minta Negara Beri Vaksin Gratis ke Semua Warga,https://www.cnnindonesia.com/ekonomi/20201215153238-92-582412/pengusaha-minta-negara-beri-vaksin-gratis-ke-semua-warga,Ekonomi,4 tahun yang lalu
"Punya Kartu JKN-KIS, Djiu Djin Tenang Hadapi Musibah Sakit",https://www.cnnindonesia.com/ekonomi/20201215145311-83-582390/punya-kartu-jkn-kis-djiu-djin-tenang-hadapi-musibah-sakit,Ekonomi,4 tahun yang lalu
"Vaksinasi Mandiri Covid-19, Warga Harus Daftar ke Faskes",https://www.cnnindonesia.com/nasional/20201215121119-20-582278/vaksinasi-mandiri-covid-19-warga-harus-daftar-ke-faskes,Nasional,4 tahun yang lalu
Teknis Vaksin Covid: Warga Akan Dikirim SMS dan Daftar Ulang,https://www.cnnindonesia.com/nasional/20201215114334-20-582264/teknis-vaksin-covid-warga-akan-dikirim-sms-dan-daftar-ulang,Nasional,4 tahun yang lalu
Vaksin Berbayar & Ikrar Jokowi Utamakan Kesehatan Rakyat,https://www.cnnindonesia.com/nasional/20201215065408-20-582135/vaksin-berbayar-ikrar-jokowi-utamakan-kesehatan-rakyat,Nasional,4 tahun yang lalu
Pemerintah Salurkan BSU Termin II ke 11 Juta Pekerja,https://www.cnnindonesia.com/ekonomi/20201214104742-537-581722/pemerintah-salurkan-bsu-termin-ii-ke-11-juta-pekerja,Ekonomi,4 tahun yang lalu
"OJK: Aset Lembaga Pembiayaan Minus 6,2 Persen per Oktober",https://www.cnnindonesia.com/ekonomi/20201214144809-78-581892/ojk-aset-lembaga-pembiayaan-minus-62-persen-per-oktober,Ekonomi,4 tahun yang lalu
Kepatuhan 3M Jadi Suntikan Semangat Relawan Covid-19,https://www.cnnindonesia.com/nasional/20201214120405-25-581773/kepatuhan-3m-jadi-suntikan-semangat-relawan-covid-19,Nasional,4 tahun yang lalu
Pasien Dapatkan Kepastian Layanan di Antrean Online JKN-KIS,https://www.cnnindonesia.com/nasional/20201214140815-25-581862/pasien-dapatkan-kepastian-layanan-di-antrean-online-jkn-kis,Nasional,4 tahun yang lalu
Gratiskan Vaksin Kami,https://www.cnnindonesia.com/nasional/20201213215832-21-581618/gratiskan-vaksin-kami,Nasional,4 tahun yang lalu
BLT Subsidi Gaji Cair untuk 636 Ribu Guru Honorer,https://www.cnnindonesia.com/ekonomi/20201214075245-532-581663/blt-subsidi-gaji-cair-untuk-636-ribu-guru-honorer,Ekonomi,4 tahun yang lalu
Bantuan Subsidi Upah Tahap 2 Bisa Diwariskan,https://www.cnnindonesia.com/nasional/20201212161857-25-581324/bantuan-subsidi-upah-tahap-2-bisa-diwariskan,Nasional,4 tahun yang lalu
Tip Siapkan Dana untuk Vaksin Corona Mandiri,https://www.cnnindonesia.com/ekonomi/20201211132923-83-580914/tip-siapkan-dana-untuk-vaksin-corona-mandiri,Ekonomi,4 tahun yang lalu
"11,02 Juta Pekerja Telah Kantongi BLT Termin II",https://www.cnnindonesia.com/ekonomi/20201211204530-532-581180/1102-juta-pekerja-telah-kantongi-blt-termin-ii,Ekonomi,4 tahun yang lalu
Cerita Cucu soal JKN KIS Bantu Rawat Jantung Koroner Nenek,https://www.cnnindonesia.com/ekonomi/20201211140537-83-580930/cerita-cucu-soal-jkn-kis-bantu-rawat-jantung-koroner-nenek,Ekonomi,4 tahun yang lalu
"Cukai Rokok Memang Harus Naik, Tapi Bukan Demi Prevalensi",https://www.cnnindonesia.com/ekonomi/20201211081003-532-580776/cukai-rokok-memang-harus-naik-tapi-bukan-demi-prevalensi,Ekonomi,4 tahun yang lalu
BPJS Kesehatan Siap Sambut Tantangan Era 'Ageing Population',https://www.cnnindonesia.com/ekonomi/20201210185748-83-580666/bpjs-kesehatan-siap-sambut-tantangan-era-ageing-population,Ekonomi,4 tahun yang lalu
Program Vaksinasi Corona RI Sasar 107 Juta Jiwa,https://www.cnnindonesia.com/ekonomi/20201210152839-532-580567/program-vaksinasi-corona-ri-sasar-107-juta-jiwa,Ekonomi,4 tahun yang lalu
Suwignyo Takjub Terima Manfaat Program JKN-KIS,https://www.cnnindonesia.com/ekonomi/20201210112709-83-580418/suwignyo-takjub-terima-manfaat-program-jkn-kis,Ekonomi,4 tahun yang lalu
Ani Rasakan Kepedulian Pemerintah Lewat Program JKN-KIS,https://www.cnnindonesia.com/ekonomi/20201210112428-83-580417/ani-rasakan-kepedulian-pemerintah-lewat-program-jkn-kis,Ekonomi,4 tahun yang lalu
Jumlah Penerima Vaksin Covid-19 Mandiri Belum Final,https://www.cnnindonesia.com/ekonomi/20201209130711-532-579913/jumlah-penerima-vaksin-covid-19-mandiri-belum-final,Ekonomi,4 tahun yang lalu
MONIKS dari BPJS Kesehatan Tuai Penghargaan Internasional,https://www.cnnindonesia.com/ekonomi/20201209112946-83-579839/moniks-dari-bpjs-kesehatan-tuai-penghargaan-internasional,Ekonomi,4 tahun yang lalu
Menaksir Biaya Buat Semua Warga Dapat Vaksin Corona Gratis,https://www.cnnindonesia.com/ekonomi/20201209092403-532-579776/menaksir-biaya-buat-semua-warga-dapat-vaksin-corona-gratis,Ekonomi,4 tahun yang lalu
BPJS Kesehatan-KUMPUL Gelar Kompetisi BPJS Visualthon 2020,https://www.cnnindonesia.com/ekonomi/20201208214923-83-579634/bpjs-kesehatan-kumpul-gelar-kompetisi-bpjs-visualthon-2020,Ekonomi,4 tahun yang lalu
Anggota DPR Minta Vaksin Gratis untuk Peserta BPJS Kesehatan,https://www.cnnindonesia.com/nasional/20201208172244-32-579513/anggota-dpr-minta-vaksin-gratis-untuk-peserta-bpjs-kesehatan,Nasional,4 tahun yang lalu
"Tak Alami Perbedaan Layanan, Risni Lega Jadi Peserta JKN-KIS",https://www.cnnindonesia.com/ekonomi/20201208170524-83-579509/tak-alami-perbedaan-layanan-risni-lega-jadi-peserta-jkn-kis,Ekonomi,4 tahun yang lalu
"Tak Dapat Bansos Corona, Buruh Perempuan Sulit Cari Makan",https://www.cnnindonesia.com/nasional/20201208132347-20-579362/tak-dapat-bansos-corona-buruh-perempuan-sulit-cari-makan,Nasional,4 tahun yang lalu
Alasan Seluruh Vaksin Corona Mustahil Gratis di RI,https://www.cnnindonesia.com/ekonomi/20201208094855-92-579244/alasan-seluruh-vaksin-corona-mustahil-gratis-di-ri,Ekonomi,4 tahun yang lalu
Desakan Koruptor Bansos Covid-19 Dihukum Berat & Celah Rasuah,https://www.cnnindonesia.com/nasional/20201208010821-12-579153/desakan-koruptor-bansos-covid-19-dihukum-berat-celah-rasuah,Nasional,4 tahun yang lalu
Peserta Apresiasi Layanan Nontatap Muka BPJS Kesehatan,https://www.cnnindonesia.com/ekonomi/20201207132047-83-578891/peserta-apresiasi-layanan-nontatap-muka-bpjs-kesehatan,Ekonomi,4 tahun yang lalu
Melihat Rincian dan Komposisi Calon Penerima Vaksin Corona,https://www.cnnindonesia.com/ekonomi/20201207134409-532-578910/melihat-rincian-dan-komposisi-calon-penerima-vaksin-corona,Ekonomi,4 tahun yang lalu
"Machfud Tuding Tak Paham IPKM, Eri Janji Tanggung BPJS",https://www.cnnindonesia.com/nasional/20201206024729-32-578491/machfud-tuding-tak-paham-ipkm-eri-janji-tanggung-bpjs,Nasional,4 tahun yang lalu
BPJS Kesehatan: Penyesuaian Iuran Diiringi Kepuasan Peserta,https://www.cnnindonesia.com/ekonomi/20201204180552-83-578162/bpjs-kesehatan-penyesuaian-iuran-diiringi-kepuasan-peserta,Ekonomi,4 tahun yang lalu
Jadi Peserta JKN-KIS Sulut Semangat Sembuh Anifa,https://www.cnnindonesia.com/ekonomi/20201203165743-83-577666/jadi-peserta-jkn-kis-sulut-semangat-sembuh-anifa,Ekonomi,4 tahun yang lalu
"Jadi Peserta JKN-KIS, Operasi Kuswati Total Ditanggung BPJS",https://www.cnnindonesia.com/ekonomi/20201202153818-83-577145/jadi-peserta-jkn-kis-operasi-kuswati-total-ditanggung-bpjs,Ekonomi,4 tahun yang lalu
"Jokowi Potong Subsidi, BPJS Kesehatan Kelas III Naik 2021",https://www.cnnindonesia.com/ekonomi/20201202115917-532-576997/jokowi-potong-subsidi-bpjs-kesehatan-kelas-iii-naik-2021,Ekonomi,4 tahun yang lalu
Terapi Saraf Terjepit Lancar di RS Berkat JKN-KIS,https://www.cnnindonesia.com/nasional/20201201205339-25-576811/terapi-saraf-terjepit-lancar-di-rs-berkat-jkn-kis,Nasional,4 tahun yang lalu
Pembahasan Aturan Jaminan Kehilangan Pekerjaan Macet,https://www.cnnindonesia.com/ekonomi/20201130130959-78-576139/pembahasan-aturan-jaminan-kehilangan-pekerjaan-macet,Ekonomi,4 tahun yang lalu
Pemerintah Ketat Awasi Distribusi Subsidi Upah Guru Honorer,https://www.cnnindonesia.com/nasional/20201129134721-25-575848/pemerintah-ketat-awasi-distribusi-subsidi-upah-guru-honorer,Nasional,4 tahun yang lalu
Jasa Raharja Santuni Korban Kecelakaan Tol Purbaleunyi,https://www.cnnindonesia.com/nasional/20201129205257-293-575926/jasa-raharja-santuni-korban-kecelakaan-tol-purbaleunyi,Nasional,4 tahun yang lalu
Melihat Lagi Faktor Penentu Kenaikan Iuran BPJS Kesehatan,https://www.cnnindonesia.com/ekonomi/20201127153905-78-575412/melihat-lagi-faktor-penentu-kenaikan-iuran-bpjs-kesehatan,Ekonomi,4 tahun yang lalu
Bio Farma Tangani Pengadaan Hingga Distribusi Vaksin Covid-19,https://www.cnnindonesia.com/ekonomi/20201125130052-97-574260/bio-farma-tangani-pengadaan-hingga-distribusi-vaksin-covid-19,Ekonomi,4 tahun yang lalu
Iuran BPJS Kesehatan Dipastikan Tak Naik pada 2021,https://www.cnnindonesia.com/ekonomi/20201126211917-78-575113/iuran-bpjs-kesehatan-dipastikan-tak-naik-pada-2021,Ekonomi,4 tahun yang lalu
"Kemenkes: Kedaluwarsa, Akreditasi RS Tetap Berlaku saat Covid",https://www.cnnindonesia.com/nasional/20201125151423-20-574363/kemenkes-kedaluwarsa-akreditasi-rs-tetap-berlaku-saat-covid,Nasional,4 tahun yang lalu
"Dana BLT Pekerja Sudah Tersalurkan Rp21,8 T per 23 November",https://www.cnnindonesia.com/ekonomi/20201125155611-532-574395/dana-blt-pekerja-sudah-tersalurkan-rp218-t-per-23-november,Ekonomi,4 tahun yang lalu
151 Ribu Pekerja Belum Dapat BLT Tahap Pertama,https://www.cnnindonesia.com/ekonomi/20201125154842-532-574392/151-ribu-pekerja-belum-dapat-blt-tahap-pertama,Ekonomi,4 tahun yang lalu
Pemerintah Siapkan Sistem Satu Data Vaksinasi Covid-19,https://www.cnnindonesia.com/nasional/20201125102919-25-574166/pemerintah-siapkan-sistem-satu-data-vaksinasi-covid-19,Nasional,4 tahun yang lalu
"Kelas Standar BPJS Kesehatan, Tak Berarti Iuran Naik",https://www.cnnindonesia.com/ekonomi/20201125070920-532-574088/kelas-standar-bpjs-kesehatan-tak-berarti-iuran-naik,Ekonomi,4 tahun yang lalu
Erick Thohir Jamin Kerahasiaan Data Penerima Vaksin Corona,https://www.cnnindonesia.com/ekonomi/20201124191749-92-574003/erick-thohir-jamin-kerahasiaan-data-penerima-vaksin-corona,Ekonomi,4 tahun yang lalu
Melihat Lagi Iuran BPJS yang Diisyaratkan Naik oleh Terawan,https://www.cnnindonesia.com/ekonomi/20201124182738-78-573988/melihat-lagi-iuran-bpjs-yang-diisyaratkan-naik-oleh-terawan,Ekonomi,4 tahun yang lalu
Respons Erick Thohir soal Permintaan Vaksin Corona Gratis,https://www.cnnindonesia.com/ekonomi/20201124172554-92-573940/respons-erick-thohir-soal-permintaan-vaksin-corona-gratis,Ekonomi,4 tahun yang lalu
BPJS Watch Sebut Harusnya Iuran BPJS Turun pada 2021,https://www.cnnindonesia.com/ekonomi/20201124171203-78-573964/bpjs-watch-sebut-harusnya-iuran-bpjs-turun-pada-2021,Ekonomi,4 tahun yang lalu
Menkes Terawan Isyaratkan Kenaikan Iuran BPJS Kesehatan,https://www.cnnindonesia.com/ekonomi/20201124144443-532-573849/menkes-terawan-isyaratkan-kenaikan-iuran-bpjs-kesehatan,Ekonomi,4 tahun yang lalu
Pemda Bantah RS Rujukan Covid-19 di Yogyakarta Penuh,https://www.cnnindonesia.com/nasional/20201124111400-20-573703/pemda-bantah-rs-rujukan-covid-19-di-yogyakarta-penuh,Nasional,4 tahun yang lalu
"Debat Pilkada Medan, Nada Tinggi Petahana Hadapi Mantu Jokowi",https://www.cnnindonesia.com/nasional/20201121233105-32-572846/debat-pilkada-medan-nada-tinggi-petahana-hadapi-mantu-jokowi,Nasional,4 tahun yang lalu
Nada Tinggi Petahana Medan Hadapi Kritik Mantu Jokowi,https://www.cnnindonesia.com/nasional/20201122031239-32-572858/nada-tinggi-petahana-medan-hadapi-kritik-mantu-jokowi,Nasional,4 tahun yang lalu
Jasa Raharja Beri Santunan ke Korban Kecelakaan di Siantar,https://www.cnnindonesia.com/nasional/20201120225646-293-572637/jasa-raharja-beri-santunan-ke-korban-kecelakaan-di-siantar,Nasional,4 tahun yang lalu
"BLT Subsidi Gaji Cair Lagi ke 2,44 Juta Pekerja Hari Ini",https://www.cnnindonesia.com/ekonomi/20201120192331-532-572577/blt-subsidi-gaji-cair-lagi-ke-244-juta-pekerja-hari-ini,Ekonomi,4 tahun yang lalu
Jutaan Pendidik Non-PNS Terima Bantuan Subsidi Upah,https://www.cnnindonesia.com/nasional/20201120102735-25-572247/jutaan-pendidik-non-pns-terima-bantuan-subsidi-upah,Nasional,4 tahun yang lalu
Ibu dari Anak dengan Gangguan Otak Gugat UU Larang Ganja,https://www.cnnindonesia.com/nasional/20201119180709-12-572066/ibu-dari-anak-dengan-gangguan-otak-gugat-uu-larang-ganja,Nasional,4 tahun yang lalu
"Debat Pilkada Surabaya, Adu Pro Wong Cilik Eri Vs Machfud",https://www.cnnindonesia.com/nasional/20201118222311-32-571621/debat-pilkada-surabaya-adu-pro-wong-cilik-eri-vs-machfud,Nasional,4 tahun yang lalu
"Hitung-hitungan Dana Operasional BPJS Tenaker: Turun Rp1,22 T",https://www.cnnindonesia.com/ekonomi/20201118202229-78-571581/hitung-hitungan-dana-operasional-bpjs-tenaker-turun-rp122-t,Ekonomi,4 tahun yang lalu
Bio Farma Ungkap Distribusi Vaksin Corona Terkendala Data,https://www.cnnindonesia.com/ekonomi/20201118175733-92-571510/bio-farma-ungkap-distribusi-vaksin-corona-terkendala-data,Ekonomi,4 tahun yang lalu
Pengusaha Farmasi Usul Pajak Obat Gratis di BPJS Kesehatan,https://www.cnnindonesia.com/ekonomi/20201118170721-92-571480/pengusaha-farmasi-usul-pajak-obat-gratis-di-bpjs-kesehatan,Ekonomi,4 tahun yang lalu
Sri Mulyani Naikkan Dana Operasional BPJS Ketenagakerjaan,https://www.cnnindonesia.com/ekonomi/20201118135920-532-571364/sri-mulyani-naikkan-dana-operasional-bpjs-ketenagakerjaan,Ekonomi,4 tahun yang lalu
"4 Penyebab BLT Pekerja Rp2,4 Juta Gagal Cair",https://www.cnnindonesia.com/ekonomi/20201118072253-532-571124/4-penyebab-blt-pekerja-rp24-juta-gagal-cair,Ekonomi,4 tahun yang lalu
Distribusi Vaksin Corona Akan Dilakukan Secara Digital,https://www.cnnindonesia.com/ekonomi/20201117150340-92-570845/distribusi-vaksin-corona-akan-dilakukan-secara-digital,Ekonomi,4 tahun yang lalu
Kemenkes Buka Alasan Biaya Perawatan Covid Capai Rp184 Juta,https://www.cnnindonesia.com/ekonomi/20201117145112-532-570837/kemenkes-buka-alasan-biaya-perawatan-covid-capai-rp184-juta,Ekonomi,4 tahun yang lalu
Kementerian BUMN Kebagian Tugas Suntik 172 Juta Vaksin Corona,https://www.cnnindonesia.com/ekonomi/20201117140129-92-570800/kementerian-bumn-kebagian-tugas-suntik-172-juta-vaksin-corona,Ekonomi,4 tahun yang lalu
4 Masalah yang Buat Pekerja Bergaji Rp5 Juta Belum Dapat BLT,https://www.cnnindonesia.com/ekonomi/20201117114634-92-570721/4-masalah-yang-buat-pekerja-bergaji-rp5-juta-belum-dapat-blt,Ekonomi,4 tahun yang lalu
Pemerintah Siap Cairkan BLT Gaji Guru Honorer Rp5 T,https://www.cnnindonesia.com/ekonomi/20201116064357-532-570120/pemerintah-siap-cairkan-blt-gaji-guru-honorer-rp5-t,Ekonomi,4 tahun yang lalu
Diabetes dan Tantangan di Masa Pandemi,https://www.cnnindonesia.com/gaya-hidup/20201103181344-255-565459/diabetes-dan-tantangan-di-masa-pandemi,Gaya Hidup,4 tahun yang lalu
Aturan Pesangon Buruh Dirampungkan Sebelum Februari 2021,https://www.cnnindonesia.com/ekonomi/20201113174926-92-569569/aturan-pesangon-buruh-dirampungkan-sebelum-februari-2021,Ekonomi,4 tahun yang lalu
"BLT Subsidi Gaji untuk 2,71 Juta Pekerja Cair Hari Ini",https://www.cnnindonesia.com/ekonomi/20201113080142-532-569263/blt-subsidi-gaji-untuk-271-juta-pekerja-cair-hari-ini,Ekonomi,4 tahun yang lalu
Daftar Penggunaan Dana APBN per September 2020,https://www.cnnindonesia.com/ekonomi/20201112141407-532-569002/daftar-penggunaan-dana-apbn-per-september-2020,Ekonomi,4 tahun yang lalu
BPK Temukan 5 Kelemahan Pengelolaan BPJS Kesehatan,https://www.cnnindonesia.com/ekonomi/20201111131241-532-568498/bpk-temukan-5-kelemahan-pengelolaan-bpjs-kesehatan,Ekonomi,4 tahun yang lalu
"JKP Segera Meluncur, BPJS Imbau Pekerja Formal Mendaftar",https://www.cnnindonesia.com/ekonomi/20201110114554-78-568000/jkp-segera-meluncur-bpjs-imbau-pekerja-formal-mendaftar,Ekonomi,4 tahun yang lalu
Survei: 10 Persen Orang RI Masih Tak Tahu Pakai Internet,https://www.cnnindonesia.com/teknologi/20201110171625-185-568208/survei-10-persen-orang-ri-masih-tak-tahu-pakai-internet,Teknologi,4 tahun yang lalu
BPJS Ketenagakerjaan Banjir Aduan Selama Pandemi Corona,https://www.cnnindonesia.com/ekonomi/20201110122532-78-568016/bpjs-ketenagakerjaan-banjir-aduan-selama-pandemi-corona,Ekonomi,4 tahun yang lalu
Pemerintah Jamin Data Penerima Kartu Prakerja Tak Bocor,https://www.cnnindonesia.com/ekonomi/20201110113309-532-567994/pemerintah-jamin-data-penerima-kartu-prakerja-tak-bocor,Ekonomi,4 tahun yang lalu
Kemenkeu Klaim Bansos Corona Percepat Inklusi Keuangan,https://www.cnnindonesia.com/ekonomi/20201109204954-78-567823/kemenkeu-klaim-bansos-corona-percepat-inklusi-keuangan,Ekonomi,4 tahun yang lalu
"Cair Hari Ini, 2,18 Juta Pekerja Bakal Dapat BLT",https://www.cnnindonesia.com/ekonomi/20201109192657-532-567791/cair-hari-ini-218-juta-pekerja-bakal-dapat-blt,Ekonomi,4 tahun yang lalu
Pemerintah Rangkul KPK dan BPK Cairkan BLT Subsidi Gaji,https://www.cnnindonesia.com/ekonomi/20201109111546-532-567513/pemerintah-rangkul-kpk-dan-bpk-cairkan-blt-subsidi-gaji,Ekonomi,4 tahun yang lalu
Penerima BLT Subsidi Gaji Tahap II Bakal Lebih Sedikit,https://www.cnnindonesia.com/ekonomi/20201109104854-532-567493/penerima-blt-subsidi-gaji-tahap-ii-bakal-lebih-sedikit,Ekonomi,4 tahun yang lalu
BLT Subsidi Gaji di Bawah Rp5 Juta Cair Hari Ini,https://www.cnnindonesia.com/ekonomi/20201109095320-532-567457/blt-subsidi-gaji-di-bawah-rp5-juta-cair-hari-ini,Ekonomi,4 tahun yang lalu
"Ditanya Omnibus Law saat Debat, Mantu Jokowi Tak Jawab Tegas",https://www.cnnindonesia.com/nasional/20201107140126-32-567072/ditanya-omnibus-law-saat-debat-mantu-jokowi-tak-jawab-tegas,Nasional,4 tahun yang lalu
"Dengan Syarat Beda, BLT Pekerja Tahap II Cair Akhir Pekan Ini",https://www.cnnindonesia.com/ekonomi/20201107144712-532-567096/dengan-syarat-beda-blt-pekerja-tahap-ii-cair-akhir-pekan-ini,Ekonomi,4 tahun yang lalu
Perjuangan Amel Sembuh dari Stroke di Usia 20-an,https://www.cnnindonesia.com/gaya-hidup/20201027145514-255-563312/perjuangan-amel-sembuh-dari-stroke-di-usia-20-an,Gaya Hidup,4 tahun yang lalu
Menaker Ungkap BLT Subsidi Gaji Cair Atas Rekomendasi KPK,https://www.cnnindonesia.com/ekonomi/20201106202525-532-566972/menaker-ungkap-blt-subsidi-gaji-cair-atas-rekomendasi-kpk,Ekonomi,4 tahun yang lalu
3 Faktor Penyebab BLT Subsidi Gaji Gagal Cair ke Pekerja,https://www.cnnindonesia.com/ekonomi/20201106164502-532-566846/3-faktor-penyebab-blt-subsidi-gaji-gagal-cair-ke-pekerja,Ekonomi,4 tahun yang lalu
Bayar Tagihan & Beli Apapun #DibikinSimpel dengan BCA mobile,https://www.cnnindonesia.com/ekonomi/20201106112254-297-566650/bayar-tagihan-beli-apapun-dibikinsimpel-dengan-bca-mobile,Ekonomi,4 tahun yang lalu
Istana soal Vaksin Covid: Kata Rasul Setiap Penyakit Ada Obat,https://www.cnnindonesia.com/nasional/20201105132004-20-566268/istana-soal-vaksin-covid-kata-rasul-setiap-penyakit-ada-obat,Nasional,4 tahun yang lalu
Dalih Luhut Tangani Corona: Data Pusat dan Daerah Tak Sesuai,https://www.cnnindonesia.com/nasional/20201105064948-20-566085/dalih-luhut-tangani-corona-data-pusat-dan-daerah-tak-sesuai,Nasional,4 tahun yang lalu
Teten Ungkap Alasan Serapan Bantuan UMKM Belum Optimal,https://www.cnnindonesia.com/ekonomi/20201104134234-92-565810/teten-ungkap-alasan-serapan-bantuan-umkm-belum-optimal,Ekonomi,4 tahun yang lalu
UKM dan Koperasi Didorong Jadi Peserta BPJS Ketenagakerjaan,https://www.cnnindonesia.com/ekonomi/20201104131730-92-565793/ukm-dan-koperasi-didorong-jadi-peserta-bpjs-ketenagakerjaan,Ekonomi,4 tahun yang lalu
Jokowi Beri Modal Program Jaminan Kehilangan Pekerjaan Rp6 T,https://www.cnnindonesia.com/ekonomi/20201103154922-532-565388/jokowi-beri-modal-program-jaminan-kehilangan-pekerjaan-rp6-t,Ekonomi,4 tahun yang lalu
"Desak UU Ciptaker Dicabut, KSPI Sorot Aturan Merugikan Buruh",https://www.cnnindonesia.com/nasional/20201103095002-32-565238/desak-uu-ciptaker-dicabut-kspi-sorot-aturan-merugikan-buruh,Nasional,4 tahun yang lalu
"BLT Rp2,4 Juta Guru Honorer Kemenag Tinggal Tunggu Kemenkeu",https://www.cnnindonesia.com/ekonomi/20201103074250-532-565207/blt-rp24-juta-guru-honorer-kemenag-tinggal-tunggu-kemenkeu,Ekonomi,4 tahun yang lalu
Empat Kesalahan Keuangan saat Resesi Ekonomi,https://www.cnnindonesia.com/ekonomi/20201102191422-83-565077/empat-kesalahan-keuangan-saat-resesi-ekonomi,Ekonomi,4 tahun yang lalu
Cara Cek Kepesertaan BPJS Kesehatan Sebelum Registrasi Ulang,https://www.cnnindonesia.com/ekonomi/20201102075110-78-564745/cara-cek-kepesertaan-bpjs-kesehatan-sebelum-registrasi-ulang,Ekonomi,4 tahun yang lalu
"Jalankan Rekomendasi KPK, BPJS Bekukan Kepesertaan PNS",https://www.cnnindonesia.com/ekonomi/20201102063654-78-564717/jalankan-rekomendasi-kpk-bpjs-bekukan-kepesertaan-pns,Ekonomi,4 tahun yang lalu
BPJS Mulai Bekukan Kepesertaan PNS yang Tak Melengkapi Data,https://www.cnnindonesia.com/ekonomi/20201101180553-92-564668/bpjs-mulai-bekukan-kepesertaan-pns-yang-tak-melengkapi-data,Ekonomi,4 tahun yang lalu
Cara Cek Kepesertaan BPJS Agar Tidak Dibekukan,https://www.cnnindonesia.com/ekonomi/20201031095745-97-564329/cara-cek-kepesertaan-bpjs-agar-tidak-dibekukan,Ekonomi,4 tahun yang lalu
Cara Registrasi Ulang BPJS Kesehatan Bagi Abdi Negara,https://www.cnnindonesia.com/ekonomi/20201030185426-78-564271/cara-registrasi-ulang-bpjs-kesehatan-bagi-abdi-negara,Ekonomi,4 tahun yang lalu
PNS Diminta Daftar Ulang BPJS Kesehatan 1 November,https://www.cnnindonesia.com/ekonomi/20201030175317-532-564256/pns-diminta-daftar-ulang-bpjs-kesehatan-1-november,Ekonomi,4 tahun yang lalu
Jurus Jitu Amankan Masa Pensiun Sejak Dini,https://www.cnnindonesia.com/ekonomi/20201026143325-83-562808/jurus-jitu-amankan-masa-pensiun-sejak-dini,Ekonomi,4 tahun yang lalu
"BLT Bidik 12,4 Juta Pekerja, Kemenaker Pastikan Tepat Sasaran",https://www.cnnindonesia.com/ekonomi/20201027133102-537-563241/blt-bidik-124-juta-pekerja-kemenaker-pastikan-tepat-sasaran,Ekonomi,4 tahun yang lalu
Kemenaker Ungkap 5 Alasan BLT 152 Ribu Pekerja Belum Cair,https://www.cnnindonesia.com/ekonomi/20201028090503-532-563605/kemenaker-ungkap-5-alasan-blt-152-ribu-pekerja-belum-cair,Ekonomi,4 tahun yang lalu
Buruh Berpeluang Bawa Surat Menaker soal Upah ke PTUN,https://www.cnnindonesia.com/ekonomi/20201027165827-92-563402/buruh-berpeluang-bawa-surat-menaker-soal-upah-ke-ptun,Ekonomi,4 tahun yang lalu
"Banyak PHK, Pencairan JHT BPJS Ketenagakerjaan Melonjak",https://www.cnnindonesia.com/ekonomi/20201027144845-78-563313/banyak-phk-pencairan-jht-bpjs-ketenagakerjaan-melonjak,Ekonomi,4 tahun yang lalu
