Judul,Link,Kategori,Tanggal Upload
Polisi Siagakan 6.000 Personel Kawal Demo Buruh di DPR,https://www.cnnindonesia.com/nasional/20191002081829-20-435924/polisi-siagakan-6000-personel-kawal-demo-buruh-di-dpr,Nasional,5 tahun yang lalu
Buruh di Jatim Bergerak Gelorakan Protes UU Ketenagakerjaan,https://www.cnnindonesia.com/nasional/20191002062149-20-435905/buruh-di-jatim-bergerak-gelorakan-protes-uu-ketenagakerjaan,Nasional,5 tahun yang lalu
Jazuli Juwaini Kembali Pimpin Fraksi PKS DPR,https://www.cnnindonesia.com/nasional/20191001155559-32-435755/jazuli-juwaini-kembali-pimpin-fraksi-pks-dpr,Nasional,5 tahun yang lalu
Ribuan Buruh Terjun Demo ke DPR Besok,https://www.cnnindonesia.com/nasional/20191001090017-20-435561/ribuan-buruh-terjun-demo-ke-dpr-besok,Nasional,5 tahun yang lalu
Mahasiswa Makassar Sempat Bajak 3 Truk untuk Blokir Jalan,https://www.cnnindonesia.com/nasional/20190930173528-20-435410/mahasiswa-makassar-sempat-bajak-3-truk-untuk-blokir-jalan,Nasional,5 tahun yang lalu
"Bertemu di Istana, Pimpinan Serikat Buruh Dukung Penuh Jokowi",https://www.cnnindonesia.com/nasional/20190930143908-32-435353/bertemu-di-istana-pimpinan-serikat-buruh-dukung-penuh-jokowi,Nasional,5 tahun yang lalu
Jokowi Kaji Keinginan Serikat Buruh Soal Tarif BPJS Kesehatan,https://www.cnnindonesia.com/ekonomi/20190930154921-78-435373/jokowi-kaji-keinginan-serikat-buruh-soal-tarif-bpjs-kesehatan,Ekonomi,5 tahun yang lalu
Puluhan Ribu Orang Teken Petisi: Jangan Naikkan Iuran BPJS,https://www.cnnindonesia.com/ekonomi/20190927134504-78-434632/puluhan-ribu-orang-teken-petisi-jangan-naikkan-iuran-bpjs,Ekonomi,5 tahun yang lalu
Warga Tak Mampu Dapat Rp150 Ribu per Bulan dari Kartu Sembako,https://www.cnnindonesia.com/ekonomi/20190926184141-532-434408/warga-tak-mampu-dapat-rp150-ribu-per-bulan-dari-kartu-sembako,Ekonomi,5 tahun yang lalu
"Perusahaan Bangkrut, Iuran BPJS Ketenagakerjaan Susut Rp30 T",https://www.cnnindonesia.com/ekonomi/20190923185208-78-433130/perusahaan-bangkrut-iuran-bpjs-ketenagakerjaan-susut-rp30-t,Ekonomi,5 tahun yang lalu
"Demo di Makassar, Mahasiswa Serukan Jokowi Lengser",https://www.cnnindonesia.com/nasional/20190923123814-20-432964/demo-di-makassar-mahasiswa-serukan-jokowi-lengser,Nasional,5 tahun yang lalu
"Tinggal di California, Tambal Gigi di Meksiko",https://www.cnnindonesia.com/gaya-hidup/20190915085700-269-430587/tinggal-di-california-tambal-gigi-di-meksiko,Gaya Hidup,5 tahun yang lalu
Hanif Dakiri: Pendiri Liga Pekerja Indonesia Jadi Plt Menpora,https://www.cnnindonesia.com/olahraga/20190920162506-142-432341/hanif-dakiri-pendiri-liga-pekerja-indonesia-jadi-plt-menpora,Olahraga,5 tahun yang lalu
Polisi Amankan 20 Anak Dieksploitasi Jadi Pengemis di Medan,https://www.cnnindonesia.com/nasional/20190919191959-12-432088/polisi-amankan-20-anak-dieksploitasi-jadi-pengemis-di-medan,Nasional,5 tahun yang lalu
DKI Pertahankan Santunan Pohon Tumbang dan BPJS Pemulung,https://www.cnnindonesia.com/nasional/20190919142800-20-431970/dki-pertahankan-santunan-pohon-tumbang-dan-bpjs-pemulung,Nasional,5 tahun yang lalu
Demo BPJS di Makassar Berunjung Bentrok Mahasiswa dan Aparat,https://www.cnnindonesia.com/nasional/20190916170528-20-430960/demo-bpjs-di-makassar-berunjung-bentrok-mahasiswa-dan-aparat,Nasional,5 tahun yang lalu
Ombudsman Sarankan Pemerintah Naikkan Iuran BPJS Bertahap,https://www.cnnindonesia.com/ekonomi/20190913085545-78-430133/ombudsman-sarankan-pemerintah-naikkan-iuran-bpjs-bertahap,Ekonomi,5 tahun yang lalu
VIDEO: Tarif Baru BPJS Kesehatan,https://www.cnnindonesia.com/tv/20190913095921-402-430138/video-tarif-baru-bpjs-kesehatan,TV,5 tahun yang lalu
"Tarif Naik, BPJS Kesehatan Ramal 30 Persen Peserta Ubah Kelas",https://www.cnnindonesia.com/ekonomi/20190912204446-78-430060/tarif-naik-bpjs-kesehatan-ramal-30-persen-peserta-ubah-kelas,Ekonomi,5 tahun yang lalu
"Tunggakan BPJS Kesehatan ke Rumah Sakit Capai Rp6,5 Triliun",https://www.cnnindonesia.com/ekonomi/20190912192427-78-430039/tunggakan-bpjs-kesehatan-ke-rumah-sakit-capai-rp65-triliun,Ekonomi,5 tahun yang lalu
Ketua RT di Depok Jadi 'Debt Collector' Iuran BPJS Kesehatan,https://www.cnnindonesia.com/ekonomi/20190912150450-78-429957/ketua-rt-di-depok-jadi-debt-collector-iuran-bpjs-kesehatan,Ekonomi,5 tahun yang lalu
Klaim Asuransi Jiwa Tumbuh Tipis Jadi Rp65 T Kuartal II 2019,https://www.cnnindonesia.com/ekonomi/20190911165135-78-429572/klaim-asuransi-jiwa-tumbuh-tipis-jadi-rp65-t-kuartal-ii-2019,Ekonomi,5 tahun yang lalu
"VIDEO: Subsidi Listrik 900 VA Dicabut, Nasib Konsumen?",https://www.cnnindonesia.com/tv/20190910194733-402-429244/video-subsidi-listrik-900-va-dicabut-nasib-konsumen,TV,5 tahun yang lalu
Tunggakan Peserta Mandiri Alasan BPJS Kesehatan Defisit,https://www.cnnindonesia.com/ekonomi/20190910154814-78-429134/tunggakan-peserta-mandiri-alasan-bpjs-kesehatan-defisit,Ekonomi,5 tahun yang lalu
"Terancam Kolaps, LPSK Minta Anggaran Dinaikkan",https://www.cnnindonesia.com/nasional/20190909182914-20-428869/terancam-kolaps-lpsk-minta-anggaran-dinaikkan,Nasional,5 tahun yang lalu
Sri Mulyani Blak-blakan soal Anggaran Kesehatan di Era Jokowi,https://www.cnnindonesia.com/ekonomi/20190909131213-532-428753/sri-mulyani-blak-blakan-soal-anggaran-kesehatan-di-era-jokowi,Ekonomi,5 tahun yang lalu
Prakarsa Usul Jokowi Rombak Direksi BPJS dan Kemenkes,https://www.cnnindonesia.com/ekonomi/20190909144525-78-428774/prakarsa-usul-jokowi-rombak-direksi-bpjs-dan-kemenkes,Ekonomi,5 tahun yang lalu
Kemenkeu Buka Alasan Sri Mulyani Usul Iuran BPJS Naik Tinggi,https://www.cnnindonesia.com/ekonomi/20190908132650-78-428549/kemenkeu-buka-alasan-sri-mulyani-usul-iuran-bpjs-naik-tinggi,Ekonomi,5 tahun yang lalu
Menyoal Keamanan Data Jika Asing Audit Sistem TI BPJS,https://www.cnnindonesia.com/teknologi/20190906175116-185-428250/menyoal-keamanan-data-jika-asing-audit-sistem-ti-bpjs,Teknologi,5 tahun yang lalu
Sri Mulyani Lempar Isu Data Peserta BPJS Kesehatan ke Mensos,https://www.cnnindonesia.com/ekonomi/20190906150259-532-428180/sri-mulyani-lempar-isu-data-peserta-bpjs-kesehatan-ke-mensos,Ekonomi,5 tahun yang lalu
VIDEO: Warga Tolak Kenaikan Iuran BPJS Kesehatan,https://www.cnnindonesia.com/tv/20190906094343-400-428045/video-warga-tolak-kenaikan-iuran-bpjs-kesehatan,TV,5 tahun yang lalu
IDI Desak Kenaikan Iuran BPJS Kesehatan,https://www.cnnindonesia.com/ekonomi/20190906073027-78-428019/idi-desak-kenaikan-iuran-bpjs-kesehatan,Ekonomi,5 tahun yang lalu
"BPJS Kesehatan Akui Tekor Rp1,5 Triliun Setiap Bulan",https://www.cnnindonesia.com/ekonomi/20190905195403-78-427959/bpjs-kesehatan-akui-tekor-rp15-triliun-setiap-bulan,Ekonomi,5 tahun yang lalu
Pemerintah Gandeng KPK Atasi Fraud di BPJS Kesehatan,https://www.cnnindonesia.com/ekonomi/20190905101245-78-427705/pemerintah-gandeng-kpk-atasi-fraud-di-bpjs-kesehatan,Ekonomi,5 tahun yang lalu
Moeldoko soal BPJS: Masyarakat Harus Memahami Sehat Itu Mahal,https://www.cnnindonesia.com/nasional/20190904213556-20-427624/moeldoko-soal-bpjs-masyarakat-harus-memahami-sehat-itu-mahal,Nasional,5 tahun yang lalu
VIDEO: Jalan Buntu Menyehatkan BPJS Kesehatan (1-3),https://www.cnnindonesia.com/tv/20190904212442-410-427621/video-jalan-buntu-menyehatkan-bpjs-kesehatan-1-3,TV,5 tahun yang lalu
VIDEO: Jalan Buntu Menyehatkan BPJS Kesehatan (3-3),https://www.cnnindonesia.com/tv/20190904212424-410-427623/video-jalan-buntu-menyehatkan-bpjs-kesehatan-3-3,TV,5 tahun yang lalu
VIDEO: Jalan Buntu Menyehatkan BPJS Kesehatan (2-3),https://www.cnnindonesia.com/tv/20190904212407-410-427622/video-jalan-buntu-menyehatkan-bpjs-kesehatan-2-3,TV,5 tahun yang lalu
Aturan Kenaikan Iuran BPJS Terbit Sebelum Jokowi Dilantik,https://www.cnnindonesia.com/ekonomi/20190904190503-78-427585/aturan-kenaikan-iuran-bpjs-terbit-sebelum-jokowi-dilantik,Ekonomi,5 tahun yang lalu
Iwan Fals Bicara Kemelut Wagub DKI hingga BPJS Naik,https://www.cnnindonesia.com/hiburan/20190904163308-234-427510/iwan-fals-bicara-kemelut-wagub-dki-hingga-bpjs-naik,Hiburan,5 tahun yang lalu
Jasa Raharja Santuni Korban dan Tersangka Kecelakaan Maut,https://www.cnnindonesia.com/ekonomi/20190904155753-78-427495/jasa-raharja-santuni-korban-dan-tersangka-kecelakaan-maut,Ekonomi,5 tahun yang lalu
Dokter Pimpin Aksi Tolak Kenaikan Iuran BPJS di Maluku Utara,https://www.cnnindonesia.com/nasional/20190903155458-20-427181/dokter-pimpin-aksi-tolak-kenaikan-iuran-bpjs-di-maluku-utara,Nasional,5 tahun yang lalu
"September Ceria bagi Konsumen PLN, Bank, sampai Sopir Ojol",https://www.cnnindonesia.com/ekonomi/20190903110329-92-427070/september-ceria-bagi-konsumen-pln-bank-sampai-sopir-ojol,Ekonomi,5 tahun yang lalu
Mengukur 'Kemanjuran' Blokir Internet Redam Hoaks di Papua,https://www.cnnindonesia.com/teknologi/20190830164424-185-426166/mengukur-kemanjuran-blokir-internet-redam-hoaks-di-papua,Teknologi,5 tahun yang lalu
VIDEO: DPR Tolak Kenaikan BPJS Kesehatan,https://www.cnnindonesia.com/tv/20190903104316-434-427045/video-dpr-tolak-kenaikan-bpjs-kesehatan,TV,5 tahun yang lalu
"Iuran BPJS Naik, Netizen Serukan #BatalkanKenaikanBPJS",https://www.cnnindonesia.com/teknologi/20190903101936-192-427031/iuran-bpjs-naik-netizen-serukan-batalkankenaikanbpjs,Teknologi,5 tahun yang lalu
Sulit Bikin Peserta BPJS Patuh Bayar Cuma Lewat Autodebet,https://www.cnnindonesia.com/ekonomi/20190903075756-78-426992/sulit-bikin-peserta-bpjs-patuh-bayar-cuma-lewat-autodebet,Ekonomi,5 tahun yang lalu
Pengusaha Tekstil Keberatan Iuran BPJS Kesehatan Naik,https://www.cnnindonesia.com/ekonomi/20190902180253-92-426912/pengusaha-tekstil-keberatan-iuran-bpjs-kesehatan-naik,Ekonomi,5 tahun yang lalu
BPJS Sarankan Peserta Yang Berat Iuran Naik untuk Turun Kelas,https://www.cnnindonesia.com/ekonomi/20190902190440-78-426922/bpjs-sarankan-peserta-yang-berat-iuran-naik-untuk-turun-kelas,Ekonomi,5 tahun yang lalu
Buruh Akan Gugat Pemerintah Terkait Kenaikan Iuran BPJS,https://www.cnnindonesia.com/nasional/20190902192551-20-426928/buruh-akan-gugat-pemerintah-terkait-kenaikan-iuran-bpjs,Nasional,5 tahun yang lalu
Audit BPKP Ungkap 10 Ribu Perusahaan Tak Patuh BPJS Kesehatan,https://www.cnnindonesia.com/ekonomi/20190902184914-92-426919/audit-bpkp-ungkap-10-ribu-perusahaan-tak-patuh-bpjs-kesehatan,Ekonomi,5 tahun yang lalu
"Desain Ulang Program JKN, DPR Usulkan Bentuk Pansus",https://www.cnnindonesia.com/ekonomi/20190902141422-78-426837/desain-ulang-program-jkn-dpr-usulkan-bentuk-pansus,Ekonomi,5 tahun yang lalu
Pemerintah Ngotot Naikkan Iuran BPJS Dua Kali Lipat Pada 2020,https://www.cnnindonesia.com/ekonomi/20190902171754-78-426877/pemerintah-ngotot-naikkan-iuran-bpjs-dua-kali-lipat-pada-2020,Ekonomi,5 tahun yang lalu
Buruh Bersatu Siapkan Aksi Massal Tolak Kenaikan Iuran BPJS,https://www.cnnindonesia.com/nasional/20190902164050-20-426871/buruh-bersatu-siapkan-aksi-massal-tolak-kenaikan-iuran-bpjs,Nasional,5 tahun yang lalu
DPR Tolak Usul Sri Mulyani Naikkan Iuran BPJS Kesehatan,https://www.cnnindonesia.com/ekonomi/20190902164122-78-426868/dpr-tolak-usul-sri-mulyani-naikkan-iuran-bpjs-kesehatan,Ekonomi,5 tahun yang lalu
"Iuran Tak Naik, BPJS Ramal Defisit Bisa Tembus Rp77 T di 2024",https://www.cnnindonesia.com/ekonomi/20190902145709-78-426831/iuran-tak-naik-bpjs-ramal-defisit-bisa-tembus-rp77-t-di-2024,Ekonomi,5 tahun yang lalu
"Kemensos: 16,2 Juta Warga Miskin BPJS Bermasalah, NIK Ganda",https://www.cnnindonesia.com/ekonomi/20190902141907-78-426810/kemensos-162-juta-warga-miskin-bpjs-bermasalah-nik-ganda,Ekonomi,5 tahun yang lalu
BPJS Kesehatan Akui Ada Kecurangan Dalam Program JKN,https://www.cnnindonesia.com/ekonomi/20190902133806-78-426809/bpjs-kesehatan-akui-ada-kecurangan-dalam-program-jkn,Ekonomi,5 tahun yang lalu
Bayar Iuran BPJS Kesehatan Wajib Autodebet Rekening,https://www.cnnindonesia.com/ekonomi/20190902123302-78-426784/bayar-iuran-bpjs-kesehatan-wajib-autodebet-rekening,Ekonomi,5 tahun yang lalu
Kemenkeu: Kenaikan Iuran BPJS Harus Diiringi Perbaikan Faskes,https://www.cnnindonesia.com/ekonomi/20190902120851-78-426768/kemenkeu-kenaikan-iuran-bpjs-harus-diiringi-perbaikan-faskes,Ekonomi,5 tahun yang lalu
OJK Bubarkan Dana Pensiun IPTN Milik Dirgantara Indonesia,https://www.cnnindonesia.com/ekonomi/20190902095030-78-426695/ojk-bubarkan-dana-pensiun-iptn-milik-dirgantara-indonesia,Ekonomi,5 tahun yang lalu
"Iuran BPJS Kesehatan Naik, Pemkot Kupang Ongkosi Warga Miskin",https://www.cnnindonesia.com/ekonomi/20190901151534-78-426555/iuran-bpjs-kesehatan-naik-pemkot-kupang-ongkosi-warga-miskin,Ekonomi,5 tahun yang lalu
Waketum Gerindra: Iuran BPJS Kesehatan Tak Perlu Naik,https://www.cnnindonesia.com/nasional/20190901150340-20-426554/waketum-gerindra-iuran-bpjs-kesehatan-tak-perlu-naik,Nasional,5 tahun yang lalu
Mensos Tak Cemas Iuran BPJS Masyarakat Miskin Naik,https://www.cnnindonesia.com/ekonomi/20190830204218-78-426276/mensos-tak-cemas-iuran-bpjs-masyarakat-miskin-naik,Ekonomi,5 tahun yang lalu
VIDEO: Tanggapan Warga Terkait Kenaikan Iuran BPJS Kesehatan,https://www.cnnindonesia.com/tv/20190831155208-405-426386/video-tanggapan-warga-terkait-kenaikan-iuran-bpjs-kesehatan,TV,5 tahun yang lalu
"BPJS Naik 100 Persen, Anies Sediakan Dana Talangan Rp93 M",https://www.cnnindonesia.com/nasional/20190830183147-20-426224/bpjs-naik-100-persen-anies-sediakan-dana-talangan-rp93-m,Nasional,5 tahun yang lalu
BI Ramal Kenaikan Iuran BPJS Akan Dorong Inflasi,https://www.cnnindonesia.com/ekonomi/20190830144228-532-426120/bi-ramal-kenaikan-iuran-bpjs-akan-dorong-inflasi,Ekonomi,5 tahun yang lalu
Iuran BPJS Masyarakat Miskin Sudah Dinaikkan Agustus Ini,https://www.cnnindonesia.com/ekonomi/20190830194532-78-426259/iuran-bpjs-masyarakat-miskin-sudah-dinaikkan-agustus-ini,Ekonomi,5 tahun yang lalu
VIDEO: Tanggapan Warga Terkait Kenaikan Iuran BPJS Kesehatan,https://www.cnnindonesia.com/tv/20190830184524-407-426236/video-tanggapan-warga-terkait-kenaikan-iuran-bpjs-kesehatan,TV,5 tahun yang lalu
"VIDEO: Iuran Naik, Begini Respon Pasien BPJS",https://www.cnnindonesia.com/tv/20190830184518-407-426235/video-iuran-naik-begini-respon-pasien-bpjs,TV,5 tahun yang lalu
Istana Sebut Aturan Kenaikan Iuran BPJS Tak Kelar 1 September,https://www.cnnindonesia.com/ekonomi/20190830153638-78-426160/istana-sebut-aturan-kenaikan-iuran-bpjs-tak-kelar-1-september,Ekonomi,5 tahun yang lalu
Pengamat: Ada Kemungkinan Data Bocor Jika BPJS Diaudit China,https://www.cnnindonesia.com/teknologi/20190830112830-185-426035/pengamat-ada-kemungkinan-data-bocor-jika-bpjs-diaudit-china,Teknologi,5 tahun yang lalu
VIDEO: Kenaikan 100% Iuran BPJS Kesehatan Tunggu Perpres,https://www.cnnindonesia.com/tv/20190830104009-434-426008/video-kenaikan-100-iuran-bpjs-kesehatan-tunggu-perpres,TV,5 tahun yang lalu
"VIDEO: Iuran Naik, BPJS Kesehatan Membaik?",https://www.cnnindonesia.com/tv/20190829211247-410-425944/video-iuran-naik-bpjs-kesehatan-membaik,TV,5 tahun yang lalu
VIDEO: Iuran BPJS Kesehatan Naik Ramai Jadi Sorotan Publik,https://www.cnnindonesia.com/tv/20190829194451-409-425907/video-iuran-bpjs-kesehatan-naik-ramai-jadi-sorotan-publik,TV,5 tahun yang lalu
Menteri Puan Bantah BPJS Kerja sama dengan Asuransi China,https://www.cnnindonesia.com/ekonomi/20190829172056-78-425841/menteri-puan-bantah-bpjs-kerja-sama-dengan-asuransi-china,Ekonomi,5 tahun yang lalu
Menteri Puan: Iuran BPJS Naik Dua Kali Lipat per 1 September,https://www.cnnindonesia.com/ekonomi/20190829163859-78-425833/menteri-puan-iuran-bpjs-naik-dua-kali-lipat-per-1-september,Ekonomi,5 tahun yang lalu
VIDEO: BPJS Kesehatan Sambut Gembira Usulan Kenaikan Iuran,https://www.cnnindonesia.com/tv/20190829170049-407-425835/video-bpjs-kesehatan-sambut-gembira-usulan-kenaikan-iuran,TV,5 tahun yang lalu
Kemenaker Cari Informasi Penyebab PHK 2.505 Pekerja di Batam,https://www.cnnindonesia.com/ekonomi/20190829121444-92-425692/kemenaker-cari-informasi-penyebab-phk-2505-pekerja-di-batam,Ekonomi,5 tahun yang lalu
"VIDEO: Iuran Naik, Jurus Tekan Defisit BPJS Kesehatan",https://www.cnnindonesia.com/tv/20190828182325-407-425478/video-iuran-naik-jurus-tekan-defisit-bpjs-kesehatan,TV,5 tahun yang lalu
Jokowi Bakal Sahkan Iuran BPJS Naik Dua Kali Lipat,https://www.cnnindonesia.com/ekonomi/20190828175718-78-425455/jokowi-bakal-sahkan-iuran-bpjs-naik-dua-kali-lipat,Ekonomi,5 tahun yang lalu
VIDEO: Menkes Setuju Tarif BPJS Kesehatan Naik Karena Defisit,https://www.cnnindonesia.com/tv/20190828175653-407-425458/video-menkes-setuju-tarif-bpjs-kesehatan-naik-karena-defisit,TV,5 tahun yang lalu
Kominfo Janji Evaluasi Dampak Blokir Internet Papua,https://www.cnnindonesia.com/teknologi/20190828150204-192-425384/kominfo-janji-evaluasi-dampak-blokir-internet-papua,Teknologi,5 tahun yang lalu
Fadli Zon Usulkan BPJS Kesehatan Gratis,https://www.cnnindonesia.com/nasional/20190828140830-20-425362/fadli-zon-usulkan-bpjs-kesehatan-gratis,Nasional,5 tahun yang lalu
BPJS Kesehatan Pelajari Tawaran Bantuan dari Perusahaan China,https://www.cnnindonesia.com/ekonomi/20190828102208-78-425302/bpjs-kesehatan-pelajari-tawaran-bantuan-dari-perusahaan-china,Ekonomi,5 tahun yang lalu
Polling: 63 Persen Pembaca Emoh Iuran BPJS Naik Tinggi,https://www.cnnindonesia.com/ekonomi/20190828093115-78-425275/polling-63-persen-pembaca-emoh-iuran-bpjs-naik-tinggi,Ekonomi,5 tahun yang lalu
"Dilema BPJS Kesehatan, Antara Defisit dan Uluran Tangan Asing",https://www.cnnindonesia.com/ekonomi/20190828072919-78-425268/dilema-bpjs-kesehatan-antara-defisit-dan-uluran-tangan-asing,Ekonomi,5 tahun yang lalu
DPR Tolak Kenaikan Iuran BPJS Kesehatan Hingga Dua Kali Lipat,https://www.cnnindonesia.com/ekonomi/20190827211114-78-425199/dpr-tolak-kenaikan-iuran-bpjs-kesehatan-hingga-dua-kali-lipat,Ekonomi,5 tahun yang lalu
"BPJS Kesehatan Bisa Defisit Rp32,8 T Jika Iuran Tak Naik",https://www.cnnindonesia.com/ekonomi/20190827205233-78-425181/bpjs-kesehatan-bisa-defisit-rp328-t-jika-iuran-tak-naik,Ekonomi,5 tahun yang lalu
Warga Tolak Usulan Kenaikan Iuran BPJS ala Sri Mulyani,https://www.cnnindonesia.com/ekonomi/20190827203255-78-425175/warga-tolak-usulan-kenaikan-iuran-bpjs-ala-sri-mulyani,Ekonomi,5 tahun yang lalu
"Sri Mulyani Amini Suntikan Dana ke BPJS Kesehatan Rp13,56 T",https://www.cnnindonesia.com/ekonomi/20190827185919-78-425134/sri-mulyani-amini-suntikan-dana-ke-bpjs-kesehatan-rp1356-t,Ekonomi,5 tahun yang lalu
Iuran BPJS Kesehatan Rp160 Ribu Ancam Peserta Malas Bayar,https://www.cnnindonesia.com/ekonomi/20190827183820-78-425127/iuran-bpjs-kesehatan-rp160-ribu-ancam-peserta-malas-bayar,Ekonomi,5 tahun yang lalu
"Tolak Asuransi China, Eks Ketum Partai Buruh Surati Jokowi",https://www.cnnindonesia.com/ekonomi/20190827174550-78-425117/tolak-asuransi-china-eks-ketum-partai-buruh-surati-jokowi,Ekonomi,5 tahun yang lalu
Sri Mulyani Usul Iuran BPJS Kesehatan Naik Dua Kali Lipat,https://www.cnnindonesia.com/ekonomi/20190827165107-78-425087/sri-mulyani-usul-iuran-bpjs-kesehatan-naik-dua-kali-lipat,Ekonomi,5 tahun yang lalu
Menengok Fasilitas Kesehatan Ibu Kota Baru di Kalimantan,https://www.cnnindonesia.com/gaya-hidup/20190827120307-255-424948/menengok-fasilitas-kesehatan-ibu-kota-baru-di-kalimantan,Gaya Hidup,5 tahun yang lalu
Gelapkan Papua Berimbas pada Ojek Online dan BPJS di Jayapura,https://www.cnnindonesia.com/teknologi/20190827113227-192-424934/gelapkan-papua-berimbas-pada-ojek-online-dan-bpjs-di-jayapura,Teknologi,5 tahun yang lalu
"Demi BPJS Kesehatan, Sri Mulyani Bantu Perusahaan Farmasi",https://www.cnnindonesia.com/ekonomi/20190827093403-532-424913/demi-bpjs-kesehatan-sri-mulyani-bantu-perusahaan-farmasi,Ekonomi,5 tahun yang lalu
SAFEnet: Penyebaran Hoaks Akan Selalu Temukan Jalan,https://www.cnnindonesia.com/teknologi/20190826203952-185-424819/safenet-penyebaran-hoaks-akan-selalu-temukan-jalan,Teknologi,5 tahun yang lalu
"Bantu BPJS Kesehatan, Asuransi China Disebut Luhut Efisien",https://www.cnnindonesia.com/ekonomi/20190825093653-78-424400/bantu-bpjs-kesehatan-asuransi-china-disebut-luhut-efisien,Ekonomi,5 tahun yang lalu
Rizal Ramli Curigai Tawaran Asuransi China ke BPJS Kesehatan,https://www.cnnindonesia.com/ekonomi/20190824134324-92-424277/rizal-ramli-curigai-tawaran-asuransi-china-ke-bpjs-kesehatan,Ekonomi,5 tahun yang lalu
Luhut Sebut Jokowi Jalin Kedekatan dengan 4 Konglomerat Dunia,https://www.cnnindonesia.com/ekonomi/20190823200402-92-424214/luhut-sebut-jokowi-jalin-kedekatan-dengan-4-konglomerat-dunia,Ekonomi,5 tahun yang lalu
Luhut: Asuransi China Tawarkan Benahi TI BPJS Kesehatan,https://www.cnnindonesia.com/ekonomi/20190823173917-532-424149/luhut-asuransi-china-tawarkan-benahi-ti-bpjs-kesehatan,Ekonomi,5 tahun yang lalu
"Dirut BPJS Kesehatan: Saat Ini, Iuran Tak Sesuai Hitungan",https://www.cnnindonesia.com/ekonomi/20190823161653-78-424125/dirut-bpjs-kesehatan-saat-ini-iuran-tak-sesuai-hitungan,Ekonomi,5 tahun yang lalu
Menkeu Sebut Peserta BPJS yang Ikut Saat Sakit Picu Defisit,https://www.cnnindonesia.com/ekonomi/20190822093527-78-423672/menkeu-sebut-peserta-bpjs-yang-ikut-saat-sakit-picu-defisit,Ekonomi,5 tahun yang lalu
"Defisit BPJS Kesehatan Diramal Bengkak Jadi Rp28,5 T di 2019",https://www.cnnindonesia.com/ekonomi/20190822090846-78-423637/defisit-bpjs-kesehatan-diramal-bengkak-jadi-rp285-t-di-2019,Ekonomi,5 tahun yang lalu
Jokowi Kucurkan Rp166 T 'Cuma' untuk Tambal BPJS 2014-2018,https://www.cnnindonesia.com/ekonomi/20190821203529-532-423571/jokowi-kucurkan-rp166-t-cuma-untuk-tambal-bpjs-2014-2018,Ekonomi,5 tahun yang lalu
Dinkes DKI Ungkap Kronologi Ibu Hamil Dapat Obat Kedaluwarsa,https://www.cnnindonesia.com/nasional/20190821172054-20-423484/dinkes-dki-ungkap-kronologi-ibu-hamil-dapat-obat-kedaluwarsa,Nasional,5 tahun yang lalu
Sri Mulyani Ungkap Dugaan Manipulasi RS ke BPJS Kesehatan,https://www.cnnindonesia.com/ekonomi/20190821164613-532-423476/sri-mulyani-ungkap-dugaan-manipulasi-rs-ke-bpjs-kesehatan,Ekonomi,5 tahun yang lalu
Sri Mulyani Soal BPJS: Saya Bukan Menteri Keuangan Kesehatan,https://www.cnnindonesia.com/ekonomi/20190821152351-78-423419/sri-mulyani-soal-bpjs-saya-bukan-menteri-keuangan-kesehatan,Ekonomi,5 tahun yang lalu
Fahri Hamzah Minta Sri Mulyani Biarkan DPR Atur Uang Sendiri,https://www.cnnindonesia.com/ekonomi/20190821125516-532-423335/fahri-hamzah-minta-sri-mulyani-biarkan-dpr-atur-uang-sendiri,Ekonomi,5 tahun yang lalu
Kalbe Farma Ungkap Tunggakan Obat BPJS Kesehatan Rp200 Miliar,https://www.cnnindonesia.com/ekonomi/20190820151905-92-423058/kalbe-farma-ungkap-tunggakan-obat-bpjs-kesehatan-rp200-miliar,Ekonomi,5 tahun yang lalu
Ibu Hamil Diberi Obat Kedaluwarsa dari Puskesmas Kamal Muara,https://www.cnnindonesia.com/nasional/20190820160716-20-423080/ibu-hamil-diberi-obat-kedaluwarsa-dari-puskesmas-kamal-muara,Nasional,5 tahun yang lalu
Jaminan Sosial Bagi Pengangguran di Era Jokowi Jilid II,https://www.cnnindonesia.com/ekonomi/20190817195450-536-422328/jaminan-sosial-bagi-pengangguran-di-era-jokowi-jilid-ii,Ekonomi,5 tahun yang lalu
Begini Cara Praktis Bayar Iuran BPJS Kesehatan di Traveloka,https://www.cnnindonesia.com/ekonomi/20190815145824-297-421630/begini-cara-praktis-bayar-iuran-bpjs-kesehatan-di-traveloka,Ekonomi,5 tahun yang lalu
Subsidi Kesehatan untuk Masyarakat Miskin Dinaikkan di 2020,https://www.cnnindonesia.com/ekonomi/20190816201051-532-422131/subsidi-kesehatan-untuk-masyarakat-miskin-dinaikkan-di-2020,Ekonomi,5 tahun yang lalu
"Sri Mulyani, Menteri yang Paling Ramai Dibicarakan Netizen",https://www.cnnindonesia.com/teknologi/20190815145149-185-421642/sri-mulyani-menteri-yang-paling-ramai-dibicarakan-netizen,Teknologi,5 tahun yang lalu
Subsidi Pengangguran ala Hanif Dhakiri di Era Jokowi Jilid II,https://www.cnnindonesia.com/ekonomi/20190815085656-532-421489/subsidi-pengangguran-ala-hanif-dhakiri-di-era-jokowi-jilid-ii,Ekonomi,5 tahun yang lalu
KNKS dan BPJS-TK Kerja Sama Kembangkan JKN Syariah,https://www.cnnindonesia.com/ekonomi/20190814214131-78-421453/knks-dan-bpjs-tk-kerja-sama-kembangkan-jkn-syariah,Ekonomi,5 tahun yang lalu
BPJS Kesehatan Raup Hasil Investasi 464 Persen dari Target,https://www.cnnindonesia.com/ekonomi/20190814115215-78-421195/bpjs-kesehatan-raup-hasil-investasi-464-persen-dari-target,Ekonomi,5 tahun yang lalu
Menaker Ingin Pekerja 'Disubsidi' Usai di-PHK,https://www.cnnindonesia.com/ekonomi/20190814132934-92-421234/menaker-ingin-pekerja-disubsidi-usai-di-phk,Ekonomi,5 tahun yang lalu
"BPJS Kesehatan Kantongi Iuran Peserta Rp44,50 T per Juni",https://www.cnnindonesia.com/ekonomi/20190814100330-78-421146/bpjs-kesehatan-kantongi-iuran-peserta-rp4450-t-per-juni,Ekonomi,5 tahun yang lalu
Menyoal 'Gaji' Rp200 Juta Per Bulan Direksi BPJS Plus Bonus,https://www.cnnindonesia.com/ekonomi/20190813205654-78-421064/menyoal-gaji-rp200-juta-per-bulan-direksi-bpjs-plus-bonus,Ekonomi,5 tahun yang lalu
Gerindra Pertanyakan Kenaikan Tunjangan Petinggi BPJS,https://www.cnnindonesia.com/nasional/20190813210413-32-421062/gerindra-pertanyakan-kenaikan-tunjangan-petinggi-bpjs,Nasional,5 tahun yang lalu
DJSN Ramal Kenaikan Iuran Buat BPJS Kesehatan Surplus Rp4 T,https://www.cnnindonesia.com/ekonomi/20190813154815-78-420937/djsn-ramal-kenaikan-iuran-buat-bpjs-kesehatan-surplus-rp4-t,Ekonomi,5 tahun yang lalu
INFOGRAFIS: Usulan Kenaikan Iuran BPJS Kesehatan,https://www.cnnindonesia.com/ekonomi/20190813133604-81-420856/infografis-usulan-kenaikan-iuran-bpjs-kesehatan,Ekonomi,5 tahun yang lalu
Kronologi Sri Mulyani Sempat Tolak Usulan Bonus Direksi BPJS,https://www.cnnindonesia.com/ekonomi/20190813121759-78-420828/kronologi-sri-mulyani-sempat-tolak-usulan-bonus-direksi-bpjs,Ekonomi,5 tahun yang lalu
DJSN Usul Iuran BPJS Kesehatan Naik Hingga Rp40 Ribu,https://www.cnnindonesia.com/ekonomi/20190813110125-78-420804/djsn-usul-iuran-bpjs-kesehatan-naik-hingga-rp40-ribu,Ekonomi,5 tahun yang lalu
Kenaikan Iuran BPJS Kesehatan Berlaku 2020,https://www.cnnindonesia.com/ekonomi/20190812180517-78-420653/kenaikan-iuran-bpjs-kesehatan-berlaku-2020,Ekonomi,5 tahun yang lalu
